#,SupportDemocracyProtesters_0, Підтримати протестувальників,"Чи віримо ми в демократію чи ні? Це не повинно бути складним. Якщо уряд проявляє авторитарні тенденції, і ми вважаємо, що протестуючі мають рацію, тоді ми повинні дотримуватися наших принципів і підтримувати їх, а не мовчати, тому що це заробляє нам гроші на торгових угодах, щоб дивитися в інший бік".,,,,,
#,SupportDemocracyProtesters_1, Не коментувати,"Ми були б обурені, якби зіткнулися з протестуючими на наших вулицях (як це роблять всі демократичні країни), а іноземні лідери почали б відкрито підтримувати протестувальників проти нашого уряду. Було б жахливо для наших дипломатичних відносин з цим торговим партнером, якби ми стали на бік відносно невеликої кількості протестуючих на вулицях".,,,,,,,,
#,SurgicalStrikes!, Хірургічні удари!,"Терористи на Близькому Сході почали атакувати життєво важливі трубопроводи, що належать нашим компаніям і які побічно забезпечують нас паливом. Щоб захистити наші поставки нафти, армія хотіла б почати точкові удари по ретельно відібраним цілям".,,,,,,,,,
#,SurgicalStrikes!_0, Наказати нанести хірургічні удари,"Тероризм є реальною загрозою, а зростаючі ціни на нафту обмежують економічне зростання. У нас є засоби для зриву терористичних операцій, не піддаючи ризику життя наших солдатів. Ми повинні завдати удару зараз і не дати цим терористам взяти верх".,,,,,,,,,
#,SurgicalStrikes!_1, Не вступатиПроблеми в цьому районі мають економічні та соціальні причини, які не можна вирішити бомбардуваннями лідерів терористів. Наземна війна та подальше відновлення є більш дорогим, але набагато ефективнішим способом вирішення проблем цього регіону".,,,,,,,,,,
#,TestBanTreaty,ій договір про заборону ядерних випробувань,"Організація Об'єднаних Націй наполягає на тому, щоб ваша країна підписала договір, який заборонив би нам проводити будь-які випробування ядерної зброї в дослідницьких цілях. Багато інших країн вже підписали договір і чинять на нас тиск, щоб ми підписали його по дипломатичних каналах".,,,,,,,,
#,TestBanTreaty_0, Підписати договір,"У нас немає реальної необхідності проводити подальші випробування, це не означає, що зброя нинішнього покоління не працює або недостатньо потужна. Підписання договору порадує учасників екологічних кампаній і підвищить нашу популярність на міжнародній арені".,,,,,,,,,
#,TestBanTreaty_1, Не підписувати договір,"Життєво важливо, щоб ми зберегли за собою право проводити обмежене тестування. Ми живемо в небезпечному світі, і наші засоби ядерного стримування є життєво важливими для нашої оборони. Не справа іншим націям вказувати нам, як захищатися. Крім того, необхідні випробування, щоб переконатися, що наша зброя все ще придатна для використання".,,,,,
#,TortureDeportation, Депортація із застосуванням тортур,"Співробітники поліції заарештували шахрая, який незаконно перебуває в нашій країні. За звичайних обставин він мав би право депортувати назад до країни походження. Чоловік стверджує, що якщо його відправлять назад на батьківщину, то, швидше за все, уряд піддасть його тортурам.",,,,,,
#,TortureDeportation_0, Депортувати його,"Цій людині нема кого звинувачувати в своїй ситуації, крім самого себе. Він прибув сюди нелегально і з тих пір, як потрапив сюди, діяв як злочинець. Якби він попросив політичного притулку, коли приїхав, а не розпочав злочинне життя, це була б інша справа. У сформованих обставинах ми повинні поставитися до його заяв про погрози тортурами з усією серйозністю".,,,,,
#,TortureDeportation_1,Тримайте його тут,"Ясно, що цю людину навряд чи можна назвати зразковим громадянином, але жоден шахрай, який користується довірою, не заслуговує тортур. Якщо ми дійсно принципово виступаємо проти застосування тортур, то, незважаючи на історію цієї людини, нам потрібно переконатися, що ми не хочемо піддавати його тортурам, відправляючи його назад додому. Якщо ми депортуємо його, це насправді може бути смертним вироком".,
#,ToxicWasteDump, Звалище токсичних відходів,"Було висунуто пропозицію про будівництво великого звалища токсичних відходів в нашій країні. Цей об'єкт буде дуже великим, потенційно створюючи багато робочих місць при його будівництві, але є побоювання з приводу його впливу на навколишнє середовище".,,,,,,,,,
#,ToxicWasteDump_0, Дозволити звалище,"Ніхто точно не хоче, щоб токсичні відходи були у них на задньому дворі, але ми були б дурнями, якби відмовилися від економічної вигоди від створення цього об'єкта, не кажучи вже про потенційні робочі місця. Крім того, ми можемо розмістити звалище в сільській місцевості, де потрібні робочі місця і ризики невеликі".,,,,,
#,ToxicWasteDump_1, Запобігти будівництву,"Не має значення, скільки робочих місць і скільки грошей задіяно, ми не можемо просто здавати нашу країну в оренду як сміттєву яму для інших країн. Наслідки цих токсичних відходів можуть зберігатися поколіннями, чи справді це спадщина, яку ми хочемо залишити своїм дітям?",,,,,,,
#,TradeAgreement, Торговельна угода,"Група західних країн виступила з ініціативою про укладення нової торговельної угоди, що регулює тарифи, квоти та інші торговельні обмеження. Цей контракт повинен допомогти запобігти надолуженню втраченого країнами, що розвиваються, і забезпечити світове економічне домінування за рахунок глобальної рівності".,,,,,,,
#,TradeAgreement_0, Підписати угоду,"Наша економіка знаходиться під тиском нових гравців на світовому ринку. Ми повинні встановити тісніші зв'язки зі старими друзями, щоб вийти переможцями в цьому новому ворожому економічному середовищі".,,,,,,,,,,
#,TradeAgreement_1, Відмовитися підписувати угоду,"Ця угода підтримала б нашу економіку за рахунок глобальної справедливості. Зараз не час думати тільки про себе, а й вітати нових гравців на світовому театрі з розпростертими обіймами".,,,,,,,,,,
#,TransgenderMilitaryBan, Військова заборона для трансгендерів,"Тепер у нас є наш перший відкрито трансгендерний військовослужбовець, який проходить військову службу. На жаль, ці солдати стали центром жорстокої культурної війни між агітаційними групами, які просять вас схвалити або заборонити трансгендерам служити у Збройних силах".,,,,,,,,
#,TransgenderMilitaryBan_0, Заборонити трансгендерним солдатам,"Якщо є які-небудь побоювання на будь-якому рівні, що це вплине на ефективність або безпеку наших військ, то це на першому місці. Це не арена для заробляння дешевих політичних очок. Патріотично налаштовані трансгендерні громадяни можуть служити в армії, але не на передовій".,,,,,,,,
#,TransgenderMilitaryBan_1, Підтримувати трансгендерних солдатів,"Що дійсно важливо в солдаті, так це його професіоналізм, відданість і патріотизм. Ідея про те, що трансгендерні солдати-це погана ідея, смішна. Ми повинні відкрито схвалювати і підтримувати всі наші війська, незалежно від статі".,,,,,,
#,TRAVELLERS RIGHTS, Мандрівники Права,"Місцева рада нещодавно знесла кілька старих занедбаних будинків, залишивши порожню землю для мандрівників, на якій вони могли б паркувати свої фургони, місцеві жителі розлючені і хочуть, щоб їх переселили, Рада не впевнена, якими правами володіють ці люди, і звернулася до уряду з проханням пояснити національну політику".,,,,
#,TRAVELLERS RIGHTS_0, Дозволити мандрівникам залишитися,"Кожен має право десь жити, в тому числі і ці мандрівники. Немає доказів того, що вони створюють проблеми, це просто випадок, коли люди не розуміють способу життя подорожуючих людей".,,,,,,,
#,TRAVELLERS RIGHTS_1, Виселити мандрівників,"Ви повинні підтримати місцевих жителів. Ці мандрівники вторглися на приватну територію і засмутили місцеві сім'ї. Це неприйнятно. Ви не можете дозволити невеликій групі людей викликати такі руйнування в мирних громадах".,,,,,,,,,,,
#,ViolentVideoGames, Відеоігри із застосуванням насильства,"У пресі висловлювалися побоювання з приводу впливу жорстоких відеоігор на молодь країн. Деякі з цих ігор описуються як" симулятори вбивств", і були висловлені припущення про зв'язок між іграми та насильницькими злочинами. є пропозиція заборонити деякі ігри і обмежити продаж інших особам старше 18 років".,,,,,,,,,,
#,ViolentVideoGames_0, Залишити без змін,"Існує мало переконливих доказів, які вказують на будь-який реальний прямий зв'язок між відеоіграми та насильством. Насправді, є ймовірність, що вони діють як катарсис, який навіть запобігає схильності молодих людей до насильства. Це спонтанна реакція людей, які шукають простого вирішення проблеми насильства в суспільстві, насильства, яке існувало задовго до створення першої відеоігри ".,,,,
#,ViolentVideoGames_1, Піддати цензурі гри,"Можливо, прямого доведеного зв'язку і немає, але вам не обов'язково грати в багато з цих ігор, щоб побачити, як вплив, який вони мають на вразливих молодих людей, має негативно позначатися на суспільстві. Відеоігри є інтерактивним середовищем і, ймовірно, матимуть набагато більш безпосередній вплив на вразливі розуми, ніж пасивні розваги, такі як книги, телебачення чи фільми. Потрібно щось робити".
#,ViolentVideoGames_2, Додати попереджувальні написи,"Заборона-це крок занадто далеко, але важливо, щоб батьки мали необхідну інформацію, щоб вони могли судити про те, наскільки конкретна гра підходить для їхніх дітей. Системи попередження вмісту на коробці або веб-сайтах, що продають ігри, має бути достатньо".,,,,,
#,Whaling, Китобійний промисел,"На розгляді уряду знаходиться Резолюція, що пропонує відновити дрібномасштабний Комерційний китобійний промисел в наших водах. Китове м'ясо є цінним місцевим делікатесом, і комерційний промисел китобоїв створив би багато робочих місць".,,,,,,,,,
#,Whaling_0, Відновити китобійний промисел,"Кити споживають величезну кількість риби і можуть бути відповідальними за зменшення вилову риби, що впливає на нашу економіку. Китобійний промисел також дав би бажаний поштовх нашій економіці. Не всі види китів знаходяться під загрозою зникнення, і комерційний китобійний промисел може продовжуватися без небезпеки вимирання".,,,,,,,,,
#,Whaling_1, Зберегти заборону в силі,"Загальновизнано, що кити є одними з найрозумніших нелюдських видів на землі, вони займають важливе положення у водному харчовому ланцюзі, і все ж на них полюють, і вони близькі до вимирання. Відновлення комерційного китобійного промислу було б неймовірно руйнівним, а також потенційно призвело б до падіння туризму. Нам слід переорієнтувати наші зусилля на спостереження за китами, а не на полювання".,,,,,
#,Whistleblower, Інформатор,"Співробітник секретної служби опублікував кілька документів, які проливають світло на темну сторону війни з терором. Чи повинні ми переслідувати її в судовому порядку і зробити все можливе, щоб притягнути до відповідальності, або нам слід реформувати секретну службу і припинити використовувати зловживання, в яких вона нас звинувачує?",,,,,,,
#,Whistleblower_0, Переслідувати в судовому порядку!"Навіть якщо звинувачення, з якими ми стикаємося, вірні, ми повинні захищати національні інтереси. Громадськість може не розуміти, чому ми повинні покладатися на ці методи у війні з тероризмом, але мета виправдовує засоби".,,,,,,,
#,Whistleblower_1, Реформувати секретну службу!,"Практика, оприлюднена Стейсі Уокер, дійсно негідна розвиненій нації. Ми повинні утриматися від подібних методів у майбутньому і подякувати Стейсі Уокер за демонстрацію того, що громадянська мужність все ще існує".,,,,,,,,
#,WhitewashSchoolHistoryBooks,Переписати Шкільні підручники історії,"Багато підручників, які використовуються на шкільних уроках історії, застаріли і відображають дещо Великодушний погляд на минуле наших країн і їх досягнення. Учасники кампанії пропонують внести серйозні зміни в те, як дітей навчають нашій історії, щоб оцінити наше минуле з сучасної точки зору".,,,,,,,
#,WhitewashSchoolHistoryBooks_0, Переписати підручники,"Просто шокує, наскільки упереджені застарілі підручники в наших школах. Судячи з цих книг, наша історія підозріло чоловіча, расово чиста і бездоганна, тоді як ми знаємо, що реальна картина зовсім інша. Ми не можемо продовжувати відбілювати свою історію та навчати дітей речам, які, як ми знаємо, не відповідають дійсності".,,,
#,WhitewashSchoolHistoryBooks_1, Залишити підручники в спокої,",Це просто вина лібералів середнього класу, які намагаються переписати історію. Ви не можете судити про великих державних діячів і воєначальників нашого минулого через призму сучасного мислення. Тоді суспільство було іншим, і їхня поведінка на той час була цілком прийнятною. Що за уряд переписує нашу горду історію?",,,,,,,,
#,USAOilPipeline, Схвалити новий нафтопровід,"Запропонований трубопровід, який з'єднає великі нафтові піски в Канаді з нафтопереробними заводами в Іллінойсі та Техасі, вимагає схвалення федерального уряду. Трубопровід викликає суперечки, оскільки він збільшив би видобуток нафти і прискорив зміну клімату, а також тому, що він перетинав би території ряду індіанських племен".,,,,,,
#,USAOilPipeline_0, Схвалити трубопровід,"Жоден великий інфраструктурний проект ніколи не був би схвалений, якби уряд поступався кожному протесту. Подобається нам це чи ні, але наша економіка потребує викопного палива, і є докази того, що такий розвиток подій призведе до зниження цін на нафту, а також до економічного зростання. Що може бути важливіше? Економіка? або думка відносно невеликої групи закоренілих захисників навколишнього середовища?",,,,,,
#,USAOilPipeline_1, Скасувати трубопровід,"Чи дійсно є виправдання для збільшення споживання викопного палива прямо зараз? Ми повинні інвестувати у відновлювані джерела енергії, а не видобувати більше нафти. Крім того, яке право ми маємо руйнувати священні землі корінних племен просто для того, щоб зробити транспортування канадської нафти більш ефективним?",,,,,,,,
#,GermanyDieselgate, Скандал з викидами дизельногопалива,"Розгорівся скандал, який свідчить про те, що багато хто з найбільших і найпрестижніших автомобільних компаній в нашій країні нахабно брехали про викиди своїх дизельних автомобілів, використовуючи навмисну і дуже прибуткову схему обману офіційних тестів. Як поліція повинна вести цю неймовірно гучну справу?",,,,,,,,
#,GermanyDieselgate_0, применшити важливість справи,"Ця справа роздувається до межі. Можуть бути виписані штрафи, а автомобілі можуть бути повторно протестовані і їм можуть бути присвоєні переглянуті показники викидів. Кілька надмірно захоплених інженерів занадто сильно порушили правила, але навряд чи в цьому є щось нове".,,,,,,,,,
#,GermanyDieselgate_1, Посадити у в'язницю керівників," якщо це можливо"Тут не може бути жодних сумнівів у тому, що люди на самому верху цих компаній точно знали, що відбувається, і нам повинно бути на 100% ясно, що тут, в Німеччині, закон застосовується в рівній мірі до всіх. Це не буде популярним серед власників бізнесу, але щоб зберегти нашу міжнародну репутацію, ми повинні навести приклад таких шахрайств".,,,
