#,IncreasedSchoolInspections, Збільшити кількість перевірок шкіл,"Є побоювання, що шкільні стандарти знижуються і що існуючий режим перевірки методів викладання і шкіл недостатній. Учасники кампанії пропонують посилити систему з набагато частішими перевірками".,,,,,,,,,,
#,IncreasedSchoolInspections_0, Посилити перевірки,"Освіта - така ж послуга, як і будь-яка інша, і дуже важливо, щоб батьки знали, що вони отримують за свої гроші або податки. Порядним вчителям нема чого боятися додаткової перевірки. Який батько виступив би проти посилення контролю за тим, як їхні діти отримують освіту?",,,,,,
#,IncreasedSchoolInspections_1, Підтримувати поточну систему,"Навчання дітей і так досить складне, до того ж воно погано оплачується і здійснюється відданими своїй справі професіоналами. Ця пропозиція просто породила б додаткову бюрократію і забрала б більше часу від фактичного викладання. Образливо вважати, що віддані працівники Державної служби, такі як вчителі, потребують подальшого вивчення".,,,,,,,
#,InternetTracking, Відстеження в Інтернеті,"Зростаюча здатність великих корпорацій використовувати бази даних клієнтів та" великі дані " для аналізу поведінки споживачів призвела до занепокоєння щодо конфіденційності. Компанії наполягають на тому, що такі дані в багатьох випадках анонімні і використовуються виключно для надання кращого сервісу, в той час як учасники кампанії припускають, що великі безликі корпорації створюють бази даних споживачів в стилі "Великого брата" без їхньої згоди".,,,,,,,,
#,InternetTracking_0, Заборонити відстеження,"Така поведінка є не що інше, як моторошна, а також створює потенційний ризик крадіжки особистих даних для споживачів. Всі ці роки компанії досить добре справлялися без відстеження та зберігання інформації про кожне окреме рішення, яке приймає клієнт, і можуть легко обійтися без цього. Люди мають право купувати речі, не піддаючись ефективному відстеженню цифрових шпигунів, куди б вони не пішли".,,,,,
#,InternetTracking_1, Дозволити відстеження,"Противники інтернет-стеження кажуть, що це звучить набагато зловісніше, ніж є насправді. Все, про що ми говоримо, - це надання компаніям можливості записувати точну інформацію про переваги споживачів, щоб вони могли виробляти кращі продукти та ефективно націлювати свою рекламу, що є нешкідливим, а також необхідним для сучасної економіки. Тут немає реального заклику до уряду втрутитися".,,,,
#,InternetTracking_2, Попереджати користувачів,"Заборона відстеження заходить занадто далеко, але важливо, щоб громадяни знали, коли за ними стежать. може бути, система зручних спливаючих вікон при відвідуванні веб - сайту, які повідомляють людям, що за ними стежать, - найкраще рішення для всіх?",,,,
#,KeepRuralBanks, Зберегти сільські банки,"У міру того як все більше людей переходять на Телефонний або Інтернет-банкінг, великі банки закривають невеликі сільські відділення. Багато людей похилого віку в сільських громадах все ще користуються цими відділеннями, і учасники кампанії хочуть, щоб уряд змусив ці сільські банки залишатися відкритими".,,,,,,,,
#,KeepRuralBanks_0, Змусити банки залишатися відкритими,"Молодим людям відділення банків можуть здатися зайвими, але багато людей похилого віку насправді вважають за краще користуватися своїми місцевими банками, які також є життєво важливою частиною сільських громад. Закриття місцевих банків стане важким ударом для невеликих громад, і його краще уникати".,,,,,,,,
#,KeepRuralBanks_1, Дозволити банкам закриватися,"Зараз не 1900-ті роки! Ідея про те, що в епоху Інтернету нам все ще потрібні фізичні банки, є смішною. Рано чи пізно всім нашим громадянам буде зручно користуватися Інтернетом. Крім того, чи дійсно справедливо по відношенню до акціонерів банків якимось чином змушувати їх тримати відкритими збиткові відділення?",,,,,,,,
#,Laborday, Святкування Дня праці,"Плануються святкові заходи з нагоди наступного Дня праці. Традиційно ви виступаєте з промовою перед профспілками, але іноземні інвестори також запросили вас на церемонію відкриття нового промислового комплексу, який зміцнить економіку регіону і створить багато робочих місць з низьким доходом".,,,,,,,,,
#,Laborday_0, Провести виступ перед профспілками,"День праці-це день робітничого класу і його профспілок, виступати перед ними з промовою - традиція і велика честь. Працівники стикаються з багатьма проблемами в ці небезпечні часи, і уряд повинен запевнити їх, що ми на їхньому боці і збереження їх робочих місць є головним пріоритетом".,,,,,,,,
#,Laborday_1, Приєднуйтесь до іноземних інвесторів,"Хоча, безумовно, важливо враховувати потреби профспілок, також важливо створювати більше робочих місць, і ключем до цього є іноземні інвестори. Приєднання до них продемонструє нашу вдячність і заохотить їх та інші країни інвестувати сюди більше. Наступного року ми знову вступимо до профспілок".,,,,,,,
#,LayWreathForGeneral, Покладіть вінок для генерала,"Помер один з наших найдовше служили військових генералів, і ви повинні вирішити, чи покладати вінок на його похорон. Генерал, безумовно, був військовим героєм, але до кінця своєї кар'єри його переслідували звинувачення в расизмі, мізогінії та знущаннях".,,,,,
#,LayWreathForGeneral_0, Покладіть вінок,"Віддаючи шану цій людині на його похоронах, ми не виправдовуємо того, ким він став пізніше в житті, а просто віддаємо шану людині, яка явно була готова ризикнути своїм життям заради своєї країни. Не покласти вінок було б дешевою демонстрацією чесноти, яка образить наші війська і зганьбить форму, яку вони носять".,,,,,
#,LayWreathForGeneral_1, Не кладіть вінок,"Поведінка цієї людини в більш пізній період його життя не може бути виправдано, незалежно від того, що він робив у своїй кар'єрі. Бути поміченим в явному шануванні того, хто поводився так погано, просто свідчить про презирство до етнічних меншин, жінок і тих, кого він переслідував і знущався. Ми не повинні бути помічені в підтримці такої поведінки".,,,,,
#,LGBTLessonsInSchool,Уроки ЛГБТ в школі,"Статеве виховання в школі-це завжди політичний футбол, і тепер воно знову в грі, оскільки питання інформування дітей про існування одностатевих пар і відносинах потрапив в Новини. Ви повинні зайняти певну позицію щодо того, підтримувати чи не підтримувати ЛГБТ-тематику на шкільних уроках".,,,,,,,,
#,LGBTLessonsInSchool_0,Підтримуємо викладання ЛГБТ,"Вся суть школи полягає в тому, щоб навчати та готувати дітей до реального світу, і очевидно, що одностатеві стосунки є частиною суспільства. Уявіть собі точку зору дитини, яка ставить під сумнів власну сексуальність. Звичайно, для них найкраще дізнатися правду від шкільних вчителів без тиску з боку релігійних лідерів або батьків з екстремістськими поглядами?",,,,,,
#,LGBTLessonsInSchool_1,Виступаємо проти викладання ЛГБТ,"Хіба діти недостатньо приголомшені і розгублені в питаннях сексу і взаємин без того, щоб ми привносили в цю справу екстремально ліберальну пропаганду про гендерну плинність? Школа-це не те місце, де можна потрапити в ці проблеми, і в будь-якому випадку школярі занадто молоді, щоб ставити під сумнів свою стать".,,,,,,,
#,Merger,Злиття,"Велика інтернет-компанія оголосила про плани викупити одного зі своїх основних конкурентів. Це злиття потребує схвалення уряду, але якщо воно відбудеться, то буде створена одна з найбільших компаній в країні".,,,,,,,,,
#,Merger_0, Дозволити злиття,"Немає ніяких вагомих причин перешкоджати цьому злиттю. На зростаючому глобальному ринку нашим компаніям потрібно зростати, якщо вони хочуть успішно конкурувати. Більша компанія буде більш ефективною на світовому ринку".,,,,,,,,,,
#,Merger_1, Заблокувати злиття,"Вся ідея вільного ринку заснована на конкуренції. Дозвіл цим двом фірмам об'єднатися зменшить як конкуренцію, так і вибір споживачів і, без сумніву, призведе до звільнень. Це ще один приклад того, як уряд піклується про великий бізнес і забуває про маленького хлопця. Представники малого бізнесу та профспілок закликають вас заблокувати це злиття".,,,,,,,
#,OilDrilling, Можливість буріння нафтових свердловин,"Нафтові компанії прагнуть отримати дозвіл на буріння нафтових свердловин в тій частині країни, яка охороняється як Заповідник дикої природи. Запаси нафти під притулком значні, але буріння матиме негативний вплив на навколишнє середовище".,,,,,,,,,
#,OilDrilling_0, Дозволити буріння,"Прямо тут, на нашій землі, знаходяться буквально мільярди барелів нафти, і чинний закон не дозволяє нам видобувати її. Натомість ми імпортуємо нафту з інших країн. Вплив на навколишнє середовище буде мінімальним, якщо врахувати вигоди, які дає буріння з точки зору енергетичної безпеки. Ніхто не хоче псувати навколишнє середовище, але альтернативою є залежність від іноземної нафти".,,,,,
#,OilDrilling_1, Запобігти буріння,"Цей цінний заповідник дикої природи був би спустошений в результаті розвідки нафти. Це один з найбільших національних скарбів нашої країни, і було б злочином знищити його лише для того, щоб збільшити внутрішній видобуток нафти. Буріння в цій частині країни не повністю усуне нашу залежність від іноземної нафти, але це зіпсує наше природне середовище для майбутніх поколінь".,,,,,,,,
#,PeopleSmuggling, Контрабанда людей,"Велика кількість людей було спіймано при в'їзді в нашу країну прихованими всередині вантажних контейнерів в ході організованої спроби контрабанди людей. Злочинці, які керували цією схемою, були заарештовані, але ведуться суперечки про те, чи слід відправляти тих людей, які зараз знаходяться на наших берегах, назад в країну їх походження".,,,,,
#,PeopleSmuggling_0, Дозволити їм залишитися,"Є переконливі докази того, що ці люди відчайдушно намагалися врятуватися від переслідувань, злиднів або навіть смерті у своїй власній країні. Це відчайдушні люди, як ми бачимо з того, на що вони пішли, щоб потрапити сюди. Було б нелюдяно депортувати їх зараз, коли вони тут".,,,,,
#,PeopleSmuggling_1, Депортувати їх,"Дозволити цим людям залишитися-значить послати абсолютно невірний сигнал людям, які хочуть приїхати сюди нелегально. У нас і так достатньо проблем з нелегальними економічними мігрантами. Як би прикро це не було, єдиний розумний вибір - відправити їх назад.",,,,,,,,,
#,POSITIVE DISCRIMINATION, Позитивна дискримінація,"Лунають заклики до прийняття закону, прямо встановлює квоти на працевлаштування етнічних та інших меншин великими корпораціями і урядовими установами. Це чинить тиск на компанії, щоб вони надавали вищий пріоритет деяким кандидатам на роботу, ніж іншим, залежно від їх раси, статі чи віку".,,,,,,
#,POSITIVE DISCRIMINATION_0, Прийняти закон,"Нам потрібен цей закон. З економічної точки зору немає ніякого сенсу в тому, щоб люди молодше або старше певного віку ставали непрацездатними. Крім того, з точки зору прав людини, це вкрай необхідна компенсація за роки дискримінації на робочому місці щодо етнічних меншин, жінок, людей похилого віку та інвалідів".,,,,,,
#,POSITIVE DISCRIMINATION_1, Відхилити закон,"Це глибоко помилковий закон. Немає сенсу боротися з дискримінацією за допомогою дискримінації. Це створює дві проблеми: проблему меншин, які вважають, що вони, можливо, не досягли цієї посади за заслугами, і обурення потенційного працівника, якому було відмовлено в роботі".,,,,,
#,Powerlines, Лінії електропередач,"Розгнівані громадяни протестують проти проекту будівництва ліній електропередач через їхні села. Ці лінії електропередач необхідні для подальшого розширення використання відновлюваних джерел енергії. Відмова від їх будівництва призведе до економічного спаду, але якщо ви проігноруєте громадян, це зробить їх ще більш злими та підтримуючими їхню справу".,,,,,,,,,
#,Powerlines_0, Все одно будувати лінії електропередач,"Ніхто не хоче, щоб лінії електропередач проходили поруч з їхніми будинками, але їх потрібно десь будувати. І до недавнього часу ці люди вимагали більше чистої енергії. Лінії електропередач будуть побудовані".,,,,,,,,,
#,Powerlines_1, Зупинити будівництво,"Є альтернативні способи дослідження, наприклад, підземні лінії електропередач. І є заяви про те, що здоров'я тих, хто живе поблизу ліній електропередач, може бути в небезпеці. Краще перестрахуватися, ніж потім шкодувати".,,,,,
#,PublicLandLaw, Закон Про державну землю,"Більша частина нашої країни все ще перебуває у приватній власності, і доступ до неї обмежений землевласниками. Ведеться активна кампанія з прийняття законів, що зобов'язують землевласників зробити свою землю доступною для бродяг і піших прогулянок, щоб вони могли насолоджуватися сільською місцевістю в рамках певних правил ".,,,,,,,,
#,PublicLandLaw_0,Заблокувати цей закон,"Приватна земля є приватна земля. Це сама основа приватної власності та капіталізму. Якщо власники хочуть обмежити доступ до своєї землі, це повністю залежить від них. Це не що інше, як тонко замаскована спроба класової війни незадоволених соціалістів".,,,,,,,,,
#,PublicLandLaw_1, Підтримати закон,"Божевільно мати стільки відкритої та часто абсолютно невикористаної землі в приватних руках, тоді як наші міста настільки перенаселені. Цей закон дозволить усім громадянам насолоджуватися красою нашої сільської місцевості, зберігаючи при цьому остаточні права власності та привілеї землевласника. Це хороший компроміс".,,,,,,,,,
#,PublicRightsOfWay, Розширити права громадян на проїзд,"Оскільки ми будуємо все більше будинків у нашій країні, колись відкрита земля, якою користувалися пішоходи та хайкери, все частіше стає закритою та вважається приватною власністю. Активісти соціалістичної кампанії протестували проти цих змін і закликають до розширення захищених "громадських прав на проїзд".",,,,,,,,
#,PublicRightsOfWay_0, Не вживати ніяких дій,"Приватна земля є приватна земля, незалежно від того, чи є це сільськогосподарськими угіддями, промисловими угіддями або чиїмось садом або двором! Ідея про те, що через те, що люди роками йшли певним шляхом, вони повинні продовжувати мати право вторгнутися в приватну власність, є смішною. є багато доріг загального користування та парків, якими люди можуть користуватися".,,,
#,PublicRightsOfWay_1, Розширити права на проїзд,"Так багато території нашої країни зараз перебуває у приватній власності, що доступ людей до відкритої сільської місцевості зухвало обмежений. Чи дійсно для фермера має значення, якщо кілька пішоходів час від часу перетинають його ділянку по спеціально відведеній пішохідній доріжці? Ми повинні забезпечити, щоб відкрита місцевість і пішохідні доріжки були легкодоступні для всіх".,,,,,,,,
#,PUBLIC SMOKING BAN, Заборона на куріння в громадських,"Існує ряд передбачуваних зв'язків між курінням і поганим здоров'ям. Групи тиску закликали заборонити куріння в громадських місцях як заохочення курців кинути палити.",,,,,,,,,,,
