#,Adoption, Поодинокі усиновлення,"Самотнім людям в даний час важко усиновити дитину в нашій країні. У минулому батькам-одиначкам було важко, але в наші дні їм стало легше поєднувати народження дитини і кар'єру одночасно. Тому для тих, хто хоче дитину, але не може знайти або не хоче мати партнера, усиновлення має бути спрощено".,,,,,,,
#,Adoption_0, Змінити вимог,и"Одинаки заслуговують тих же прав, що і сімейні пари, на усиновлення дитини. Полегшіть вимоги до усиновлення одинаками, забезпечивши денний догляд і гнучкий графік роботи, у одинаків теж повинна бути можливість ростити і любити дитину".,,,,,,,
#,Adoption_1, Зберегти вимоги,"Усиновленим дітям потрібен стабільний будинок і двоє батьків. Хоча деякі батьки-одиначки можуть впоратися з вихованням дитини самостійно, вони часто потрапляють у біду, яка завдасть ще більшої шкоди прийомній дитині".,,,,,,,,,
#,AgeBasedDrivingTests, Тести з водіння з урахуванням віку,"Є пропозиція запровадити регулярні іспити з перепідготовки водіїв для людей похилого віку, щоб переконатися, що вони все ще є безпечними водіями. Вважається, що це питання безпеки для зменшення кількості дорожньо-транспортних пригод".,,,,,,,,
#,AgeBasedDrivingTests_0, Ввести тести,"Це факт життя, що з часом зір людей погіршується, час їх реакції збільшується, і багато літніх водіїв можуть просто становити небезпеку для інших учасників дорожнього руху, особливо маленьких дітей. Старші водії можуть чинити опір цьому, але для загальної безпеки це необхідно зробити. Тим людям, які все ще є безпечними водіями, нема чого боятися".,,,,
#,AgeBasedDrivingTests_1, Зберегти єдиний тест,"Чесно кажучи, старші водії є найменшою з наших проблем, коли справа доходить до дорожньо - транспортних пригод. Водії старшого віку менш схильні до безвідповідального ставлення до алкоголю або наркотиків і водіння автомобіля, і у них значно більше досвіду. Це образа для людей похилого віку, щоб змусити їх довести, що вони все ще можуть керувати автомобілем. У нас вже є поліція і камери для виявлення людей, які поводяться безвідповідально".,,,,,
#,Airport, Підключення до аеропорту,"У столиці планується побудувати новий аеропорт, розташований далеко від центру міста. Що слід використовувати як основне з'єднання аеропорту та центру міста?",,,,,,,,,,
#,Airport_0, Автомобіль,"Громадський транспорт-це все добре, але ми знаємо, що люди зазвичай вважають за краще керувати автомобілем. Давайте побудуємо нову дорогу, що з'єднує аеропорт з центром міста. Люди, які не їздять, завжди можуть найняти таксі, щоб дістатися до аеропорту.",,,,,
#,Airport_1, Автобус,"Сам аеропорт вже є основною причиною забруднення навколишнього середовища, і шум тут такий же жахливий. Давайте не погіршуватимемо ситуацію і скористаємося добре спланованою автобусною системою, це буде ефективно, з низьким рівнем забруднення навколишнього середовища і заторами".,,,,,,,,
#,AirportExpansion, Розширення аеропортуБуло, запропоновано дозвіл на будівництво для розширення деяких найбільших аеропортів нашої країни, Тут просто не вистачає місткості для такої кількості рейсів, які хочуть приземлитися тут".,,,,,,,,,,,
#,AirportExpansion_0, Дозволити плани розширення,,"Наша туристична індустрія дуже залежить від авіаперельотів, і якщо ми хочемо розширити туризм, забезпечити більше робочих місць і зростання ВВП, Ми повинні збільшити пропускну здатність повітряних суден. Нам потрібно діяти зараз, щоб забезпечити своєчасне нарощування потужностей".,,,,,,
#,AirportExpansion_1, Відхилити плани,"Авіаперельоти-це кошмар із забрудненням навколишнього середовища, проблеми викликають як забруднення повітря, так і шумове забруднення, ми не повинні заохочувати авіаперельоти. Крім того, ці плани означали б знесення незліченних будинків і величезні незручності для людей, які живуть поблизу аеропортів. Відмовтеся від своїх планів!",,,,,,
#,AirportExpansion_2, Відкласти прийняття рішення,"Це важке рішення, але, чесно кажучи, не з тих, які ми повинні приймати в цьому році. це може здатися трохи нерішучим, але ми можемо просто відкласти це на деякий час. Можливо, навіть до наступних виборів?",,,,,
#,AllowForeignFightersToReturn, Дозволити іноземним бойовикам повернутися,"Деякі з наших релігійних громадян покинули нашу країну, щоб брати участь у релігійній війні за кордоном, війні, яка багато в чому загрожувала нашим інтересам і безпеці. Ці бойові дії тепер закінчилися, і бійці висловили жаль про свої дії і бажання повернутися додому".,,,,,,,
#,AllowForeignFightersToReturn_0, Перешкоджати поверненню бойовиків,"Коли наші громадяни залишають цю країну, щоб битися пліч-о-пліч з нашими ворогами за кордоном, вони втрачають будь-які претензії на громадянство і будь-яке право жити тут. Ні в якому разі їм не слід дозволяти повертатися, навіть для того, щоб їх судили. Це було б образою для наших солдатів і служб безпеки".,,,,,,,
#,AllowForeignFightersToReturn_1, Дозволити бійцям повернутися,"Це важкий принцип для захисту, але ми повинні визнати, що наші громадяни залишаються нашими громадянами, навіть коли вони вчиняють злочини за кордоном або, в даному випадку, навіть піднімають зброю проти нас. Неодмінно притягніть їх до відповідальності за їхні дії, але ми не можемо відмовити їм у громадянстві, оскільки вважаємо це незручним".,,,,
#,AppointAmbassador, Призначити посла ООН,"Наш посол в ООН йде у відставку в цьому році, і нам потрібно якомога швидше призначити наступника. Багато чого буде залежати від того, чи призначимо ми прихильника жорсткої лінії, який встане на захист країни, або когось більш здатного до компромісу".,,,,,,,
#,AppointAmbassador_0, Призначити Тоню Робінсон,"Тоня Робінсон добре відома як патріотка, яка буде боротися зубами і кігтями за те, щоб наші інтереси були представлені в ООН. Вважається популярним вибором серед патріотично налаштованих і більш консервативних громадян, вона історично виступає проти іноземної допомоги та підтримує імпортні тарифи. Вона не користується популярністю на міжнародному рівні".,,,,,,,,
#,AppointAmbassador_1, Призначити Денніса Гонсалеса,"Денніс Гонсалес-популярна фігура на міжнародній арені з репутацією людини, що вирішує складні проблеми шляхом компромісу і розуміння. Справжній інтернаціоналіст, він популярний серед лібералів і соціалістів у нашому суспільстві, а також серед іноземних лідерів".,,,,,,,,
#,AppointJudge, Призначити старшого суддю,"Один з наших найбільш високопоставлених і шанованих суддів помер, і тепер нам потрібно зробити вибір на користь його заміни серед висунутих кандидатів. Ця людина буде засідати в наших судах дуже довго, тому ми повинні прийняти правильне рішення".,,,,,,,,,
#,AppointJudge_0, Призначити Едгара Лопеса,"ЕДГАР Лопес був переконаним прихильником прав людини, прийнявши багато знакових рішень на користь прав і свобод окремих осіб.його також вважають переконаним прихильником інтересів споживачів і не боїться кидати виклик великим корпораціям".,,,,,,,,,,
#,AppointJudge_1, Призначити Еліс Рід,"Еліс рід стала домашньою назвою завдяки її численним відомим рішенням, що стосуються насильницьких злочинів, і її часто відвертим поглядам на суворі вироки, які, на її думку, повинні застосовуватися до злодіїв, грабіжників і магазинних злодюжок".,,,,,
#,AttendGayWedding, Бути присутнім на гей-весіллі,"Суперпопулярна знаменитість виходить заміж, і ви запрошені в якості одного з гостей. Зазвичай це ні в якому разі не викликає суперечок, але це одностатева пара, а знаменитість - добре відомий захисник прав ЛГБТ. Ви будете присутні?",,,,,,,,
#,AttendGayWedding_0, Бути присутнім на весіллі,"Звичайно, ви повинні бути присутніми, і зробити це з гордістю, і подякувати за запрошення. На дворі 21 століття, і людям, які стали б гірше ставитися до політика через сексуальну орієнтацію людей, на чиїх весіллях він присутній, дійсно потрібно йти в ногу з часом. Незручно, що це взагалі має бути проблемою".,,,
#,AttendGayWedding_1, Не бути присутнім,"Очевидно, що політичний лідер не повинен з'являтися на кожному весіллі знаменитостей, незалежно від того, наскільки добре вони можуть знати нареченого чи наречену. Управління країною - це робота на повний робочий день, і якщо у вас в цей день будуть якісь важливі державні справи, то всі зрозуміють, що ви не зможете бути присутніми".,,,,,
#,AttendLGBTPlay, Відвідати ЛГБТ-виставу,"В даний час в кращому театрі нашої країни йде дуже добре прийнята і популярна п'єса. Режисер запросив вас відвідати виставу. Це не було б проблемою, але п'єса є коментарем до ставлення суспільства до представників ЛГБТ-спільноти. Відвідування вистави буде сприйнято як прояв сильної симпатії до ЛГБТ-руху".,,,,,,,,,,
#,AttendLGBTPlay_0, Відвідати виставу,"Це легка політична перемога, оскільки відвідування вистави нічого не коштує і не пов'язане з будь-яким законодавством, але дозволяє вам проявити певний інтерес і симпатію до ЛГБТ-спільноти. Було б несмаком відхилити запрошення.",,,,,,,,,
#,AttendLGBTPlay_1, Відхилити запрошення,"Ви не зобов'язані приймати кожне запрошення, яке вам спадає на думку. Режисер явно цинічно намагається використати запрошення, щоб домогтися демонстрації підтримки своєї програми, що непристойно і цинічно. Не ходити на виставу-цілком розумна відповідь".,,,,,,,,
#,BAILOUTCOMPANY, Виручити компанію,"Сталеливарний завод Stargazy, Inc, один з найбільших сталеливарних заводів в країні, зіткнувся з серйозними фінансовими труднощами і знаходиться на межі банкрутства. Керівники компанії вважають, що вони зможуть отримати нові замовлення та зберегти роботу компанії, якщо уряд надасть Безвідсотковий кредит, щоб підтримувати їх роботу протягом наступних кількох місяців".,,,,,
#,BAILOUTCOMPANY_0, Допомогти компанії,"У цій компанії працюють тисячі людей, і є безліч інших компаній, які надають їм послуги, які також постраждають, якщо компанія збанкрутує. Тільки подумайте, який вплив це матиме на місцеву економіку, якщо ми дозволимо цій компанії закритися. Ми повинні надати безподатковий кредит".,,,,,
#,BAILOUTCOMPANY_1, Нічого не робити,"Це називається вільним ринком. Компанія розоряється, тому що вона нерентабельна. Якби було розумно позичити їм гроші, приватний сектор зробив би це. Це просто викидання хороших грошей на вітер. Звичайно, в короткостроковій перспективі виникне безробіття, але ви не можете боротися з вільним ринком".,,,,,,,
#,BAILOUTCOMPANY_2, Взяти на себе часткову відповідальність,"Очевидно, ми не хочемо, щоб ця компанія збанкрутувала, але передавати готівку платників податків приватному підприємству, нічого не отримуючи натомість, нерозважливо. Давайте внесемо за них заставу, але в якості умови візьмемо міноритарну частку в бізнесі".,,,,,
#,BakingGayCakes, Випікати торти для геїв,"Пекарня, що належить релігійній парі, була притягнута до суду за дискримінацію після того, як вони відмовилися спекти святковий торт для одностатевої пари з релігійних мотивів, враховуючи несхвалення гомосексуальності їх церквами. Закон явно потребує роз'яснення в подібних випадках".,,,,,,,
#,BakingGayCakes_0, Підтримати пекарів,"Звичайно, основний принцип ведення бізнесу полягає в тому, що ви можете відмовитися від звичаїв, які вам не потрібні? Чи дійсно ми збираємося змушувати людей створювати роботи, які вони вважають блюзнірськими, щоб не образити замовника? Це явна провокація, оскільки є безліч інших пекарів, які з радістю спекли б цей пиріг".,,,,
#,BakingGayCakes_1, Підтримати одностатеву пару,"Дискримінація є дискримінація, незалежно від віросповідання. Це дуже слизький шлях, якщо ми дозволяємо людям стверджувати, що вони можуть відмовити клієнтам з релігійних міркувань, навіть якщо це суперечить закону. Вони вільні не схвалювати спосіб життя пари, але вони не можуть на законних підставах відмовитися вести з ними бізнес".,,,,,,
#,BAN ALCOHOL ADVERTS, Заборонити рекламу алкоголю,"Є пропозиція про прийняття закону, що забороняє рекламу алкоголю на телебаченні. Хоча реклама на радіо, рекламних щитах та іншими засобами залишатиметься законною, заборона на телебачення розглядається як потенційний спосіб зменшити споживання алкоголю нашими громадянами".,,,,,,,,
#,BAN ALCOHOL ADVERTS_0, Відхилити заборону,"Цей закон божевільний. Або у вас є заборона на будь-який продукт, або його немає. Алкоголь абсолютно легальний, і мільйони громадян користуються ним без будь-яких побічних ефектів. Заборона реклами продукту на певному носії-це символічний жест для фанатиків боротьби з алкоголем, який не робить нічого, крім втручання у вільний ринок".,,,,,,,
#,BAN ALCOHOL ADVERTS_1,Підтвердити заборону,"Це може не зупинити алкоголізм протягом ночі, але заборона телевізійної реклами - це крок у правильному напрямку. Рекламодавці стають все більш агресивними у своїй рекламі, виявляючи тривожну тенденцію до просування своєї продукції на молодіжному ринку. Все, що ми можемо зробити, щоб зменшити споживання алкоголю, варто спробувати".,,,,,,
#,BanAnimalTesting,Заборонити тестування на тваринах,Групи тиску внесли на розгляд уряду пропозицію заборонити всі експерименти на тваринах. В даний час у нас є досить багато людей, які працюють у галузях, де використовуються випробування на тваринах, але це також надзвичайно непопулярна практика".,,,,,,,,
#,BanAnimalTesting_0,Заборонити,У наш час немає вагомих причин тестувати будь-які продукти на тваринах, особливо косметику. Використовувані методи часто неймовірно жорстокі, і заборона мала б широку громадську підтримку та незначний реальний вплив на промисловість".,,,,,,,,,
#,BanAnimalTesting_1,Без змін,"Продукти тестуються тільки на тваринах, щоб переконатися у відсутності небезпеки для людей, і це робиться тільки в крайньому випадку в контрольованих умовах. Якщо ми введемо таку рішучу заборону, це сильно вдарить по нашій косметичній і фармацевтичній промисловості".,,,,,,,,
#,BanEScooters,Заборона електросамокатів,"Технологічні досягнення та надлишок венчурного капіталу в поєднанні перетворили управління компанією з прокату електричних скутерів на нову золоту лихоманку. В результаті конкуруючі компанії поширили десятки тисяч таких велосипедів по всіх центрах наших міст. Мешканці незадоволені безладом, оскільки їх часто випадково кидають на вулиці. Лунають заклики до заборони цих підприємств".,,,,,,,,,,
#,BanEScooters_0,Заборона прокату електросамокатів,"Це типовий приклад зарозумілого приватного бізнесу, який ставиться до громадських вулиць як до власного складу та вітрини магазину, навіть не консультуючись з громадськістю. Покинуті велосипеди захаращують наші вулиці, дратуючи як пішоходів, так і автомобілістів. Заборона-це єдина розумна відповідь".,,,,,,,
