#,CondemnRefuseStrike_1, Засудити страйк.,"Це нерозумний спосіб домагатися підвищення заробітної плати. Це небезпечно для здоров'я, і ми повинні розглянути можливість заміни працівників іншими людьми, якщо це необхідно. Це не що інше, як екстремістський союз, який намагається створити перешкоди для отримання несправедливої заробітної плати, за яку змушені платити звичайні люди. Це некваліфікована робота, і нинішня заробітна плата цілком прийнятна".,,,,,
#,CONTROVERSIAL MARCH, Суперечливий марш,"Вкрай права політична група планує ходу по нашій столиці. Група має расистські тенденції, і поліція переконана, що якщо марш продовжиться, між учасниками маршу та людьми, які прийдуть виступити проти них, відбудуться жорстокі сутички. Поліція рекомендує заборонити ходу".,,,,,,
#,CONTROVERSIAL MARCH_0, Заборонити марш,"Поліція дала нам достатньо вагому причину, щоб заборонити цей марш. Ми повинні враховувати думку переважної більшості нашого суспільства, яке не хоче і не потребує насильства і неприємностей, які викличе цей марш. Свобода слова не означає свободу бунтувати. Забороніть цей марш".,,,,,,,,
#,CONTROVERSIAL MARCH_1, Дозволити марш,"Однією з основних свобод в нашому суспільстві має бути право вільно збиратися і висувати політичну точку зору, навіть якщо це непопулярна точка зору або точка зору меншості. Учасники маршу всього лише висловлюють свої погляди, а опоненти можуть вільно проводити мирні акції протесту. Це незручна ситуація, але забороняти політичну демонстрацію-дуже диктаторський вчинок,,,,,,,,
#,CorporateManslaughter, Законопроект про ненавмисне вбивство корпорацій,"Пропонується новий законопроект, який дозволить юридичній особі притягатися до відповідальності за ненавмисне вбивство, якщо воно було визнано винним в недбалості, що призвела до загибелі людей".,,,,,,,,
#,CorporateManslaughter_0, Прийняти закон,"Цей закон необхідний для того, щоб утримати компанії від зрізання кутів, коли мова заходить про безпеку їх співробітників і представників громадськості. Занадто багато людей щорічно гине в результаті нещасних випадків на виробництві, і часто уроки не витягуються і вина не розподіляється. Цей закон стане кроком вперед у сфері корпоративної відповідальності".,,,,,,,,
#,CorporateManslaughter_1, Заблокувати цей закон,"Цей закон не має законної сили. Оскільки великі компанії наймають багато субпідрядників, юридичні ускладнення, пов'язані з відповідальністю за нещасні випадки, є значними. Цей закон може бути прийнятий з добрими намірами, але на практиці це буде дорогою тратою часу, яка допоможе наповнити кишені адвокатам, але не призведе до реальних змін у корпоративній поведінці".,,,,,
#,CorporateMedicalMarketing, Корпоративний медичний маркетинг,"Протягом багатьох років деякі фармацевтичні компанії надавали гроші та інші послуги лікарям, які призначали їм ліки, хоча іноді ці препарати були непотрібними або не були ідеальним вибором. В останні місяці це збільшилося, і хоча до цього часу фізичної шкоди не було завдано, це лише питання часу, перш ніж трапиться щось погане".,,,,,,
#,CorporateMedicalMarketing_0, Не вживати ніяких дій,"Це тривало багато років, і нічого не сталося. Очевидно, що немає необхідності втручатися і нав'язувати правила цим компаніям. Зрештою, фармацевтична промисловість є багатим і потужним бізнесом, і якщо інші компанії вважають, що їхній продукт кращий, вони можуть зробити те ж саме".,,,,,
#,CorporateMedicalMarketing_1, Ввести нормативні акти,"Це має припинитися, на кону життя пацієнтів, і неприпустимо, щоб лікарі призначали ліки, грунтуючись на своїх власних фінансових мотивах, а не на тому, що потрібно пацієнтові. Будуть введені правила, які перешкоджають фармацевтичним компаніям мати будь-який фінансовий вплив на лікарів".,,,,
#,DebtProtectionLaw, Закон Про захист боргів,"Агентства по стягненню боргів потрапили в новини через агресивні методи, які вони використовують для отримання платежів від людей, які заборгували великі суми грошей. Ці агенції з стягнення боргів надають позики людям, яким більші та поважніші компанії не позичатимуть гроші. Пропонується прийняти закон, що обмежує можливості діяльності таких агентств".,,,,,,,
#,DebtProtectionLaw_0, Обмежити Діяльність агентств,"Ці агенції заробляють на найслабших і найбідніших членах нашого суспільства, часто обманюючи їх позичати гроші за непомірними ставками, які ніколи не можна повернути. Це трохи більше, ніж вимагання, і уряд повинен негайно вжити заходів, щоб суворо обмежити діяльність таких недобросовісних компаній".,,,,,,
#,DebtProtectionLaw_1, Дозволити агентствам працювати,"Ніхто не змушує людей позичати гроші, які вони не можуть повернути, і обмежувати права боргових агентств по стягненню законних боргів було б контрпродуктивно. Люди повинні навчитися жити за коштами і не очікувати, що держава виручить їх з біди, якщо вони не можуть навчитися цьому".,,,,,,,
#,DecryPaydayLoanCompany, Засудити компанію з видачі позик до зарплати,"Компанії з надання короткострокових позик або позик "до зарплати" пропонують кредити за надзвичайно високими процентними ставками і орієнтовані на найбідніші верстви суспільства через відсутність у них доступу до основних кредиторів. Деякі захисники прав споживачів вимагають, щоб уряд висловився з цього питання".,,,,,,,,,,
#,DecryPaydayLoanCompany_0, Критикувати кредити,"Звичайно, неприпустимо, щоб з тих членів суспільства, які найбільше потребують кредитів, стягувалися найвищі ставки? Ці компанії цинічно експлуатують обмежені можливості бідних і назавжди заганяють їх у борговий круговорот. Принаймні, ми повинні відкрито критикувати їх бізнес-модель".,,,,,,
#,DecryPaydayLoanCompany_1, Не коментувати,"Ці кредитори ведуть абсолютно легальний бізнес, який просто обслуговує певний ринок. Звичайно, з тих клієнтів, які належать до групи дуже високого ризику, будуть стягуватися більш високі процентні ставки, це цілком зрозуміло. Крім того, краще дозволити легальним і регульованим кредиторам отримувати зарплату в день виплати платні, ніж дозволити злочинцям і лихварям захопити владу".,,,,
#,DeliveryDrones, Дрони-доставщики,"Міжнародний рітейлер хоче впровадити доставку вантажів за допомогою автономних вантажних квадрокоптерів. Широка громадськість схвильована такою перспективою, але профспілкові активісти налаштовані вкрай критично, передбачаючи втрату робочих місць і нещасні випадки. Рітейлер запросив дозвіл на запуск пілотного проекту, а чинне законодавство не поширюється на комерційні безпілотники".,,,,,,,,
#,DeliveryDrones_0, Дозволити дрони-доставники,"Пілотна програма не буде пропонувати клієнтам доставку за допомогою безпілотників, тільки з одного складу на інший. Технологія досить безпечна, щоб дозволити це".,,,,,,,,,
#,DeliveryDrones_1, Заборонити безпілотні літальні апарати для доставки,"З поліцейськими і військовими безпілотниками громадський повітряний простір вже стає переповненим. Приватні безпілотники невиправдано збільшили б ризик нещасних випадків, пов'язаних з безпілотниками".,,,,,,,,,,
#,DeliveryDrones_2, Дозволити обмежені судові розгляди,"Давай не будемо вдаватися в це. Можливо, найкраще просто провести кілька обмежених випробувань протягом року-двох, щоб побачити, що станеться?",,,,,,,,
#,DisguisedEmploymentLaw, Закон про приховану зайнятість,"В останні роки спостерігається значне зростання кількості підприємств з нульовою зайнятістю, таких як додатки для таксі, і закон не зміг надолужити згаяне. Деякі учасники кампанії кажуть, що це замаскована зайнятість, спрямована на те, щоб уникнути виплати відпускних або лікарняних працівникам, і що до компаній потрібно ставитися як до звичайних роботодавців".,,,,,
#,DisguisedEmploymentLaw_0, Оголосити роботу у сфері комерційної діяльності замаскованою зайнятістю"Ці компанії, по суті, є високотехнологічними компаніями таксі та доставки, які використовують лазівку, щоб не платити собі лікарняні, пенсійні внески та інші основні виплати. Це нечесна конкуренція з тими, хто грає відповідно до духу закону. Посилення правил дозволить забезпечити чесну конкуренцію".,,,,,,
#,DisguisedEmploymentLaw_1, Залишити діючі правила в спокої,"Це просто те, як працює вільний ринок. Нова бізнес-модель, яка забезпечує надзвичайно гнучку зайнятість тисячам людей і дозволяє користуватися наддешевими послугами таксі та доставки їжі, просто перевершила конкуренцію старих підприємств. Працівники можуть абсолютно вільно відключати додатки або працювати на конкурентів, тому цілком справедливо сказати, що це ненормальна зайнятість ".,,,,,,
#,DNADatabase, База даних ДН,К"Начальники поліції просять дозволити їм створити глобальну базу даних ДНК кожної людини, щоб допомогти їм у боротьбі зі злочинністю. Дані ДНК дозволяють встановити винних у багатьох раніше нерозкритих злочинах, хоча існують проблеми з конфіденційністю".,,,,,,,,,
#,DNADatabase_0, Дозволити базу даних,"Це, ймовірно, стане безцінною зброєю в боротьбі зі злочинністю. Занадто довго злочинці могли заперечувати відповідальність за свої злочини, і за допомогою ДНК-доказів ми можемо істотно скоротити час поліції, витрачений на пошук злочинців, таких як вбивці і насильники. Якщо людям нема чого приховувати, вони навряд чи зможуть виступити проти такого заходу".,,,,,
#,DNADatabase_1, Заборонити базу даних,"Це фундаментальне порушення прав людини наших громадян. Ми повинні підтримувати презумпцію невинуватості окремих осіб, поки провина не буде доведена, і створення бази даних у стилі "великого брата" про кожного змушує нас усіх відчувати себе злочинцями. Чи дійсно ми збираємося "змусити" наших громадян надавати зразки ДНК державі або їм загрожує в'язниця?",,,,,,,,,
#,DNADatabase_2, База даних лише для злочинців,"Давайте застосуємо практичний підхід. ДНК, взята у підозрюваних, може зберігатися в поліцейській базі даних необмежений час, але не повинно бути масового збору ДНК невинних людей, якщо тільки їм не пред'явлено звинувачення в скоєнні злочину".,,,,,,,
#,EndLifeRecyclingLaw, Припинити життя Закон Про утилізацію відходів,"Одним з недоліків суспільства споживання є те, що так багато продуктів в кінці терміну служби просто викидаються на звалище. Одним з рішень є заохочення людей до переробки відходів, але останнім часом спостерігається прагнення покласти цей тягар на виробників великої побутової техніки, поклавши на них Юридичний обов'язок забирати свої старі вироби і переробляти їх".,,,,,,,,
#,EndLifeRecyclingLaw_0, Прийняти закон,"Ми не можемо продовжувати просто кидати все більше і більше сміття в ями в землі і сподіватися, що воно зникне. Перекладаючи тягар утилізації назад на компанії, це спонукає їх розробляти продукти, які легко і дешево переробляються, а значить, виграють всі".,,,,,,
#,EndLifeRecyclingLaw_1, Відхилити закон,"На практиці це звучить просто, але це лягло б величезним тягарем на компанії і виробників, що базуються в нашій країні. Ми не можемо забезпечити це за кордоном, а це означає, що ми просто покладаємо безглуздий тягар регулювання на нашу власну галузь".,,,,,,,
#,EXTRADITE TERROR SUSPECT, Видати підозрюваного в тероризмі?,"Країна Близького Сходу, з якою у нас немає офіційного договору про екстрадицію, звернулася до нас з проханням видати їм проживає тут іммігранта для пред'явлення звинувачень у тероризмі. Вони звинувачують його у причетності до вибухів автомобілів у їхній столиці, але єдиними доказами цього є визнання інших підозрюваних у тероризмі, які, можливо, були зроблені під "тиском".",,,,,
#,EXTRADITE TERROR SUSPECT_0, Видати підозрюваного,"Ми повинні негайно відправити цього терориста назад в його рідну країну. У його рідній країні можуть виникнути незначні занепокоєння щодо системи правосуддя, але вони борються з терористами, і якби ситуація була зворотною, ми були б обурені будь-якою відмовою відправити терористів до суду. Зараз не час проявляти педантичність щодо методів допиту.",,,,,,,,
#,EXTRADITE TERROR SUSPECT_1, Залишити його тут,"Якщо ми екстрадуємо цю людину, є шанс, що йому загрожує смертна кара. У нас немає можливості дізнатися, чи доб'ється він справедливого судового розгляду, і ми не можемо бути впевнені, що він та сама людина. Ми не можемо видавати людей тільки за вказівкою іноземних урядів, нам потрібно побачити докази злочинної діяльності, перш ніж ми, можливо, відправимо людину на вірну смерть".,,
#,FactoryFarming, Закон про промислове фермерство,"Кампанія за посилення стандартів захисту тварин на фермах набирає обертів. Було запропоновано законодавство, яке встановлювало б вищі мінімальні стандарти щодо простору, їжі та доступу на вулицю, які доступні тваринам у закладах інтенсивного землеробства.",,,,,,,,
#,FactoryFarming_0, Встановити більш жорсткі стандарти,"Саме час нам щось зробити для того, щоб тварини не страждали при інтенсивному веденні сільського господарства. Більшість людей прийшли б в жах, якби побачили, в яких умовах утримуються деякі тварини. Ці стандарти призвели б до подорожчання продуктів харчування, але люди були б раді платити більше, якби знали, в яких умовах в даний час утримуються тварини".,,,,,
#,FactoryFarming_1, Залишити без змін,"Ніхто не змушує людей купувати перероблене м'ясо з найдешевшого джерела. Існують органічні продукти харчування та продукти вільного вигулу, але вільний ринок чітко показує, що люди не готові платити більше за зміну умов утримання тварин. Цей уряд втручається на ринок, щоб заспокоїти кількох учасників кампанії".,,,,,,,,
#,FishingQuota, Квоти на вилов риби,"Групи з охорони морського середовища наполягають на тому, щоб ми підписали міжнародні закони, що обмежують кількість певної риби, яку можуть виловити наші рибалки протягом будь-якого календарного року. Це спроба зберегти життєздатність рибних запасів для майбутніх поколінь".,,,,,,,,
#,FishingQuota_0, Погодитися на квоти,",Це просто здоровий глузд. Сучасні технології призвели до того, що ловити величезну кількість риби стало занадто дешево і легко, що призвело до зниження цін і небезпечного виснаження запасів. У короткостроковій перспективі це може бути непопулярним серед рибалок, але в довгостроковій перспективі ми повинні думати про морське середовище. Екологічні групи рекомендують підписати закон".,,,,,,,
#,FishingQuota_1, Відхилити квоти,"Теоретично все це звучить дуже розумно,але на практиці чи хочемо ми передати контроль над нашою рибальською економікою якомусь міжнародному органу? І хоча ми можемо бути впевнені, що наші рибалки будуть дотримуватися умов Угоди, як ми можемо бути впевнені, що іноземні рибалки зроблять те ж саме? Підписання цього закону стане ще одним цвяхом в кришку труни рибальської галузі, і це буде коштувати робочих місць! Відкиньте закон!",,,,,,
