#,FailedConservativeAssassination, Невдала спроба вбивства!,"Схоже, екстремістське крило консервативного" Альянсу традиційних цінностей " взяло на себе завдання усунути вас з поста глави уряду. Очевидно, що ця осколкова група відома як" моральний хрестовий похід", і сьогоднішня невдала спроба вбивства не буде їх останньою. Ви, мабуть, дійсно стрясаєте клітини консерваторів, раз змушуєте їх до подібних дій".
#,FailedEthnicAssassination, Невдала спроба вбивства!,"Сьогодні вранці Ви були розбуджені в паніці звісткою про те, що озброєні екстремісти вчинили замах на ваше життя. Група озброєних антиурядових демонстрантів, які стверджують, що вони з "групи чорної влади", відкрила вогонь по урядових будівлях сьогодні вранці, розбивши вікна і поранивши деяких співробітників, але, на щастя, обійшлося без жертв. Група звинуватила уряд у расизмі та заявила, що вони представляють гнів етнічних меншин цієї країни. Ми повинні бути обережними щодо потенційних подібних атак у майбутньому".
#,FailedFarmersAssassination, Невдала спроба вбивства!,"Сьогодні о 10.21 ранку наші співробітники Служби безпеки заарештували чоловіка, який намагався пробратися на брифінг для преси із зарядженим дробовиком. Очевидно, він був із "Альянсу фермерів", екстремістської групи, створеної для боротьби з політикою уряду щодо сільського господарства. Сили безпеки вже деякий час стежать за цією організацією, і зрозуміло, що поки політика уряду не зміниться, нам доведеться очікувати нових нападів, подібних до цього. Цього разу нам пощастило".
#,FailedGreenAssassination, Спроба вбивства!,"Було скоєно невдалий замах на ваше життя терористичним угрупуванням зелених, відомої як "зелена бригада". Вам пощастило, що відважні співробітники вашої розвідки зуміли вчасно перехопити їх. У майбутньому нам може не пощастити так сильно, тому ви, можливо, захочете переглянути заходи безпеки. Це невелика маргінальна група екотерористів, але чим більше ми обурюємо ширший екологічний рух, тим більше подібних нападів нам доведеться очікувати".
#,FailedLiberalAssassination, Невдала спроба вбивства!,"Приносимо вибачення за те, що в поспіху вивели вас з будівлі, але цей вибух був замахом на вас, здійсненим екстремістської ліберальної угрупованням, відомої як "Ліга свободи". Вони, очевидно, досить розлючені ставленням вашого уряду до ліберальних питань, щоб спробувати рознести вас на шматки. На щастя, нашим службам безпеки вдалося виявити бомбу до того, як вона вибухнула. Наступного разу нам може так не пощастити."
#,FailedPatrioticAssassination, Невдала спроба вбивства!,"Ті постріли, які ви чули на сьогоднішньому ранковому зібранні, були не тренуванням, а реальною спробою вбити вас групою озброєних до зубів терористів, які називають себе "істинний шлях". Мабуть, це якась ультрапатріотична воєнізована організація, останнім часом вони стають все більш агресивними у своїй критиці уряду. Сьогодні нам вдалося зловити їх до того, як вони підібралися ще ближче. Наступного разу нам може так не пощастити."
#,FailedReligiousAssassination, Невдала спроба вбивства!,"Секретна служба заробила свою платню сьогодні, коли вони заарештували вагон з людьми, які, мабуть, є релігійними фанатиками, які планують напад на Вас і Кабінет Міністрів. Фургон, наповнений вибухівкою та стрілецькою зброєю, був зупинений нашою пильною поліцією після того, як наші співробітники Служби безпеки перехопили розвіддані. Здається, існує ряд релігійних екстремістів, які вирішили скинути нинішній уряд. Ця компанія називала себе"армією Божою"."
#,FailedSocialistAssassination, Невдалий замах!,"Раніше сьогодні наші чудові співробітники секретної служби заарештували п'ятьох озброєних людей, які зібралися біля урядової штаб-квартири, очевидно, з планом вашого вбивства. В даний час ми допитуємо цих людей, але поки що все, що нам відомо, це те, що вони є частиною крайнього лівого руху під назвою "Соціалістична армія". Якби не наші хоробрі хлопці з безпеки, ви б зараз були в морзі, сер..."
#,GainNewDonor, Новий великий партійний донор!,"Завдяки вашим зусиллям зі збору коштів вдалося залучити нову заможну людину, яка зробить пожертвування у фонд вашої майбутньої кампанії. Переконайтеся, що ви робите цього донора щасливим, і зверніть увагу на групи, яким він симпатизує. Якщо донори стануть незадоволені, є ймовірність, що ви втратите їх життєво важливу фінансову підтримку".
#,LoseDonor, Великий донор залишає партію!,"Схоже, ви не прислухалися до думки наших основних фінансових спонсорів. Один з наших багатих донорів просто скоротив свою підтримку нашої партії. Це може вплинути на нашу здатність ефективно проводити кампанію, якщо ми не зможемо знайти донора на заміну (і зберегти їх...)""
#,_MinisterialResignation, Відставка міністра,"Одному з ваших Міністрів набридло служити у вашому уряді, і він пішов у відставку, щоб "проводити більше часу зі своєю сім'єю". Вам доведеться якомога швидше знайти когось, хто підходить для їх заміни."
#,socialmediascandal, Скандал у соціальних мережах,"Розслідування виявило шокуюче порушення конфіденційності провідними технологічними компаніями, що стоять за популярними сайтами соціальних мереж. Відсутність належного захисту приватного життя та правоохоронних органів призвела до того, що технологічні компанії вільно збирали величезні обсяги приватної інформації, яка потім продавалася тому, хто заплатить більше. Це прекрасний приклад однієї з небезпек нашого способу життя, пов'язаного з постійними зв'язками. Природно, борці за конфіденційність обурені тим, що ви дозволили це статися".
#,tsunami, Цунамі!,"Руйнівне цунамі обрушилося на наше узбережжя. Незважаючи на те, що ми готуємося до таких подій, неможливо запобігти всім людським жертвам і збиткам. Руйнування, завдані нашим прибережним містам і рибної промисловості, серйозні і стануть значним ударом по нашій економіці".
#,earthquake, Землетрус!,"У нашій країні стався землетрус. Хоча, на щастя, кількість жертв досить низька, це матиме помітний вплив на нашу економіку, оскільки підприємствам потрібен час для відновлення та усунення збитків".
#,falklands, Аргентина піднімає прапор,"Давня суперечка про приналежність Фолклендських островів була знову розпалена Аргентиною, яка претендує на острови як на "Мальвінські острови". Аргентинські солдати висадилися і поставили прапор, а потім, після короткої промови для телебачення, відступили, але це тривожна ознака того, що Аргентинський уряд вважає, що ми, можливо, не зможемо захистити острови вдруге, якщо вони зроблять ще одну спробу вторгнення".
#,russianships, Наближаються російські кораблі,"У все більш відвертій спробі залякати нас і перевірити нашу обороноздатність кораблі і літаки російського військово-морського флоту підійшли надзвичайно близько до наших кордонів, вимагаючи від нас посилення оборони. Це показує, що наші військові можливості в даний час не вважаються серйозним стримуючим фактором".
#,heatwave, Спека,"Оскільки глобальні температури підвищилися, наша погода стала більш екстремальною, і в даний час ми знаходимося в епіцентрі небезпечної спекотної погоди, що призводить до лісових пожеж і численних смертей. Наша країна просто не звикла справлятися з такими екстремальними погодними умовами, і ми починаємо відчувати економічні наслідки".
#,blacklivesmatter,Життя чорношкірих має значення,"Після гучного арешту поліції, який вбив кольорову людину, хвиля гніву через расову нерівність прокотилася по всій нашій країні".

#,BorderConflict, Прикордонний конфлікт!,"Смілива нація щойно розпочала прикордонний конфлікт! наші сили вступили в бій, і нові підкріплення вже в дорозі".
#,GovermentScandal, Урядовий скандал!,"Один з ваших високопоставлених чиновників крав гроші, які повинні були бути використані для оплати державних витрат, незабаром після того, як це було виявлено, чиновнику вдалося покинути країну".
#,ArtifactsDiscovered, Ми виявили артефакти!,"Одній з наших команд вдалося виявити артефакти, давно втрачені нашою цивілізацією!".
#,AirAccident, Авіакатастрофа!, "Один з наших військових вантажних літаків, що перевозили обладнання і транспортні засоби, зазнав аварії з невідомих причин, ми почали розслідування цієї справи, ми повинні відправити звіт нашому вищому військовому персоналу, як тільки розслідування буде завершено..."
#,AShootingStar, Падаюча зірка!,"У нас щойно була падаюча зірка, яка засвітила небо!"
#,SchoolShootingPrevented, Ми запобігли стрілянині в школі!,"На щастя, один з наших шкільних радників зміг зупинити стрілянину в школі, багато людей щасливі, що ми зупинили це, і нас хвалять, але деякі батьки та інші активісти думають, що ми могли б запобігти цьому в першу чергу".
#,SchoolShooting, Стрілянина в школі!,"Сьогодні один підліток з місцевої школи, озброєний 9-міліметровим пістолетом свого батька і гвинтівкою калібру 5,56, вистрілив і вбив 12 інших підлітків і 2 вчителів, і поранив ще 22 людини цього ранку, поліція відреагувала на стрілянину і застрелила підлітка, наша нація сильно постраждала від цієї трагічної події".
#,LocalHero, Народився герой,"Пожежа в місцевій ремонтній майстерні та невеликому будинку змусила пожежника втрутитися і врятувати 11 людей в обох будівлях, на щастя, ніхто серйозно не постраждав, але, на жаль, будівлі втрачені, але пожежник - герой, який врятував життя, яке могло бути втрачено, і захистив будівлі від спіткала та ж доля, що і попередні будівлі."
#,GovermentTraitorArrested, Заарештовано зрадника уряду!,"Один з ваших високопоставлених чиновників крав гроші, які повинні були бути використані для оплати державних витрат, незабаром після того, як це було виявлено, чиновнику майже вдалося покинути країну, але наша Секретна служба разом з нашою поліцією змогли заарештувати його до того, як він втік!"
#,HugeFire, Величезна пожежа!,"Трагічний нещасний випадок спричинив величезну пожежу в ремонтній майстерні! На жаль, жодна служба реагування на надзвичайні ситуації не змогла прибути досить рано, щоб зупинити швидке поширення пожежі".
#,ArtifactsStolen, Деякі артефакти були вкрадені!,"Минулої ночі шестеро грабіжників проникли в наш національний музей і вкрали безліч безцінних артефактів, поліція змогла встановити особи грабіжників. Якщо у вас є будь-яка інформація, повідомте поліцію за винагороду в розмірі 100 000 Доларів США за будь-яку інформацію, яка призведе до повернення артефактів. Сказав репортер DDC"
#,CrimeSpree, Міська злочинність веселощі!,"Чоловік і жінка влаштували кримінальний скандал у захопленому місті, поліція затоплює вулиці в пошуках підозрюваних, до вас приставлена група безпеки, щоб захистити вас в цей важкий час".
#,ZooBreak, Тварини тікають із зоопарку!,"Тварини заповнюють вулиці, блокуючи рух транспорту, викликаючи заворушення, і надходять повідомлення про те, що тварини завдають шкоди майну і навіть нападам".
#,Flood, Міста затоплені!,"У багатьох містах після сильних дощів сталися повені".

#,globalsummit,Глобальний лідерський саміт, "Недавній саміт, в якому взяли участь кілька найбільш впливових лідерів світу, пройшов краще, ніж ми очікували. Знайдено спільну мову, укладено угоди, і вирішено непорозуміння. Світ став трохи безпечнішим, частково завдяки вашому внеску."
