#,governmentshutdown, "Закрити уряду" з операційного бюджету вашого уряду було утримано, а державні послуги були припинені на місяць. Ваша суперечлива політика не має широкої підтримки в законодавчому органі, і вони використовували свою колективну владу, щоб відмовити вам у коштах, необхідних для оплати праці державних службовців. Співробітники Служби безпеки, прикордонні патрулі, тюремний персонал і авіадиспетчери - це лише деякі з неоплачуваних працівників, які тижнями сидять вдома, поки ви знаходите політичне рішення".
#,gravemoveprotests, "Зрадники" Останки фашистського історичного діяча були ексгумовані з їх видатного місця поховання в столиці і перенесені у віддалену могилу. Соціалісти високо оцінили переселення, оскільки ця глава нашого минулого більше не буде прославлятися. Тоді як консервативні націоналісти протестували проти втручання, заявляючи, що стерти минуле неможливо".
#,highcorruptioncriticized, "У міжнародній доповіді" Критика корупції " критикується високий рівень корупції в нашому суспільстві, вказуючи на те, що ми є однією з найбільш корумпованих країн на континенті. Корупція гальмує всі аспекти життя, і висвітлення її наслідків в нашій країні буде негативно сприйнято як всередині країни, так і за кордоном".
#,highriseblaze", "Дорога в гості", " несправність побутового приладу призвела до смертельного загоряння в багатоповерховому житловому будинку, побудованому в столиці нашої країни для проживання сімей з низьким доходом. Поєднання неякісного будівництва будівель, відсутності регуляторного контролю та непідготовленої служби пожежогасіння призвело до смертельних випадків, які сколихнули країну. Ваш уряд зазнав більш широкої критики за зростаючий розрив у майновій нерівності, який був підкреслений відсутністю турботи, виявленої до цих громадян".
#,holybuildingburned, Священна будівля спалена"Відоме місце поклоніння у вашій столиці було зрівняно із землею за допомогою запальної бомби після ескалації напруженості між конкуруючими релігійними групами. Преса мало що робить, щоб мінімізувати катастрофічні наслідки, які це матиме на міжрасові відносини в нашій країні".
#,hostagesrescued, "Заручники, захоплені терористичною групою, були знайдені і врятовані нашою армією. Хоча радикальні угруповання все ще активні в нашому суспільстві, ми показали, що ефективно боремося з ними і в кінцевому підсумку здобудемо перемогу".
#,housingmarketboom, "Бум на ринку житла", ціни на житло досягли рекордно високого рівня. Це хороший знак того, що наша економіка набирає обертів. Кожен заробляє гроші і здатний реалізувати своє прагнення до збільшення портфеля нерухомості. Деякі яструбині економісти розглядають це як тимчасовий міхур, який ось-ось лопне, але більшість займається заготівлею сіна, поки світить сонце".
#,housingmarketcrash, Крах ринку житла"Ціни на житло падають. Здається неминучим цикл бумів і спадів на ринку знову наздогнав нас. Власники декількох будинків і іноземні інвестори підняли ціни вище, ніж це було по кишені тим, хто дійсно потребував житло. Зараз у людей кредити перевищують вартість їхніх будинків, ліквідність при продажу нерухомості знизилася, і всі ринки страждають від нестачі довіри".
#,hugehurricane,Величезний ураган"Громади були спустошені надзвичайно сильним ураганом. Тисячі людей загинули, оскільки засоби захисту від стихійних лих зазнали невдачі, а реагування на надзвичайні ситуації були вкрай недостатніми. Згодом стався шквал відставок серед урядовців, які були відповідальні за запобігання цій трагедії. Вас особисто критикували за те, як ви впоралися з цим інцидентом".
#,illegalimmigrationoutcry, Протест проти нелегальної імміграції"Значне зростання нелегальної імміграції викликало обурення серед консервативного населення нашої країни. Расова напруженість і без того була висока, а оскільки пористі кордони постійно порушувалися, ця ситуація неминуче повинна була загостритися".
#,internationalcharges, Міжнародні звинувачення"Міжнародний кримінальний суд висунув проти вас звинувачення у вбивстві, зґвалтуванні та депортації. Звичайно, ви заперечуєте ці злочини і відмовляєтесь підтвердити свої претензії зустріччю зі своїми обвинувачами. Ви впевнені, що громадськість побачить цю брехню такою, якою вона є".
#,internationalliteraryaward, Міжнародна літературна премія"Місцевий письменник отримав найпрестижнішу міжнародну літературну премію за свій роман. Дія цієї історії розгортається в нашій країні, і вона підняла авторитет країни в усьому світі".
#,joiningtheunion, Вступ до профспілки"Наша нація була прийнята в панконтинентальну організацію, метою якої є забезпечення миру і процвітання на територіях Союзу. Ще живі громадяни, які пам'ятають, що воювали з деякими з наших сусідніх країн, до чиєї наддержави ми зараз приєднуємось. Безсумнівно, пожертвування деякою суверенною владою-це ціна, яку варто заплатити за укладення сприятливих торгових угод і пакту про ненапад, щоб запобігти катастрофічним конфліктам у майбутньому".
#,journalistjailed,Журналіст ув'язнений"Іноземний журналіст, який робить репортаж зі столиці, був поміщений у в'язницю за шпигунство. Вони заявляють про свою невинність, але були спіймані на зв'язках з повстанцями-дисидентами, які хочуть дестабілізувати наш режим. Міжнародна преса висловилася на підтримку цього шпигуна, критикуючи відсутність прав людини в нашій країні".
#,journalistreleased, Журналіст звільнений"Журналіст, ув'язнений за дисидентство, був достроково звільнений після того, як виграв їх апеляцію. Умови прав людини в нашій країні покращилися з моменту їх ув'язнення, і їх звільнення було добре сприйнято як у країні, так і за кордоном".
#,judgemartyr, Суддя-мученик"Суддя приніс пістолет в зал суду і вистрілив собі в груди. Цей акт мучеництва був здійснений на знак протесту проти корупції вашого уряду та відкритого втручання в судову систему".
#,landacquisitionscandal, Скандал з придбанням землі"Пропонований спільний інфраструктурний проект з іноземним урядом був припинений. Це пов'язано з тим, що проти будівельної компанії порушено судову справу про законність покупки ними землі. Схоже, що громадяни були примусово виселені зі своїх будинків без відповідної компенсації, в той час як чиновники викачували державні гроші з проекту".
#,leaderdiessuddenly, Лідер раптово помирає,"Лідер уряду раптово помер. У них стався великий Серцевий Напад, від якого вони так і не оговталися. Ви, тимчасовий лідер, були поставлені на їх місце до тих пір, поки не будуть проведені вибори".
#,leavingtheunion, Вихід із Союзу"Ви успадкували результати референдуму від попереднього уряду, і воля народу повинна бути дотримана. Нація розкололася навпіл через те, чи залишатися в союзі з нашими торговими сусідами. З мінімальним відривом електорат проголосував за те, щоб покинути супердержаву. Наші власні закони, Конституція та ринки настільки переплітаються із законами Союзу, що вихід здається неможливим бюрократичним завданням. Однак, що означає відпустка, не було визначено, тому це може бути можливістю політичного захоплення землі".
#,lowcorruptionpraised, Вихваляється низький рівень корупції"Міжнародний звіт високо оцінив низький рівень корупції в нашому суспільстві, вказавши, що країна є однією з найменш корумпованих на континенті. В таких умовах бізнес може процвітати, а наші співробітники можуть безперешкодно прагнути до самовдосконалення. Міжнародне співтовариство може бути впевнене в тому, що їхні інвестиції в нашу країну будуть використані ефективно, за прямим призначенням".
#,martyrdies, Помирає мученик"В ході екстремальної демонстрації протесту проти уряду громадянин підпалив себе в столиці країни. Вони не вижили після отриманих ран, і їх мученицька смерть викликала хвилю громадянської непокори, яка дестабілізувала ситуацію в країні".
#,masssentencing. Масові вироки"Сотні ув'язнених були засуджені в ході одного слухання, порушивши міжнародні стандарти справедливого судового розгляду. Факти у справі кожної окремої людини, можливо, не були належним чином розглянуті під час цієї пародії на правосуддя".
#,migrantsdieintruck, Мігранти гинуть у вантажівці"Десятки тіл були виявлені в кузові комерційної вантажівки на нашому кордоні. Задушені жертви були ідентифіковані як іноземні мігранти, які загинули, намагаючись дістатися до нашої країни. Провина за цю трагедію покладається на уряд за неефективне патрулювання наших кордонів і за хронічну ситуацію, коли зневіреним людям не дозволяють законно в'їжджати в нашу країну".
#,militarycontractscandal, Скандал з військовим контрактом"Розслідування було розпочато після того, як національна газета розкрила узаконену корупцію в наших Збройних силах. Фальсифіковані контракти на закупівлі використовувалися для перекачування величезних сум державних грошей на особисті банківські рахунки".
#,minerskilled, Вбиті шахтарі"В результаті обвалу на шахті з видобутку корисних копалин загинули десятки шахтарів. В даний час проводиться розслідування дотримання стандартів охорони праці та техніки безпеки на об'єкті, але громадськість вважає це занадто незначним і запізнілим".
#,multinationalcompanyheadquarters, Штаб-квартира транснаціональної компанії"Велика транснаціональна компанія вирішила побудувати свою регіональну штаб-квартиру тут, в нашій країні. Сприятливий ринок праці, хороший рівень освіти і стабільний режим - все це сприяло їх вирішенню. Це означатиме зростання зайнятості та нашої економіки".
#,nationalcyberattack, Національна кібератака"Основні комп'ютерні системи нашої країни зазнали великої кібератаки. Банки, Засоби масової інформації та урядові веб-сайти - всі вони стали мішенями величезних іноземних ботнетів, що перевантажували сервери неймовірною кількістю онлайн-запитів. Зрозуміло, що за нападом стоїть Історичний агресор, який викликає гнів патріотів".
#,nationalsportsstarsgaggedbyforeignpower, Зіркам національного спорту заткнули роти іноземцями"Коли спорт-це бізнес, спортсменам потрібно перевірити свої контракти, перш ніж висловлювати свою думку. Були принесені принижені вибачення іноземній наддержаві, яка висловила незгоду з підтримкою протестного руху в їхній країні."
#,nationalteambanned, "Національна команда заборонена" Наша національна футбольна команда була відсторонена від участі у всіх змаганнях за расистські висловлювання на адресу своїх суперників. Расова напруженість у нашому суспільстві висока, і це дуже помітне покарання проливає бентежне світло на наші соціальні проблеми".
#,nationalteamdefects, "Деекти національної команди", національна збірна з футболу відмовляється повертатися з міжнародного турніру. Вони просять притулку в країні-організаторі турніру, стверджуючи, що їхньому життю загрожує небезпека, якщо вони повернуться додому. Це міжнародна ганьба, яка підкреслює наші широкі соціальні проблеми".
#,nationalteamexitsworldcup, Національна збірна залишає Чемпіонат світу,"Національна збірна з футболу вилетіла з чемпіонату світу раніше, ніж очікувалося. Наше населення не може стримати свого розчарування. Гравці зазнали жорсткої критики в засобах масової інформації, і по всій країні панує загальна зневіра. Як ми можемо прагнути стати світовим лідером, коли ми навіть не можемо брати участь у спортивних змаганнях?"
#,nationalteamwinsworldcup, Національна команда виграє Чемпіонат світу,"Національна збірна з футболу виграла Чемпіонат світу, порадувавши вболівальників по всій країні. Це може не призвести до довгострокових відчутних переваг, але хвиля доброї волі серед наших людей дуже вітається".
#,nativespeciesextinct, Місцеві види вимерли,"Дуже помітний місцевий вид тварин був оголошений вимерлим. Виною всьому ерозія їх природного середовища проживання і браконьєрство. Нездатність уряду захистити природні ресурси нашої країни розлютила екологів".
#,naturallyentertaining,Природно цікаво,"Знамениті натуралісти нашої країни зробили це знову. Їх остання серія документальних відеороликів стала світовим хітом, привертаючи увагу до найбільш актуальних глобальних екологічних проблем. Те, що решта світу сильно ототожнює нашу націю з цими випусками, також підвищує наш власний авторитет. Відбулося значне збільшення кількості членів екологічних груп".
#,newlyindustrializedcountrystatus, Статус нової промислово розвиненої країни,"Світові економісти класифікували нашу країну як нещодавно індустріалізовану. Це визнання нашого сильного політичного лідерства, зростання виробництва, урбанізації та вільної торгівлі".
#,nobelpeaceprize, Нобелівська премія миру,"Ті, хто, як вважається, зіграв важливу роль у просуванні демократії всередині країни і за кордоном, були удостоєні Нобелівської премії миру. Це рішуче схвалення нашого демократичного режиму міжнародним співтовариством".
#,olympichosts, Господарі Олімпійських ігор,"Ніщо так не говорить про міжнародне лідерство, як успішне проведення Олімпійських ігор, і наша Олімпіада пройшла без сучка і задирки. Прийняття олімпійської обітниці чесної гри та честі перед величезною аудиторією по всьому світу коштувало всіх витрат, політики та рукостискань. Ви впевнені, що спортсмени теж отримали задоволення?"
#,openlygayleader, Лідер відкритого гея,"Лідером опозиції був обраний політик-відкритий гей. Представництво на найвищих рівнях влади стало результатом тривалої кампанії проти дискримінації за ознакою статі в нашому суспільстві".
#,oppositionmembersstagewalkout,Учасники опозиції влаштовують страйк,"Представники опозиції в законодавчому органі вийшли на вулицю на знак протесту проти придушення демократичного процесу урядом. Без участі опозиції не може бути навіть видимості демократії".
#,oppositionplanswithdrawal, Опозиція плани згортаються"Деякі опозиційні партії заявили, що вони відкличуть своїх представників з виборчих дільниць на майбутніх виборах на знак протесту проти передбачуваних історичних фальсифікацій на виборах. Вони будуть посилатися на це як на причину свого програшу, і їхні дії привели політичних активістів у шаленство".
#,parkrangerkilled, Вбитий доглядач парку,"Охоронець парку, який потривожив групу озброєних браконьєрів, був убитий сьогодні під час виконання службових обов'язків. Цінність зникаючих видів на чорному ринку означає, що браконьєри тепер готові вбивати".
#,pipelineprotests,Протести на трубопроводі,"Будівництво нафтопроводу викликало запеклі протести, оскільки він проходить по землі, що належить спільноті корінних громадян. Вони рішуче виступають проти впливу на навколишнє середовище та привернули міжнародну увагу та підтримку з усього світу".
