#,CryptocurrencyCrash!, Крах криптовалюти!"Зростання популярності криптовалюта привів до появи міхура, який просто лопнув. Мільйони самозайнятих втратили гроші. Тепер вони закликають до посилення регулювання Інтернет-валют".
#,FlashCrash, Раптовий збій,"Автоматизована торгівля зробила Фондовий ринок настільки крихким, що одна велика угода призвела до раптового стрибка цін на акції. Економісти закликають до негайного введення правил автоматичної торгівлі, щоб запобігти повторенню подібної катастрофи. Нашому ВВП було завдано серйозного удару".
#,accidentalshooting, Випадкова стрілянина"Рівень злочинності в нашій країні настільки високий, що вторгнення в будинки є реальною проблемою для всіх громадян. Знаменитість застрелила члена власної сім'ї в своєму будинку, стверджуючи, що вони прийняли його за непроханого гостя."
#,accountantsbusted, Заарештовані бухгалтери,"Журналістам, які розслідують складне податкове шахрайство, була передана і оприлюднена велика база даних зганьбленої зарубіжної бухгалтерської фірми. База даних містить відомості про тисячі заможних людей з нашої країни, включаючи політиків і знаменитостей, що показують, як саме вони ухилялися від сплати податків. Це домінує в циклі новин і викликає гнів через нерівність та наслідки необмеженого капіталізму".
#,affair, Інтрижка"Порнозірка публічно звинуватила вас у тому, що у вас з ними роман, і що ви заплатили їм гроші за мовчання, щоб зберегти вашу необачність в секреті. Гірше того, ці гроші за мовчання були отримані з коштів передвиборної кампанії, що є злочином. Пора знайти лакея низького рангу, який візьме на себе відповідальність за оплату, заперечує зв'язок і відкупиться від вашого обвинувача, щоб покінчити з цим".
#,aidtoeradicatedisease, "Допомога в боротьбі з ВІЛ", " Міжнародна організація виділила великий обсяг допомоги, спрямованої на викорінення виснажливої хвороби в нашій країні. Наш народ страждає, тому це вливання ресурсів для боротьби з хворобою можна тільки вітати. Однак те, що наш уряд потребує такої зовнішньої підтримки, піддалося критиці з боку патріотичних коментаторів".
#,aidtoeradicatepoverty,Допомога у викоріненні бідності"Міжнародна організація виділила великий обсяг допомоги, спрямованої на викорінення бідності в нашій країні. Наш народ страждає, тому це вливання ресурсів на боротьбу з бідністю можна тільки вітати. Однак те, що наш уряд потребує такої зовнішньої підтримки, піддалося критиці з боку патріотичних коментаторів".
#,airstrike, Авіаудар,"Заяви про накопичення запасів зброї масового знищення використовувалися в якості виправдання для бомбардувань військових об'єктів в нашій країні. Повітряна кампанія цієї іноземної військової коаліції знизить наш військовий потенціал і завдасть ще більшої шкоди міжнародним відносинам".
#,carpoolrapescandal, Скандал із зґвалтуванням на автобазі,"Найбільша компанія з обміну поїздками, що діє в країні, систематично придушує звинувачення в згвалтуваннях, висунуті проти їх водіїв. Журналісти-розслідувачі знайшли докази сотень повідомлень пасажирів про те, що працівникам служби підтримки було наказано не повідомляти в правоохоронні органи. У нових технологічних компаній так мало персоналу, що базові протоколи безпеки ігноруються в секторах, які вони руйнують".
#,celebrityopioiddeath,Смерть знаменитостей від опіоїдів"Молоду кінозірку знайшли мертвою у своїй квартирі, оточеній пляшками опіоїдів, що відпускаються за рецептом. Зазвичай використовується для короткочасного знеболення, цей клас ліків, що викликають звикання, заполонив аптечки нашої країни. Коли медична страховка не дозволяє оплатити нічого, крім дешевих таблеток, лікарям легко виписати опіоїди. Тисячі людей помирають від передозування під час цієї кризи".
#,centralbankfraud, Шахрайство Центрального банку,"Було встановлено, що посадові особи центрального банку здійснюють шахрайство, обмінюючи нові банкноти на підроблені. Коли інститути, які формують самі основи нашої фінансової системи, корумповані, як наш народ може довіряти керівництву цього уряду?"
#,civilservantsstrike, Страйк державних службовців,"Державні службовці проголосували за страйк через зарплату. Коли вашим роботодавцем є уряд, ви не можете просто звільнитися і знайти іншу роботу у конкурента. Державна служба часто є невдячною діяльністю, але слід очікувати винагороди, яка забезпечує розумний рівень життя".
#,coastaloilspill, Розлив нафти в прибережних районах,"Руйнівний розлив нафти знищив запаси місцевого рибальства, зруйнувавши спосіб життя місцевого сільського населення. Це витіснить їх з району в сусідні селища та весі та посилить неприязнь між тими, хто хоче захистити навколишнє середовище, та тими, хто хоче його експлуатувати".
#,corruptionarrests, Арешти за корупцію,"Корумповані чиновники були заарештовані за звинуваченням у розтраті. Тривала кампанія по боротьбі з корупцією призвела до цих гучних арештів. Наша нетерпимість до корупції стала очевидною, і ми показали, що ніхто не стоїть вище закону".
#,CryptocurrencyCrash, Крах криптовалюти,"Зростання популярності криптовалюта привів до появи міхура, який просто лопнув. Мільйони самозайнятих втратили гроші. Тепер вони закликають до посилення регулювання Інтернет-валют".
#,deadlyvirusoutbreak, Спалах смертельного вірусу,"Стався спалах смертельного вірусу, який забрав життя тисяч людей по всій країні. Виняткова вірулентність цього захворювання та високий рівень смертності пацієнтів є руйнівними. Міжнародні поїздки та торгівля були обмежені до тих пір, поки цей спалах не буде локалізовано".
#,deadlywatercontamination,Смертельне забруднення води,"Сотні тисяч громадян залишилися без безпечної питної води після того, як їх водопровідна вода була забруднена свинцем. Щоб заощадити гроші, їх муніципалітет переключив місцеві джерела водопостачання, але нова вода роз'їла свинцеві труби, по яких вона подавалася. До того, як було виявлено отруєння свинцем, загинуло дванадцять людей."
#,debtdeal, Боргова угода,"За посередництва наших міжнародних кредиторів була укладена угода з реструктуризації боргу нашої країни. Завдяки консолідації наших позик і забезпеченню їх грошовими потоками від підприємств, що перебувають у державній власності, наші процентні платежі були значно скорочені".
#,diplomaticimmunity, Дипломатичний імунітет,"Іноземний дипломат втік з країни після того, як імовірно загинув громадянин в автокатастрофі. Вони скористалися своїм дипломатичним імунітетом, щоб безперешкодно повернутися на батьківщину з боку правоохоронних органів. Незважаючи на те, що очікується, що вони будуть підкорятися закону, в межах наших кордонів знаходяться тисячі іноземних дипломатів, що діють всупереч йому. Громадськість розцінює це як грубу судову помилку, направляючи свій гнів на політичний клас".
#,diseaseeradicated, Хвороба ліквідована,"Тривала кампанія вакцинації, освіти та моніторингу призвела до викорінення хронічного, виснажливого захворювання в нашій країні. Ми повинні забезпечити захист цього статусу, щоб наші люди могли продовжувати жити вільними від цієї руйнівної хвороби".
#,disputedterritoryrepatriated, Спірна територія репатрійована,"Після рішення Міжнародного суду значна територія, на суверенітет над якою ми історично претендували, була репатрійована. Його нинішні окупанти завжди оскаржували наші претензії, але у них немає іншого вибору, крім як звільнити і передати право власності на цей район".
#,drought, Посуха,"Сезонні дощі так і не випали, і країна страждає від гострої посухи. Урожай гине, запаси води виснажуються, а чисельність домашньої худоби і диких тварин не може підтримуватися. При поліпшенні інфраструктури серйозність цієї ситуації можна було б пом'якшити".
#,dubiousrolemodel, Сумнівний зразок для наслідування,"Високопоставлений чиновник, якого Ви обрали особисто, в одній зі своїх промов похвалив сумнозвісного екстремістського диктатора. Можливо, за час свого правління вони вбили мільйони невинних людей, але у них було кілька цікавих ідей щодо державної інфраструктури".
#,electiondeclaredfreeandfair, Вибори оголошені вільними і справедливими,"Останні вибори були оцінені міжнародними спостерігачами як вільні і справедливі. Загальнонаціональні вибори-це один з небагатьох випадків, коли окремі особи можуть безпосередньо впливати на демократичний процес. Зберігаючи цілісність системи голосування, зберігається сама демократія".
#,electionflawed, Вибори зіпсовані"На думку незалежних груп спостерігачів, останні вибори не відповідали міжнародним стандартам. Загальнонаціональні вибори-це один з небагатьох випадків, коли окремі особи можуть безпосередньо впливати на демократичний процес. Підриваючи систему голосування, підривається сама демократія".
#,electionresultchallenged, Результати виборів оскаржені"Опозиція, яка програла останні вибори, рішуче стверджує, що мала місце фальсифікація бюлетенів. Вони оскаржують результати виборів у Верховному суді, найвищій судовій інстанції країни. Навіть якщо вони виявляться безуспішними, диму без вогню не буває, і електорат буде обурений".
#,embezzledfundsrecovered, Повернуто викрадені кошти"Гроші, виведені колишнім лідером, були повернуті з рахунків в іноземних банках. Оскільки рівень корупції в нашому суспільстві знижується, наші правоохоронні органи можуть безперешкодно виправляти помилки минулого".
#,environmentalconservationaid, Допомога в охороні навколишнього середовища"Міжнародна організація виділила великий обсяг допомоги, щоб допомогти в збереженні навколишнього середовища в нашій країні. Наше цінне природне середовище страждає, тому таке вливання ресурсів для боротьби з її занепадом можна тільки вітати. Однак те, що наш уряд потребує такої зовнішньої підтримки, піддалося критиці з боку патріотичних коментаторів".
#,extraditedhackerconvicted, Екстрадований хакер засуджений"Ми успішно екстрадували і засудили іноземного хакера, який скомпрометував ключові урядові комп'ютерні системи. Наш глобальний вплив і договори про екстрадицію завдали сьогодні удару по міжнародній кіберзлочинності".
#,extremiststate, Екстремістська держава"Екстремістське угруповання всередині нашої країни проголосило свою власну територіальну незалежність. Вони зі своїм ополченням захопили віддалений район, розташований недалеко від північного кордону нашої країни. Те, що ми не можемо захистити наш власний суверенітет, є звинуваченням у порушенні безпеки нашої країни. Ще більш тривожним є те, що ми створили середовище, в якому громадяни стали досить відчайдушними, щоб робити екстремальні дії, подібні до цього ".
#,factorycloses, Фабрика закривається"Великий роботодавець в нашій країні тільки що закрив один зі своїх автомобільних заводів, в результаті чого тисяча громадян були звільнені. В якості основних причин зупинки називають скорочення використання автомобілів нашим населенням, а також низьку продуктивність праці".
#,femaleleader, Жінка-лідер"Новим главою опозиції була обрана Жінка-лідер. Представництво жінок на найвищих рівнях державного управління стало результатом тривалої кампанії з боротьби з гендерною нерівністю в нашому суспільстві".
#,fgmreportshame, Ганебний звіт про КЖПО"Була опублікована доповідь шанованої міжнародної організації, в якій критикується значне поширення калічать операцій на жіночих статевих органах в нашій країні. Цей небезпечний ритуал корениться в гендерній нерівності і серйозно погіршує сексуальне здоров'я жертв".
#,foodscandal,Продовольчий скандал"Працюючі під прикриттям тележурналісти опублікували шокуючі кадри умов на ряді боєнь в нашій країні. Хоча мало хто не знає, що дешеве м'ясо має свої витрати, це різко підкреслює реальність того, як виробляються наші продукти харчування. Прихильники органічної їжі та веганства називають це поворотним моментом у громадській думці з цього питання".
#,foodshortages, Нестача продовольства"Міжнародна допомога хлинула в країну після того, як гостра нестача продовольства призвела до голоду наших громадян. Погані умови навколишнього середовища та скомпрометована інфраструктура підірвали наше внутрішнє виробництво. Наш народ страждає, тому це вливання ресурсів для боротьби з голодом можна тільки вітати. Однак те, що наш уряд потребує такої зовнішньої підтримки, піддалося критиці з боку патріотичних коментаторів".
#,foreignneighbournuclearmissiletest, Ядерна ракета іноземного сусіда випробування"Розробка ядерної зброї залишається еталоном глобальної військової значущості. Сусідня ізоляціоністська нація випробувала ракету в рамках своєї ядерної програми недалеко від нашого кордону".
#,formermilitaryleaderssentenced, У суді були винесені вироки військовим лідерам "коаліції на чолі з суджені", які активно придушували демократичний прогрес. Це впливові люди, і наша судова система мужньо відстоює закони нашої країни. Ми зробили рішучу заяву: ніхто не стоїть вище закону, і правосуддя восторжествує".
#,formerspypoisoned, "Колумбійський шпигун отруній" колишній іноземний шпигун, якому було надано притулок в нашій країні, був убитий своїми колишніми кураторами. Шпигун раптово захворів після відвідин ресторану, де ворожі оперативники підсипали йому в напій радіоактивну речовину. Громадяни панікують через потенційний вплив отрути в громадському місці, а патріоти в жаху від того, що така операція може бути проведена на території країни".
#,fuelshortage, "Нестача палива", " Паливні насоси пересохли на під'їзних доріжках гаражів нашої країни. Внутрішнє виробництво не може задовольнити попит, а імпорт палива був скорочений через проблеми з логістикою і високого рівня світового споживання".
#,garbagescam,Сміттєва афера"Тонни сміття, відправленого за кордон на переробку, були повернуті. Контейнери, повні небажаних відходів нашого суспільства, були помилково позначені як перероблені пластмаси. Екологи обурені фундаментальним провалом програми утилізації відходів в нашій країні. Ця національна ганьба потрапила в заголовки газет по всьому світу".
#,gigeconomypressure, "Лещат на економіку", " водій маршрутного таксі визнав себе винним у викраденні свого пасажира, щоб підвищити вартість проїзду, і в поїздці в інше місто, поки вони спали. У суді водій назвав фінансовий тиск мотивацією, оскільки їм було важко сплачувати щомісячні рахунки. Працівники гіг-економіки впадають у відчай, оскільки їхні трудові права та рентабельність підриваються руйнівними корпораціями".
#,globalhitdrama,Світова драма-хіт"Драма побутового періоду стала світовою сенсацією. Більше ста країн придбали права на трансляцію шоу. Його масова привабливість принесла телевізійні нагороди по всьому світу. Цей розважальний феномен в даний час є одним з найбільших в країні експортних товарів".
