#,CurrencyStrength, Зміцнення валюти,"Відносна сила вашої валюти на світових ринках. Сильна економіка підвищить цю вартість, що зробить експорт менш конкурентоспроможним і скоротить доходи від експорту, а також знизить купівельну спроможність туристів, і навпаки".
#,FoodPrice, Ціни на продукти харчування,"Середня ціна на продукти харчування визначається внутрішнім виробництвом продуктів харчування та імпортом. Зростаюче населення світу і все більш ресурсомістке виробництво продуктів харчування сприяють зростанню цін на продовольство і в кінцевому підсумку можуть привести до кризи цін на продовольство".
#,AverageTemperature, Середня температура,"Середня температура по всьому світу підвищується. Обмеження викидів CO2 та участь у міжнародних договорах можуть уповільнити розвиток, але не зупинити його. Більш високі середні температури призводять до стихійних лих і посилення світової конкуренції за воду та інші природні ресурси."
#,Lifespan, Тривалість життя,"Очікувана тривалість життя окремої людини. Це може бути посилено технологічним прогресом і зменшено забрудненням навколишнього середовища, хворобами та іншими явищами".
#,InternetCurrencyAdoption,Впровадження криптовалюти,"Рівень впровадження криптовалют, якими торгують через Інтернет".
#,IndustrialAutomation, Промислова автоматизація,"Це значення описує загальний стан автоматизації у вашій галузі. Чим більше чисельність робочої сили роботів, тим вище їх цінність. Автоматизація скорочує робочий тиждень і підвищує продуктивність, але за рахунок того, що багато низькокваліфікованих працівників залишаються без роботи".
#,HealthcareDemand, Попит на охорону здоров'я,"Частота, з якою середньостатистичний громадянин буде пред'являти вимоги до галузі охорони здоров'я або послуги. Цей показник буде нижче при більш здоровому населенні в цілому, але, навпаки, буде вище при наявності більш досконалих технологій, що дозволяють проводити більш складне і просунуте лікування".
#,InternetSpeed, Інтернет Швидкість,"Загальний стан ІТ-інфраструктури в країні, який на особистому рівні виражається в доступності та середній швидкості доступу до Інтернету як за допомогою наземних, так і бездротових/мобільних технологій"
#,Veganism, Рослинні дієти,"Частка населення, яке є веганом або вегетаріанкою, а також тих, хто вважає себе "флекситаріанцями", навмисно вживає менше м'яса або проводить дні без м'яса щотижня"
#,GenerationalWealthGap, Розрив у добробуті поколінь,"Ступінь, в якій люди похилого віку багатші за молодих, що може спричинити соціальний поділ і часто пов'язане з цінами на нерухомість".
#,ElectricCarTransition, Перехід на електромобілі,"Прогрес у переході суспільства від використання транспортних засобів, що працюють на викопному паливі, до використання електромобілів, які завдають меншої шкоди навколишньому середовищу"
#,PrivateTelecoms, Телекомунікаційна галузь,"У більшості країн телекомунікаційна галузь перебуває у приватній власності конкуруючих компаній, але держава може захотіти націоналізувати цю галузь або контролювати її, щоб забезпечити всіх".
#,PrivateWater, Водна промисловість,"Водною галуззю може керувати ряд приватних компаній, але це природна монополія, і вона часто регулюється або навіть націоналізується".
#,PrivateRail, Залізнична промисловість,"Приватні залізничні компанії стверджують, що вони є більш ефективними, але є природною монополією і іноді націоналізуються, щоб дозволити державі субсидувати громадський транспорт".
#,PrivateEnergy, Енергетика,"Хоча в багатьох країнах є конкуруючі Електроенергетичні та газо-нафтові компанії, можна стверджувати, що енергетичний ринок є природною монополією".
#,BusinessConfidence, Ділова впевненість,"Понад усе бізнесу подобаються стабільність і верховенство закону. Будь-яка невизначеність зменшить ділову впевненість та інвестиції і, таким чином, в кінцевому підсумку вплине на ВВП".
#,Population, Населення,"Як багато людей живе в нашій великій країні. Висока чисельність населення може призвести до економічних проблем, пов'язаних із ціною на землю та доступністю природних ресурсів".
#,Inflation, Інфляція,"Показник швидкості, з якою ціни і заробітна плата зростають щороку. Взагалі кажучи, інфляція повинна бути низькою, але не "занадто низькою". Низька інфляція несе ризик дефляції, яка може паралізувати економіку, тоді як занадто висока інфляція загрожує гіперінфляцією та економічним колапсом".
#,Charity, Благодійність,"Пожертви від представників громадськості та корпорацій на будь-які благодійні цілі. Люди можуть жертвувати лише те, що вони можуть собі дозволити, і на їхню схильність до пожертв може впливати те, чи бачать вони прогалини у забезпеченні державних цілей".
,,,
#,HumanDevelopment, Людські ресурси розвиток,"Середній рівень людського розвитку у вашій країні. Цей показник має три виміри для всього вашого населення: його здоров'я, рівень освіти та дохід. Високий рівень людського розвитку приверне імміграцію та Культурний туризм і є показником розвитку вашої країни в цілому".
#,Corruption, Корупція,"Будь-яка форма нечесної або неетичної поведінки з боку осіб, які займають керівні посади, як у державному, так і в приватному секторах. Корупція гальмує вашу економіку, оскільки ресурси крадуться або витрачаються неефективно, і це знижує інтерес іноземних держав до допомоги та інвестицій. Виборці стають все більш недовірливими до адміністрації своєї країни в міру зростання корупції".
#,ForeignAidReceived, Отримана іноземна допомога,"Обсяг отриманої іноземної допомоги. Ресурси можуть бути переведені з однієї країни в іншу з цілого ряду причин. Якщо ваша країна бідна і має гострі проблеми, які можуть бути вирішені за допомогою допомоги, вона може бути надана в гуманітарних і альтруїстичних цілях. Іноземна допомога також може бути надана на знак дипломатичного схвалення, для зміцнення Альянсу або отримання комерційного доступу до ресурсів вашої країни."
#,Democracy, Демократія"Стан," демократії у вашій країні. Цей показник відображає рівень впровадження демократичних систем, які заохочують виборчий плюралізм, участь у політичному житті, громадянські свободи та функціонування уряду. Як лідер, обмеження демократії є методом отримання особистої влади і контролю над громадянами вашої країни, але може бути зустрінуте з широким несхваленням".
#,GenderEquality, Гендерна рівність,"Міра рівності між громадянами жіночої та чоловічої статі. Соціально сконструйовані гендерні ролі можуть призвести до нерівного поводження та сприйняття індивідів залежно від їх статі. Аспекти гендерної нерівності вимірюються з точки зору репродуктивного здоров'я жінок, розширення їх можливостей та участі на ринку праці."
#,Stability, Стабільність,"Стабільність держави. Це показник того, наскільки стабільний діючий режим у вашій країні, з урахуванням широкого спектру показників для оцінки ризику краху. Нестабільність матиме вплив на Міжнародні відносини, інвестиції та туризм і вказує на те, що в управлінні вашою країною існують фундаментальні проблеми".
#,ForeignInvestment, Іноземні інвестиції,"Обсяг інвестицій у вітчизняні підприємства та інфраструктуру з боку іноземних інвесторів. Інвестори можуть визначити вашу країну як гарне місце для інвестування, якщо вона вважається стабільною та пропонує переваги перед конкуруючими територіями, такими як продуктивна та дешева робоча сила. "
#,Emigration, Еміграція,"Показник кількості людей, які вирішили назавжди залишити цю країну і оселитися в іншому місці, що може бути викликано економічними причинами або побоюваннями щодо стабільності або безпеки країни".
#,IllegalImmigration, Нелегальна імміграція,"Показник кількості людей, яким вдається в'їхати в нашу країну, незважаючи на відсутність належних документів. Це може бути зменшено за рахунок посилення прикордонного контролю та подібних заходів. Багато тих самих сил, які керують імміграцією, також керують нелегальною імміграцією".
#,RareEarthPrice, Ціни на рідкоземельні метали,"Поточна вільна ринкова ціна на безліч спеціальних МЕТАЛІВ, що використовуються у високотехнологічному обладнанні, такому як смартфони, електромобілі, вітрові турбіни та комп'ютерне обладнання. Хороший запас таких металів необхідний для високотехнологічної економіки".
#,MentalHealth, Психічне здоров'я,"Показник поточного стану психічного здоров'я наших громадян. Проблеми психічного здоров'я можуть покласти величезний тягар на медичних працівників і зменшити загальне щастя наших громадян, тому це має бути головним пріоритетом для кожного уряду. Розумний баланс між роботою та життям може допомогти, екстремальні проблеми, такі як надзвичайно високий рівень злочинності, наркоманія та бідність, погіршать психічне здоров'я, як і погане середовище".

#,youthcrime,"Молодіжна злочинність","Молодіжна злочинність являє собою будь-який злочин, вчинений усіма особами у віці до 18 років".,
#,StrayAnimals,""Бродячі тварини","бродячі тварини-це будь-які тварини, які не мають будинку або бродять вулицями, будь то собаки, коти, мавпи чи інші подібні тварини".,
#,OrphansAndHomelessMinors,"Неповнолітні сироти та бездомні","неповнолітні сироти та бездомні у віці від 0 до 17 років не можуть піклуватися про себе або захищати себе".,

#,MilitaryPower,Військова сила,"Сильна військова сила є важливою частиною впливу на глобальному рівні та забезпечення безпеки нашої країни. Є багато способів збільшити потужність нашої армії та її досяжність, що призведе до сильнішої та різноманітнішої бойової сили."
#,GlobalInfluence,Глобальний вплив,"Не всі країни мають рівну вагу у питаннях впливу на політику в світі. Ті, хто економічно важливі, мають потужну армію або технологічно розвинені, мають перевагу у глобальних справах. Коли ми збільшуємо наш глобальний вплив, ми матимемо більше важелів для впливу на інші країни світу."
#,ForeignThreat,Міжнародна оцінка загроз,"Хоча повномасштабні війни між глобальними потужностями стали значно рідшими в XXI столітті, міждержавні конфлікти продовжують існувати у більш приглушеному вигляді. Шпигунство, втручання у вибори та кібер-війну — це всі трюки, які використовуються проти суперників. Ми можемо зменшити це за допомогою союзів, розміщення військ та можливих контрзаходів. Ми ніколи не дізнаємось точні плани наших ворогів, тому всі оцінки, які ми маємо, є наближеними до істини."
#,ActualThreat,НЕВІДОМО,hidden
#,GlobalStability,Глобальна стабільність,"Крім стабільності окремої країни, нації повинні також піклуватися про загальну стабільність глобального клімату. Війни, катастрофічні катастрофи та зміни клімату можуть дестабілізувати багато країн одночасно. При високому рівні хаосу тероризм та конфлікти поширюються. Формуючи союзи з іншими країнами та здійснюючи глобальний порядок за допомогою нашої армії, ми можемо допомогти підвищити стабільність."
