#,GlobalCO2, Глобальні викиди CO2,"Кількість вуглецю, яку ми викидаємо в атмосферу. Екологи та більшість вчених сходяться на думці, що обмеження викидів СО2 є життєво важливим кроком, який ми повинні зробити для боротьби зі зміною клімату. Нездатність контролювати наші викиди може знизити наш міжнародний авторитет і вплинути на Міжнародні відносини. Бурхливо розвивається економіка, якщо її не зупинити, призведе до збільшення викидів вуглекислого газу, а також до зростання числа автомобільних і авіаперельотів. Існує широкий спектр різних стратегій, які можна використовувати для мінімізації рівня викидів CO2."
#,Health, Охорона здоров'я,"Загальний показник здоров'я ваших громадян, який вимірює фізичну форму та загальний добробут людей".
#,Education, Освіта,"Показник рівня освіти середньостатистичного громадянина. Не тільки грамотність, а й вміння рахувати і загальне розуміння всього - від історії до інформаційних технологій і науки".
#,CrimeRate, Злочинність,"Показник загального рівня ненасильницьких злочинів у вашій країні. Це включає в себе такі злочини, як викрадення автомобілів, крадіжка зі зломом і т.д., але також охоплює шахрайство та інші подібні злочини".
#,ViolentCrimeRate, Насильницькі злочини,"Більш тривожний показник, ніж загальний рівень злочинності, він вимірює частоту насильницьких злочинів, таких як вбивства, зґвалтування та грабежі. Насильницькі злочини викликають занепокоєння у всіх в країні".
#,PovertyRate, Бідність,"Один з найбільш широко використовуваних показників порівняння між націями. Рівень бідності періодично переглядається, але всі країни повинні прагнути до того, щоб рівень бідності в них був якомога нижче".
#,Equality, Рівність,"Існує багато способів виміряти рівність. Консерватори говорять про рівність можливостей, соціалісти говорять про рівність результатів. Це лише простий вимір розподілу багатства (фінансова рівність результатів)".
#,Environment, Навколишнє середовище,"Загальне вимірювання якості навколишнього середовища, включаючи якість повітря, а також вимірювання шумового забруднення, сміття, якості води та багатьох інших показників забруднення".
#,WorkingWeek, Робочий тиждень,"Кількість годин, відпрацьованих в середньому вашими громадянами на тиждень. В умовах нестабільної економіки це може відрізнятися від договірних годин, оскільки люди змушені працювати неоплачувано або оплачувано понаднормово, щоб зберегти свою роботу. Співробітники вважають, що скорочення робочого дня-це добре".
#,Technology, Технологія,"Загальний показник рівня технологічної розвиненості країни, включаючи відсоток громадян, що мають доступ в Інтернет і високошвидкісний широкосмуговий зв'язок, а також технологічні знання студентів і можливості промисловості. Високий технологічний Індекс підвищує міжнародну конкурентоспроможність. Для залучення високотехнологічної промисловості можуть знадобитися податкові пільги".
#,CarUsage, Використання автомобілів,"Показник того, скільки миль на рік середньостатистична сім'я проїжджає на автомобілі. Інтенсивне використання автомобілів може призвести до забруднення навколишнього середовища, але це неминуче в умовах бурхливої економіки та поганого забезпечення громадським транспортом".
#,RailUsage, Використання залізниць,"Показник кількості поїздок, які здійснюються залізницею. Прихильники громадського транспорту будуть прагнути до збільшення використання залізничного транспорту, щоб зменшити як затори на дорогах, так і забруднення навколишнього середовища. Залізничні перевезення можуть бути дуже ефективними в густонаселених країнах, але покращення залізничної інфраструктури може бути надзвичайно дорогим і трудомістким".
#,BusUsage, Використання автобусів,"Показник кількості поїздок, що здійснюються автобусом, на відміну від автомобільних, повітряних або залізничних. Автобуси більш екологічні, ніж автомобілі, тому розглядаються як спосіб зменшити забруднення навколишнього середовища, а також зменшити затори на дорогах".
#,WorkerProductivity,Продуктивність праці,"Середній результат у фінансовому вираженні для типового громадянина. У деяких країнах працівники є більш продуктивними, ніж в інших, завдяки таким факторам, як трудова етика, технічні знання та робочий час".
#,Unemployment, Безробіття,"У найпростішому вигляді це підрахунок відсотка вашого населення, яке не має оплачуваної роботи. Скориговано таким чином, щоб виключити тих громадян, які з тієї чи іншої причини активно не шукають роботу".
#,CO2Emissions, Викиди CO2,"Кількість вуглецю, яку ми викидаємо в атмосферу. Екологи та більшість вчених сходяться на думці, що обмеження викидів СО2 є життєво важливим кроком, який ми повинні зробити для боротьби зі зміною клімату. Нездатність контролювати наші викиди може знизити наш міжнародний авторитет і вплинути на Міжнародні відносини. Бурхливо розвивається економіка, якщо її не зупинити, призведе до збільшення викидів вуглекислого газу, а також до зростання числа автомобільних і авіаперельотів. Існує широкий спектр різних стратегій, які можна використовувати для мінімізації рівня викидів CO2."
#,AirTravel, Авіаперельоти,"Авіаперельоти часто тісно пов'язані з економікою країни і, отже, з ВВП. Заможніші громадяни частіше відпочивають за кордоном, а багатша економіка означатиме більше ділових авіаперельотів та більше товарів, що відправляються повітряним транспортом. Обсяг авіаперевезень дуже чутливий до ціни, тому зміни у витратах на паливо, податках та інших зборах можуть мати суттєвий вплив".
#,Immigration, Імміграція,"Імміграція вимірює кількість людей, які фактично в'їжджають в цю країну на законних підставах з наміром зробити її своїм новим будинком. Імміграція, як правило, спричинена сильною економікою, оскільки ті, хто живе в бідніших країнах, шукають роботу та вищий рівень життя. Імміграцію можна скоротити за допомогою регулювання, але це може призвести до зростання нелегальної імміграції. Занадто багато імміграції та занадто швидкі темпи можуть призвести до зростання расової напруженості".
#,ImmigrationDemand, Попит на імміграцію,"Імміграція вимірює кількість людей, які бажають в'їхати в цю країну, як легально, так і нелегально, з наміром зробити її своїм новим домом".
#,EnergyEfficiency, Енергоефективність,"Це загальний показник того, наскільки ефективно країна використовує свої енергетичні ресурси. Низькі стандарти енергоспоживання автомобілів і відсутність інвестицій в нові технології означатимуть марнотратну економіку і, в свою чергу, більш високий попит на викопні види палива, такі як нафта. Скорочення енергоспоживання останнім часом стало більш актуальним через побоювання з приводу зміни клімату і прагнення скоротити викиди CO2."
#,RacialTension,Расова напруженість,"Ступінь, в якій існує незручність між різними національностями та культурами. Раптова, неконтрольована імміграція іноді може призвести до расової напруженості, яка в гіршому випадку може вилитися в запеклі зіткнення".
#,ForeignRelations, Міжнародні відносини,"Міжнародні відносини важливі з двох причин: по-перше, як спосіб запобігання переростання суперечок у війни або тероризм, які можуть загрожувати нашим громадянам, і, по-друге, як спосіб забезпечити хороші торговельні відносини і економічну вигоду від торгівлі і туризму з іншими країнами".
#,InternationalTrade, Міжнародна торгівля,"Міжнародна торгівля, як правило, корисна для економіки в силу Закону порівняльних переваг, ефективно допомагаючи кожній країні виробляти те, що у неї виходить найкраще. Торгівля може бути обмежена політичними проблемами з іншими країнами, де суперечки можуть призвести до введення імпортних тарифів та санкцій. У деяких випадках країни також вдаються до "протекціонізму", щоб захистити політично чутливі галузі від іноземної конкуренції".
#,OilDemand, Попит на нафту,"Наш попит на нафту обумовлений промисловістю, автомобільними і повітряними перевезеннями. Чим більше наші громадяни літають і їздять, тим більший наш попит на нафту, хоча заходи з енергоефективності та гібридні автомобілі можуть дещо знизити цей показник, як і інвестиції в екологічно чисту промисловість та Відновлювані джерела енергії".
#,OilSupply, Пропозиція нафти,"Наші запаси нафти дійсно можуть бути розширені тільки за рахунок відкриття нових ділянок нашої території для буріння, що може бути політично і екологічно важко. Разом із попитом на нафту пропозиція визначає ціну, що має сильний вплив на нашу економіку".
#,OilPrice, Ціна на нафту,"Ціна на нафту впливає на економіку, при цьому більш високі ціни знижують наш загальний рівень життя, хоча це буде пом'якшено заходами з підвищення енергоефективності. Більш низький рівень залежності від нафти також зробить нас менш чутливими до шоків світових цін на нафту, викликаних політичною нестабільністю".
#,_Terrorism,Terrorism,hidden
#,_LowIncome, Низький заробіток,"Ефективний дохід тих людей, які мають низький заробіток (або взагалі не мають його) в нашому суспільстві. Якщо це значення підніметься досить високо (за рахунок пільг і податкових звільнень для бідних), то більше людей виберуться з бідності і перейдуть в групу із середнім рівнем доходу. Прогресивне оподаткування в поєднанні з добре фінансованими державними послугами та державними пільгами є найпопулярнішими способами "вивести людей" з бідності".
#,_MiddleIncome, Середній заробіток,"Ефективний дохід цих людей залежить від середнього заробітку, а не від багатих чи бідних. Як правило, це найчисленніша група людей в економіці, тому політика, яка впливає на це значення, може мати вирішальне значення при голосуванні. Очікується, що люди із середнім рівнем доходу володітимуть власними будинками (або купуватимуть їх) і часто володітимуть одним або кількома автомобілями. Вони, ймовірно, проводять відпустку за кордоном принаймні раз на рік. Податки, які впливають на будь-який з них, найсильніше вдарять по цим людям і можуть увергнути деяких з них у злидні"
#,_HighIncome, Високий заробіток,"Реальний дохід найбільш високооплачуваних людей в суспільстві. Це легко зменшити за допомогою каральних податків на багатих, їх майно, спадщину та такі види діяльності, як авіаперельоти, яким вони часто віддаються. Також можна принести їм користь, пропонуючи податкові пільги та лазівки для багатих або надаючи перевагу регресивному оподаткуванню, такому як податок з продажу, а не прогресивному податку на прибуток".
#,GDP, ВВП,"Валовий внутрішній продукт вашої країни. Це визначається як загальна ринкова вартість усіх товарів та послуг, вироблених у країні за рік. Це хороший універсальний показник сили вашої економіки і загального добробуту країни. Одним із факторів, що сприяють, є глобальний економічний цикл, який має тенденцію бути циклічним і поза вашим контролем."
#,PrivateHealthcare, Приватна охорона здоров'я,"Розмір приватного сектора охорони здоров'я. Це, природно, виникне через попит і пропозицію і збільшиться в часи буму, але може бути зменшено шляхом створення гідної державної системи охорони здоров'я. Недоліком приватної охорони здоров'я є те, що найбідніші верстви суспільства не можуть собі цього дозволити, а також можуть уникати лікування, поки воно не стане необхідним для економії коштів".
#,PrivateHousing, Приватне житло,"Розмір приватного житлового сектора. Приватне житло, природно, реагуватиме на попит та пропозицію, але може бути штучно зменшено за рахунок пропозиції житла, що субсидується державою, або контролю за орендною платою в приватному секторі".
#,PrivateSchools, Приватні школи,"Розмір приватного сектору освіти. Це скоротиться, якщо держава забезпечить високоякісну систему державної освіти. У важкі економічні часи в суспільстві буде багато тих, хто не зможе дозволити собі приватну освіту".
#,PrivatePensions, Приватні пенсії,"Розмір приватного пенсійного сектора. Це може здійснюватися паралельно з мінімальною державною пенсією або повністю замінити її в країнах, які з радістю залишають планування виходу на пенсію приватним особам. Багато бідних членів суспільства не матимуть коштів для того, щоб належним чином накопичити на пенсію без допомоги держави".
#,TobaccoUse, Вживання тютюну,"Популярність куріння серед вашого населення. Очевидно, що куріння знижує рівень здоров'я вашого населення і, отже, може вплинути на його продуктивність. Крім того, куріння ляже додатковим тягарем на витрати на охорону здоров'я".
#,AlcoholConsumption, Споживання алкоголю,"Рівень споживання алкоголю у вашій країні.  Високий рівень споживання означатиме, що держава заробляє значну суму на будь-яких податках на алкоголь, але це також може призвести до зростання злочинності, антисоціальної поведінки та зниження рівня здоров'я та продуктивності праці".
#,TrafficCongestion, Затори на дорогах,"Рівень пробок на Ваших дорогах. В основному це стосується приватних автомобілів, тому зменшення використання автомобілів запобіжить перетворенню цього на проблему. Подорож на автобусі або поїзді набагато ефективніше і допоможе зменшити затори навіть у часи економічного буму".
#,Tourism, Туризм,"Розмір туристичної індустрії. Туристи віддадуть перевагу відвідати країни, де немає серйозних соціальних проблем, а також низькі податки з продажів. Гідна репутація вашої країни за кордоном також сприятиме розвитку туризму. Загалом туризм розглядається як позитивний фактор, оскільки він приносить гроші в економіку. Стимулювання туризму може частково залежати від низьких витрат на авіаперевезення, що може мати наслідки для забруднення навколишнього середовища та викидів CO2".
#,Wages, Заробітна платня,"Середній рівень заробітної плати у вашій країні. Заробітна плата, як правило, визначається попитом та пропозиціями, що приблизно відповідає пропозиції робочої сили та стану економіки (ВВП). Імміграція збільшує пропозицію робочої сили, знижуючи заробітну плату, а високий рівень безробіття також чинитиме тиск на заробітну плату. Трудове законодавство, включаючи мінімальну заробітну плату, може штучно підвищити заробітну плату, хоча це матиме побічні ефекти".
#,LegalDrugConsumption, Легальне споживання наркотиків,"Кількість легальних наркотиків, таких як Каннабіс, героїн та екстазі, які споживаються в країні. Очевидно, що якщо ці препарати нелегальні, то це значення дорівнюватиме нулю. Оскільки ці ліки є товаром, доступним на вільному ринку, на їх споживання впливатиме ВВП країни, а також ступінь їх легальності. Деякі уряди, можливо, побажають використовувати їх споживання в якості об'єкта оподаткування."
