#,Be filmed feeding a baby lamb,Laat je filmen terwijl je een lammetje voedt,"Niets verwarmt de harten van kiezers meer dan het zien van een politicus die voor een klein schattig dier zorgt, zolang ze eruit zien alsof ze zich op hun gemak voelen en ervan genieten, en de dieren zich gedragen. Wat kan er misgaan?"
#,Attend funeral of police officer killed in line of duty,Begrafenis bijwonen van politieagent die tijdens zijn werk is omgekomen,"Het bijwonen van de begrafenis van een dappere politieagent die tragisch om het leven is gekomen tijdens het uitvoeren van zijn plicht, toont zeker je medelevende kant, zolang de rouwende familieleden het niet erg vinden dat je daar bent, en je aanwezigheid niet wordt opgevat als cynisch, of manipulatief, of gewoon in slechte smaak."
#,Give speech in church after shooting.,Toespraak houden in de kerk na het schieten.'Als je een toespraak houdt over het onrecht en de tragedie van een schietpartij, kun je extreem medelevend overkomen, zolang je er niet uitziet alsof je je emoties in de maling neemt of probeert een tragedie om te zetten in een politieke kans."
#,Visit aftermath of flood,Bezoek de nasleep van de overstroming,"Snel ter plaatse komen na een overstroming, getuigt zeker van uw medeleven met de mensen die tragisch zijn getroffen door deze gebeurtenis, op voorwaarde dat uw colonne de reddingswerkers niet afremt, en de lokale bevolking blij en niet woedend is om u hun onderwaterhuizen te zien inspecteren. ."
#,Judo with special forces,Judo met speciale krachten,"Niets zegt zoveel 'sterk' als het verslaan van de experts van de speciale strijdkrachten van het land in vechtsporten, op voorwaarde dat je er niet belachelijk uitziet, een been breekt, of het lijkt alsof ze je opzettelijk laten winnen."
#,Be interviewed while jogging,Geïnterviewd worden tijdens het joggen,"Voor een sterke politicus is niets natuurlijker dan alleen de tijd te vinden voor een interview tijdens je reguliere trainingssessie, zolang je maar echt fit bent, en door de lengte van een interview kunt joggen zonder in te storten of te verdrinken in het zweet."
#,Windsurfing photo-op,Windsurfen foto-op,"Het lijkt alsof je de touwtjes in handen hebt en tegen de elementen kunt winnen door windsurfen als fotomoment. Er kan niets fout gaan, ervan uitgaande dat er daadwerkelijk genoeg wind is, dat je echt weet hoe je moet windsurfen en dat het er niet elitair uitziet en pretentieus."
#,Play in a charity football match,Speel in een liefdadigheidsvoetbalwedstrijd,"Pronk met je energie en vitaliteit door een onschuldig en leuk potje voetbal te spelen voor het goede doel. Dit zou makkelijk moeten zijn, zolang je maar echt goed speelt en wint, maar niet te veel wint, want dat lijkt op valsspelen, en natuurlijk speel niet vals of speel niet ruw!"
#,Be filmed hunting with a rifle,Gefilmd jagen met een geweer, "Verschijn sterk en zelfverzekerd door je dapperheid te tonen met een geweer en te gaan jagen. Zorg ervoor dat je echt iets raakt, zodat je er niet incompetent uitziet, maar niet te veel dingen doodt, of eruitzie alsof je het leuk vindt, of eruitziet je vindt het niet leuk. Kun je dat doen?"
#,Be interviewed on morning television,Geïnterviewd worden op de ochtendtelevisie,"Laat zien dat je niets te verbergen hebt door geïnterviewd te worden in een luchtige, leuke ochtend-tv-show die de ware jij blootlegt. Probeer dominant en intelligent te lijken, maar ook nuchter en herkenbaar. Serieus maar ook leuk. Ook natuurlijk, maar toch uitzonderlijk ."
#,Eat breakfast in a typical builders cafe,Ontbijt in een typisch bouwcafé,"Niets is eenvoudiger en beter om te laten zien dat je een gewone burger bent, dan te genieten van een lekker traditioneel ontbijt in een gewoon café voor werkende mensen. Je weet natuurlijk wat je moet bestellen en hoe je het perfect natuurlijk kunt eten voor 200 camera's."
#,Be filmed watching the a sports team play,Laat je filmen terwijl je het sportteam ziet spelen,"Als gewone burger ben je duidelijk een grote fan van de nationale sport van het land en geniet je van niets anders dan het team aan te moedigen terwijl ze spelen. Dit veronderstelt duidelijk dat je de sport echt volgt, enig idee hebt wat de regels zijn en de naam van ten minste één speler."
#,Appear on a televised genealogy program,Verschijnen in een genealogisch programma op televisie,"Een populaire tv-show die de voorouders van mensen volgt, zal mensen helpen om de echte jij te zien en je achtergrond te begrijpen. Dit zal je veel herkenbaarder maken, ervan uitgaande dat je niet in verlegenheid wordt gebracht zoals je voorouders criminelen, slavenhandelaars of onthutsend rijk blijken te zijn. "
#,Carve promises in stone,Beloften in steen kerven,"Wat is er normaler dan de wens om je politieke beloften letterlijk in een gigantische steen te kerven en buiten het parlementsgebouw op te richten om iedereen aan je betrouwbaarheid te herinneren. Dit zal op geen enkele manier ooit een echt gek idee lijken."
