#,Be filmed feeding a baby lamb, Бути знятим годуючим ягняти"Ніщо так не зігріває серця виборців, як спостереження за політиком, який доглядає за маленькою милою твариною, за умови, що вони виглядають так, ніби їм комфортно і вони отримують від цього задоволення, а тварини поводяться належним чином. Що взагалі може піти не так?"
#,Attend funeral of police officer killed in line of duty, Бути присутнім на похоронах поліцейського, убитого під час виконання службових обов'язків"Відвідування похорону хороброго поліцейського, який трагічно загинув під час виконання службових обов'язків, безсумнівно, показує вашу співчутливу сторону, якщо скорботні родичі не заперечують проти вашої присутності там, і ваша присутність не сприймається як цинічна, маніпулятивна або просто несмачна".
#,Give speech in church after shooting., Виголосити промову в церкві після стрілянини., "Виголошення промови про несправедливість і трагедію стрілянини може змусити вас здатися надзвичайно співчутливим, якщо ви не виглядаєте так, ніби підробляєте свої емоції або намагаєтесь перетворити трагедію на політичну можливість".
#,Visit aftermath of flood,Відвідати наслідки повені"Швидке прибуття на місце події після повені, безумовно, свідчить про ваше співчуття до тих людей, які трагічно постраждали в результаті події, за умови, що ваш кортеж не затримає рятувальників, а місцеві жителі щасливі, а не в люті, бачачи, як ви оглядаєте їх підводні будинки".
#,Judo with special forces, Дзюдо зі спецназом"Ніщо так не говорить про "силу", як перемога над експертами спецназу країн з бойових мистецтв, за умови, що в кінцевому підсумку ви не будете виглядати безглуздо, не зламаєте ногу або не буде виглядати так, ніби вони навмисно дозволяють вам перемогти".
#,Be interviewed while jogging, Дати інтерв'ю під час пробіжки підтюпцем"Для сильного політика немає нічого більш природного, ніж знайти час для співбесіди лише під час вашої звичайної тренування, за умови, що ви дійсно в хорошій формі і можете бігати протягом усього інтерв'ю, не падаючи в непритомність і не обливаючись потім".
#,Windsurfing photo-op, Фотосесія віндсерфінгу,"Виглядайте так, ніби ви контролюєте ситуацію і можете перемогти стихію, займаючись віндсерфінгом в якості можливості сфотографуватися. Ніщо не може піти не так, якщо припустити, що вітру дійсно достатньо, що ви дійсно вмієте займатися віндсерфінгом і що це не виглядає елітарно і претензійно".
#,Play in a charity football match, Взяти участь у благодійному футбольному матчі"Продемонструйте свою енергію і життєлюбність, зігравши в нешкідливу і веселу гру в футбол на благодійність. Це повинно бути легко, якщо ви дійсно добре граєте і виграєте, але не вигравайте занадто багато, оскільки це виглядає як шахрайство, і, очевидно, не обманюйте і не грайте грубо!"
#,Be filmed hunting with a rifle, Бути знятим на полюванні з рушницею"Проявіть силу і впевненість в собі, продемонструвавши свою майстерність володіння рушницею і відправившись на полювання. Переконайтеся, що ви дійсно потрапили в щось, щоб не виглядати некомпетентним, але не вбивайте занадто багато речей, або не робіть вигляд, що вам це подобається, або не робіть вигляд, що вам це не подобається. Чи можете ви це зробити?"
#,Be interviewed on morning television, Дати інтерв'ю ранковому телебаченню"Покажіть, що вам нема чого приховувати, давши інтерв'ю в легкому Веселому ранковому телешоу, яке розкриває вас справжнього. Намагайтеся здаватися владним і розумним, але в той же час приземленим і товариським. Серйозний, але в той же час веселий. Теж природний, але в той же час винятковий."
#,Eat breakfast in a typical builders cafe, Поснідати в типовому кафе для будівельників"Немає нічого простішого і кращого для демонстрації того, що ви звичайний громадянин, ніж насолодитися смачним традиційним сніданком в звичайному кафе для працюючих людей. Очевидно, ви знаєте, що замовити і як з'їсти це цілком природно перед 200 камерами".
#,Be filmed watching the a sports team play, Бути знятим за грою спортивної команди "Як звичайний громадянин, очевидно, що ви великий шанувальник національного виду спорту країни і нічого так не любите, як підбадьорювати команду під час її гри. Це явно передбачає, що ви дійсно стежите за цим видом спорту, маєте уявлення про правила та ім'я хоча б одного гравця".
#,Appear on a televised genealogy program, З'явитися в телевізійній програмі з генеалогії"Популярне телешоу, яке розповідає про родовід людей, допоможе людям побачити вас сьогодення і зрозуміти ваше походження. Це дозволить вам виглядати набагато більш поступливим, за умови, що ваші предки не виявляться злочинцями, работорговцями або приголомшливо багатими."
#,Carve promises in stone, Виконувати обіцянки в Камінь,"Що може бути більш нормальним, ніж бажання буквально вирізати свої політичні обіцянки на гігантській кам'яній плиті і встановити її перед будівлею парламенту, щоб нагадати всім про вашу надійність. Це ні в якому разі не буде здаватися по-справжньому божевільною ідеєю".
