#,sustainabilitytrust,Sustainability Trust,Medlemmar av "Sustainability Trust" badmouthing regeringen på internet, Sustainability Trust aktivt kampanj mot regeringens politik, " Sustainability Trust har krävt att regeringen att vända sin politik, och officiellt tillbaka oppositionen"
#,seniorrightssociety,Senior Rights Society,The Senior Rights Society has been criticizing the government in its newsletter,The Senior Rights Society have described government policies as 'a disgrace' and urge it's members not to support you.,"The Senior Rights Society have been sending large petitions to government, criticizing your current policies."
#,evangelicalalliance,Evangelical Alliance,The Evangelical Alliance has been expressing dismay at government policies,The Evangelical Alliance are holding town-hall meetings to express their anger at the current government.,The Evangelical Allianceare actively preaching to all members to oppose the government and support the opposition
#,liberalleague,Liberal League,The Liberal League has been criticizing government policy on the radio.,The Liberal League says it actively encourage it's members to oppose the current government.,The Liberal League is threatening direct-action to show it's opposition to the current government
#,marxismnow,Marxism Now,Marxism Now has been strongly critical of the current government's policies.,Marxism Now has declared the government to be illegitimate and urged it's supporters to oppose it 'in every way'.,Marxism Now is actively urging it's members to take non-violent action against government policies.
#,campaignforfamilyvalues,Campaign For Family Values,The Campaign For Family Values have spoken out strongly against government policy.,The Campaign For Family Values is mounting an online campaign against the government.,The Campaign For Family Values says it will oppose government policy by all means at it's disposal.
#,defendersoftheflag,Defenders Of The Flag,Members of  'Defenders Of The Flag' are criticizing government policy in their leaflets.,Defenders Of The Flag has warned that it will disrupt government meetings and events to make its opposition felt.,Defenders Of The Flag has refused to rule out direct physical action against the current government.
#,environmentalalliance,Environmental Alliance,The 'Environmental Alliance' are criticizing government policies in online forums,The Environmental Alliance have warned that it is the duty of it's members to 'fight against government policy at all levels'.,The Environmental Alliance have been staging protests at the homes of government officials.
#,diversityalliance,Diversity Alliance,Diversity Alliance members have called for the government to change it's policies in many areas.,Diversity Alliance are carrying out a major online campaign encouraging people to oppose government policy.,"Diversity Alliance have pledged to defend citizens rights from the government, and to 'meet force with force'."
#,federationofentrepreneurs,Federation of Entrepreneurs,The Federation of Entrepreneurs has advised many of it's members to discontinue support for the current government.,The Federation of Entrepreneurs has warned that current government policy puts it on a dangerous collision course with the aims of big business.,The Federation of Entrepreneurs has warned that it will not stand by and allow the government to wreck the business community any longer.
#,ruralalliance,Rural Alliance,The Rural Alliance has openly criticized government policy on rural issues.,The Rural Alliance have warned that they will resist attacks on rural life by any means at their disposal.,The Rural Alliance have warned government that many farmers and rural citizens feel they have 'nothing to lose' when it comes to fighting the government.
#,angelsofheavelyjustice,Angels of Heavenly Justice,Intelligence services report growing concern about a relatively small extremist religious organization known as the 'Angels of Heavenly Justice'. We should keep a close eye on their activities.,Our intelligence services report serious concerns about the actions of the extremist religious groups who go by the name 'Angels of Heavenly Justice'. There is a moderate threat of violent attacks from this group in the near future.,"Our intelligence experts express concern about a large and credible threat from the 'Angels of Heavenly Justice', the extremist religious organization which has been making a high number of specific threats against the government."
#,freedomrebellion,Freedom Rebellion,Our security services are concerned about strong support for the extremist human-rights campaigning group known as the 'Freedom Rebellion'. This group may present a serious threat in the future.,Our security experts are warning us about the growing capabilities and strengths of the extremist group known as the 'Freedom Rebellion'. This group has both the motivation and personnel to carry out serious attacks against our government.,Our Intel experts are concerned about imminent attacks on government by the popular and dangerous extremist group calling themselves the 'Freedom Rebellion'. We need to be on high alert.
#,peoplesbrigade,Peoples Brigade,We are monitoring extensive extremist communication amongst a group of communist activists calling themselves the 'Peoples Brigade'. We need to keep an eye on this group.,The hard-left extremist group known as the 'Peoples Brigade' are growing in strength and may represent a serious threat to our government in the medium term.,"There is a very real danger of attack on government institutions by the hard-left extremist group called the 'Peoples Brigade'. This group is large, motivated and well equipped."
#,traditionalvaluesregiment,Traditional Values Regiment,"Our security experts report that they have monitored communications between members of what appears to be an extremist conservative group called the 'Traditional Values Regiment', which draws on support from conservative voters.",Our Intel experts are showing increased concern about the capabilities and motivations of the conservative terror group known as the 'Traditional Values Regiment'. This group should be considered an active threat.,Our security personnel are showing urgent concern about the capabilities and motivations of the conservative terror group known as the 'Traditional Values Regiment'. This group should be considered a  real and present danger.
#,avengersofmotherearth,Avengers Of Mother Earth,"The experts in the intelligence services have expressed concern about the 'Avengers Of Mother Earth', an extremist environmentalist organization that may represent a serious threat to government institutions.","Security experts are concerned that the Green terror group known as the 'Avengers Of Mother Earth' are growing in ambition and capability, and are a threat to be taken very seriously.",Our intelligence experts are highly concerned about the threat to government and your person by the extremist green terrorist cell called the 'Avengers Of Mother Earth'.
#,truepatriots,True Patriots,The security services have detected a growth in support for extremist patriotic organizations and have concerns about a group called the 'True Patriots'.,Our security forces have intercepted evidence suggesting that the patriotic terrorist group 'True Patriots' represents a genuine threat which needs to be monitored closely.,We have evidence that the extremist terror group 'True Patriots' has the manpower and capability to pose a genuine threat to our government. We need to be on high alert.
#,multiculturalwwarriors,Multicultural Warriors,"Our security services are concerned that there are extremist elements within ethnic minorities that are calling themselves the 'Multicultural Warriors', which may become a serious threat to law and order.",We have evidence of a real threat from the extremist ethnic terror group known as the 'Multicultural Warriors'. This group is now being actively monitored in case they attempt violent action.,Our security personnel have serious concerns about a real terror threat to us from the organization calling themselves the 'Multicultural Warriors'. Everyone is on high alert for an attack.
#,theinvisiblehand,The Invisible Hand,Our security experts are concerned about a potential security threat from an extremely well funded shadowy organization comprised of various wealthy industrialists called  'The Invisible Hand'.,Our intelligence experts have intercepted communications which suggests the pro-capitalist corporate-funded terror group known as  'The Invisible Hand' may be considering action against our government.,"Although we can't prove anything, our Intel experts are convinced that a serious terror threat from the mysterious  'Invisible Hand' is in fact being directly supported by wealthy and powerful corporations. The threat is acute."
#,provincialdefensebrigade,Provincial Defense Brigade,Our security staff are now routinely monitoring communications within a group of rural anti-government protesters known as the 'Provincial Defense Brigade' which is drawing support from farmers and other rural communities.,Our intelligence staff report that there are genuine concerns about terrorist action from the rural pressure group / terrorist group calling themselves the 'Provincial Defense Brigade'.,"There is now ample evidence that the rural terror group 'Provincial Defense Brigade' made up mostly of disgruntled farmers, has the capability and manpower to carry out a serious terrorist strike against our government."
