#,mpt,L'edificio più alto del nuovo mondo,"Costruire una struttura che sia la più alta del mondo è un grande messaggio per il mondo intero, i nostri amici e nemici rimarranno sbalorditi dal nostro successo."
#,revenueservice,Revenue Service,"Un servizio di entrate assicura che le persone paghino le tasse e le paghino in tempo, molti dicono che questo danneggia maggiormente la classe media e bassa ma altri dicono il contrario, non importa, la nostra nazione ha bisogno di questa agenzia per garantire le tasse del governo».
#,freetaxpreparationclasses,Classi di preparazione fiscale gratuita,"Offre corsi per chiunque su come pagare le tasse e tutto ciò che riguarda ciò che è molto importante, questo garantisce a tutti e, soprattutto, ai giovani di sapere come pagare le tasse e di evitare qualsiasi problema facendolo in modo errato ."
#,pandemicpreparationfund,PPF,"Un PPF Abbreviazione di Fondo per la preparazione alla pandemia viene utilizzato per salvaguardare civili e funzionari governativi da malattie che mettono in pericolo la nostra nazione."
#,sas,"State Animal Shelters", "Fornire rifugi per animali offre agli animali randagi o bisognosi una casa temporanea dove vengono nutriti, lavati e addestrati".,
#,sac,"State Animal Control","Finanziare e gestire un servizio o un'agenzia per il controllo degli animali consentirà agli ufficiali di controllo degli animali di gestire animali selvatici, pericolosi o bisognosi di aiuto e di sopprimerli o portarli in un rifugio per animali o altro impianto di custodia”.,
#,so,"Orfanotrofi statali","Gli orfanotrofi costruiti e gestiti dallo stato forniscono una casa per orfani e minori senzatetto che hanno bisogno di aiuto e cura.",
#,pt,"Formazione della polizia","La migliore formazione che diamo ai nostri ufficiali meglio preformano!",
#,landvaluetax,"Land Value Tax","Un'imposta sul valore fondiario (LVT) è un'imposta sul valore del terreno indipendentemente da edifici, proprietà personali e altri miglioramenti.[1] È anche nota come imposta sul valore dell'ubicazione, un'imposta sulla valutazione dei punti , un'imposta sulla valutazione del sito, un'imposta sull'aliquota ripartita o una valutazione del valore del sito".,
#,vat,"Imposta sul valore aggiunto", "Un'imposta sul valore aggiunto (IVA), nota in alcuni paesi come imposta su beni e servizi (GST), è un tipo di imposta che viene valutata in modo incrementale. Viene applicata al prezzo di un prodotto o servizio in ogni fase della produzione, distribuzione o vendita al consumatore finale. Se il consumatore finale è un'azienda che riscuote e paga allo Stato l'IVA sui suoi prodotti o servizi, può richiedere il rimborso dell'imposta pagata. È simile a, e è spesso paragonato a un'imposta sulle vendite. L'IVA è un'imposta indiretta perché la persona che alla fine sopporta l'onere dell'imposta non è necessariamente la stessa persona che paga l'imposta al fisco.",
#,interest_rate,"Tasso di interesse", "I tassi di interesse influenzano molti aspetti della nostra economia, i tassi di interesse più alti sono generalmente negativi per la maggior parte delle persone, mentre uno più basso danneggia le nostre banche e altre parti della nostra economia.",
#,tax_fraud_department,"Dipartimento per la frode fiscale","un dipartimento con agenti incaricati di indagare su persone, aziende e altre entità, il cui obiettivo è trovare frodi fiscali e altri casi simili. Crearne uno mentre una nazione ha problemi di evasione fiscale aumenta i costi di gestione del dipartimento, si consiglia di crearne uno prima di tali problemi o il più presto possibile.",
#,contributions_to_the_european_union,"Contributi all'Unione Europea","I paesi dell’UE possono contribuire con euro all’UE che verranno utilizzati per molte cose, dal sostegno ai beneficiari dell’UE e persino per gli aiuti umanitari.",
#,un_nation_status,"Status di nazione delle Nazioni Unite","Lo status di membro di una nazione può cambiare molte cose, senza di esso si perde legittimità, con esso la si guadagna.",
#,dmz,"La zona demilitarizzata","Le Coree sono ufficialmente in guerra dagli anni '50, anche se ha fatto freddo per gran parte della sua storia, il confine è ancora altamente militarizzato.",
#,dmznk,"La zona demilitarizzata","Le Coree sono ufficialmente in guerra dagli anni '50, anche se ha fatto freddo per gran parte della sua storia, il confine è ancora altamente militarizzato.",
#,interest_rate_eu,"Tasso di interesse UE","La BCE è la banca centrale dell’euro ed è responsabile della formulazione e dell’attuazione della politica monetaria per l’Eurozona. Le nazioni dell’UE non sono in grado di fissare il proprio tasso di interesse.",
#,vc,"La Santa Sede","Unico nel suo genere, sette degli assoluti, santo e grande, guidato da un papa, supremo, vescovo di tutti, servitore dei servi di Dio, patriarca, sua santità, con status e autorità, guida sotto Dio.",
#,sah,"La questione del Sahara","Un territorio conteso, non lo controlliamo completamente, circa il 20% del territorio è detenuto dalla Repubblica Araba Democratica Saharawi",
#,sad,"La questione del Marocco","Siamo un territorio conteso e una nazione minacciata, non controlliamo completamente le nostre terre, circa l'80% del territorio è detenuto dal Marocco, dobbiamo cercare di sopravvivere in una situazione così brutta",
#,empage,"Agenzia per l'occupazione","Un'agenzia per l'occupazione collega i cercatori di lavoro con i datori di lavoro, facilitando l'inserimento della forza lavoro e contribuendo allo sviluppo economico."
#,govbon,"Obbligazioni sovrane","Le obbligazioni sovrane sono titoli di debito emessi da uno Stato per raccogliere fondi per progetti pubblici e la crescita economica."