#,CryptocurrencyCrash!, Kripto Para Birimi Kazası!,"Kripto para birimlerinin yükselişi, yeni patlayan bir balona yol açtı. Milyonlarca serbest meslek sahibi para kaybetti. Şimdi internet para birimlerinin daha fazla düzenlenmesi için çağrıda bulunuyorlar."
#,FlashCrash, Flaş Çökmesi, "Otomatik ticaret borsayı o kadar kırılgan hale getirdi ki, tek bir büyük ticaret hisse senetlerini ani bir sarmalın içine gönderdi. Ekonomistler, böyle bir felaketin bir daha yaşanmasını önlemek için otomatik ticaret kurallarının derhal getirilmesini istiyorlar. Gsyih'mız ciddi bir darbe aldı."
#,accidentalshooting, Kazara Ateş Etmek,"Ülkemizde suç seviyeleri o kadar yüksek ki, ev istilaları tüm vatandaşlar için gerçekçi bir endişe kaynağı. Bir ünlü, davetsiz misafir olduklarını düşündüklerini iddia ederek kendi ailelerinin bir üyesini evlerinde vurdu."
#,accountantsbusted,Muhasebeciler Yakalandı,"Karmaşık bir vergi dolandırıcılığını araştıran gazeteciler, rezil bir denizaşırı muhasebe firmasından geniş bir veri tabanına teslim edildi ve kamuoyuna açıklandı. Veri tabanı, politikacılar ve ünlüler de dahil olmak üzere ülkemizden binlerce varlıklı bireyin vergi ödemekten tam olarak nasıl kaçındıklarını gösteren ayrıntılarını içeriyor. Bu, haber döngüsüne hükmediyor ve eşitsizlik ve sınırsız kapitalizmin sonuçları hakkındaki öfkeyi körüklüyor."
#,affair, İlişki,"Bir porno yıldızı, onlarla bir ilişkiniz olduğunu ve kararsızlığınızı gizli tutmaları için onlara gizli para ödediğinizi açıkça suçladı. Daha da kötüsü, bu gizli para kampanya finansmanından çıktı, ki bu bir suç. Ödemeyi üstlenecek, ilişkiyi reddedecek ve bunu ortadan kaldırmak için suçlayıcınızı ödeyecek düşük rütbeli bir uşak bulma zamanı."
#,aidtoeradicatedisease, Hastalığın Ortadan Kaldırılmasına Yardımcı Olmak, "Uluslararası bir örgüt, ülkemizdeki zayıflatıcı bir hastalığın ortadan kaldırılmasını hedefleyen büyük miktarda yardım taahhüt etti. Halkımız acı çekiyor, bu yüzden hastalıkla savaşmak için bu kaynak enjeksiyonu memnuniyetle karşılanıyor. Ancak hükümetimizin böyle bir dış desteğe ihtiyacı olduğu vatansever yorumcular tarafından eleştirildi."
#,aidtoeradicatepoverty,Yoksulluğun Ortadan Kaldırılmasına Yardım Etmek,"Uluslararası bir örgüt, ülkemizdeki bir yoksulluğun ortadan kaldırılmasını hedefleyerek büyük miktarda yardımda bulundu. Halkımız acı çekiyor, bu yüzden yoksullukla mücadele için bu kaynak enjeksiyonu memnuniyetle karşılanıyor. Ancak hükümetimizin böyle bir dış desteğe ihtiyacı olduğu vatansever yorumcular tarafından eleştirildi."
#,airstrike, Hava Saldırısı, "Ülkemizdeki askeri hedefleri bombalamak için kitle imha silahları stoklama iddiaları gerekçe olarak kullanıldı. Bu yabancı askeri koalisyonun hava harekatı askeri yeteneklerimizi azaltacak ve dış ilişkilere daha fazla zarar verecek."
#,carpoolrapescandal, Araba Yolculuğu Tecavüz Skandalı, "Ülkede faaliyet gösteren en büyük sürüş paylaşım şirketi, sürücülerine yönelik tecavüz iddialarını sistematik olarak bastırıyor. Araştırmacı gazeteciler, yolcuların destek çalışanlarına kolluk kuvvetlerine rapor vermemeleri söylendiğine dair yüzlerce raporun kanıtını buldular. Başlangıç teknolojisi şirketlerinin o kadar az personeli var ki, bozdukları sektörlerde temel güvenlik protokolleri göz ardı ediliyor."
#,celebrityopioiddeath, Ünlü Opioid Ölümü, "Dairelerinde reçeteli opioid şişeleriyle çevrili genç bir film yıldızı ölü bulundu. Normalde kısa süreli ağrı kesici için kullanılan bu bağımlılık yapan ilaç sınıfı, ülkemizin ecza dolaplarını sular altında bıraktı. Sağlık sigortası ucuz bir haptan başka bir şey için ödeme yapmayacaksa, opioidlerin doktorların reçete etmesi kolaydır. Bu kriz sırasında binlerce kişi aşırı dozdan ölüyor."
#,centralbankfraud, Merkez Bankası Dolandırıcılığı, "Merkez bankası yetkililerinin sahtekarlık yaptıkları ve yeni faturaları sahte faturalarla değiştirdikleri tespit edildi. Finansal sistemimizin temellerini oluşturan kurumlar yozlaştığında, halkımız bu hükümetin liderliğine nasıl güvenebilir?"
#,civilservantsstrike, Memurlar Grev Yapıyor, "Memurlar maaş üzerinden greve oy verdiler. İşvereniniz hükümet olduğunda, istifa edip bir rakiple başka bir iş bulamazsınız. Kamu hizmeti genellikle nankör bir iştir, ancak makul bir yaşam standardını desteklemek için ücret beklenmelidir."
#,coastaloilspill, Kıyı Petrol Sızıntısı,"Yıkıcı bir petrol sızıntısı, yerel balıkçılıktaki stoğu yok ederek yerel kırsal nüfusun yaşam tarzını yok etti. Bu, onları bölgeden yakındaki kasaba ve şehirlere götürecek ve çevreyi korumak isteyenler ile onu sömürmek isteyenler arasında hissedilen kötü iradeyi daha da kötüleştirecektir."
#,corruptionarrests, Yolsuzluk Tutuklamaları, "Yolsuzluk yapan yetkililer zimmete para geçirme suçlamasıyla tutuklandı. Sürekli bir yolsuzlukla mücadele uygulama kampanyası bu yüksek profilli tutuklamalara yol açtı. Yolsuzluğa karşı hoşgörüsüzlüğümüz açıkça ortaya kondu ve hiç kimsenin yasaların üstünde olmadığını gösterdik."
#,CryptocurrencyCrash, Kripto Para Birimi Çökmesi, "Kripto para birimlerinin yükselişi, yeni patlayan bir balona yol açtı. Milyonlarca serbest meslek sahibi para kaybetti. Şimdi internet para birimlerinin daha fazla düzenlenmesi için çağrıda bulunuyorlar."
#,deadlyvirusoutbreak, Ölümcül Virüs Salgını, "Ülke genelinde binlerce insanı öldüren ölümcül bir virüs salgını oldu. Bu hastalığın olağanüstü virülansı ve hastaların yüksek ölüm oranları yıkıcıdır. Bu salgın kontrol altına alınana kadar uluslararası seyahat ve ticaret kısıtlandı."
#,deadlywatercontamination, Ölümcül Su Kirliliği, "Musluk suyu kurşunla kirlendikten sonra yüz binlerce vatandaş güvenli içme suyu olmadan kaldı. Para biriktirmek için belediyeleri yerel su kaynaklarını değiştirdi, ancak yeni su onu taşıyan kurşun boruları aşındırdı. Kurşun zehirlenmesini keşfetmeden önce on iki kişi öldü."
#,debtdeal, Borç Anlaşması, "Ülkemizin borcunu yeniden yapılandırmak için uluslararası alacaklılarımızla bir anlaşma yapıldı. Kredilerimizi konsolide ederek ve kamuya ait işletmelerden gelen nakit akışlarına karşı güvence altına alarak faiz ödemelerimiz önemli ölçüde azaltılmıştır."
#,diplomaticimmunity,Diplomatik Dokunulmazlık,"Yabancı bir diplomat, bir vatandaşı trafik kazasında öldürdüğü iddia edildikten sonra ülkeden kaçtı. Diplomatik dokunulmazlıklarını, kolluk kuvvetleri tarafından tartışmasız olarak kendi ülkelerine geri dönmek için kullandılar. Yasaya uyması beklense de, sınırlarımız içinde onun üzerinde faaliyet gösteren binlerce yabancı diplomat var. Halk bunu, öfkelerini siyasi sınıfa yöneltmek için büyük bir adalet düşüklüğü olarak görüyor."
#,diseaseeradicated, Hastalık Ortadan Kaldırıldı, "Sürekli bir aşı, eğitim ve izleme kampanyası, ülkemizde kronik, zayıflatıcı bir hastalığın ortadan kaldırılmasına yol açtı. Halkımızın bu yıkıcı hastalıktan arınarak yaşamaya devam edebilmesi için bu statüyü savunduğumuzdan emin olmalıyız."
#,disputedterritoryrepatriated,Tartışmalı Bölge Ülkesine Geri Gönderildi."Uluslararası bir mahkeme kararından sonra, tarihsel olarak egemenliğini iddia ettiğimiz önemli bir bölge ülkesine geri gönderildi. Mevcut işgalcileri her zaman iddiamıza itiraz ettiler, ancak bölgenin mülkiyetini boşaltmaktan ve devretmekten başka çareleri yok."
#,drought, Kuraklık,"Mevsimsel yağmurlar düşmedi ve ülke akut bir kuraklıktan muzdarip. Mahsuller başarısız oldu, su kaynakları azaldı ve hayvancılık ve vahşi yaşam popülasyonları sürdürülemez. Daha iyi altyapı ile bu durumun ciddiyeti hafifletilebilirdi."
#,dubiousrolemodel, Şüpheli Rol Modeli, "Sizin seçmiş olduğunuz yüksek rütbeli bir yetkili, konuşmalarından birinde aşırı derecede aşırı bir diktatörü övdü. Yönetimleri sırasında milyonlarca masum insanı öldürmüş olabilirler, ancak devlet altyapısı hakkında bazı ilginç fikirleri vardı."
#,electiondeclaredfreeandfair, Seçim Özgür ve Adil İlan Edildi, "Son seçim uluslararası gözlemciler tarafından özgür ve adil olarak değerlendirildi. Ulusal seçimler, bireylerin demokratik süreç üzerinde doğrudan bir etkiye sahip olabileceği birkaç zamandan biridir. Oylama sisteminin bütünlüğünü koruyarak demokrasinin kendisi korunur."
#,electionflawed, Seçim Kusurlu, "Bağımsız gözlemci gruplarına göre son seçim uluslararası standartların gerisinde kaldı. Ulusal seçimler, bireylerin demokratik süreç üzerinde doğrudan bir etkiye sahip olabileceği birkaç zamandan biridir. Oylama sistemini baltalayarak demokrasinin kendisi altüst olur."
#,electionresultchallenged, Seçim Sonucuna İtiraz Edildi, "Son seçimi kaybeden muhalefet, oy pusulasında sahteciliğin gerçekleştiğini şiddetle iddia ediyor. Ülkenin en yüksek mahkemesi olan yüksek mahkemede seçim sonucuna meydan okuyorlar. Başarısız olsalar bile, ateşsiz duman olmaz ve seçmenler öfkelenir."
#,embezzledfundsrecovered, Zimmete Geçirilen Fonlar Geri Alındı, "Eski bir lider tarafından pompalanan para yabancı banka hesaplarından geri alındı. Toplumumuzdaki yolsuzluk seviyesi azaldıkça, icra dairelerimiz geçmişin yanlışlarını düzeltmek için engelsizdir."
#,environmentalconservationaid, Çevre Koruma Yardımı, "Uluslararası bir kuruluş, ülkemizde çevrenin korunmasına yardımcı olmak için büyük miktarda yardım taahhüt etti. Değerli doğal çevremiz acı çekiyor, bu nedenle düşüşüyle mücadele etmek için bu kaynak enjeksiyonu en çok memnuniyetle karşılanıyor. Ancak hükümetimizin böyle bir dış desteğe ihtiyacı olduğu vatansever yorumcular tarafından eleştirildi."
#,extraditedhackerconvicted, İade Edilen Hacker Mahkum Edildi, "Kilit hükümet bilgisayar sistemlerini tehlikeye atan yabancı bir bilgisayar korsanını başarıyla iade ettik ve mahkum ettik. Küresel etkimiz ve iade anlaşmalarımız bugün uluslararası siber suça karşı bir darbe indirdi."
#,extremiststate, Aşırılık Yanlısı Devlet, "Ülkemizdeki aşırılık yanlısı bir hizip kendi toprak bağımsızlığını ilan etti. Ülkemizin kuzey sınırına yakın milisleriyle uzak bir bölgeyi güvence altına aldılar. Kendi egemenliğimizi savunamamamız, milletimizde bir güvenlik iddianamesidir. Daha da endişe verici olanı, vatandaşların bu gibi aşırı eylemlerde bulunacak kadar çaresiz hale geldiği bir ortam oluşturmuş olmamız."
#,factorycloses, Fabrika Kapanıyor,"Ülkemizdeki büyük bir işveren, bin vatandaşı gereksiz kılan otomobil fabrikalarından birini kapattı. Nüfusumuzdaki araç kullanımındaki düşüşün yanı sıra düşük işgücü verimliliği, kapanmanın başlıca nedenleri olarak gösteriliyor."
#,femaleleader, Kadın Lider,"Muhalefetin yeni başkanı olarak bir kadın lider seçildi. Kadınların hükümetin en üst düzeylerinde temsil edilmesi, toplumumuzdaki cinsiyet eşitsizliğine karşı sürdürülen sürekli bir kampanyanın sonucudur."
#,fgmreportshame, Kadın Sünneti Utanç Raporu, "Ülkemizde kadın sünnetinin önemli görülme sıklığını eleştiren saygın bir uluslararası kuruluş tarafından bir rapor yayınlandı. Bu tehlikeli ritüel, cinsiyet eşitsizliğine dayanır ve mağdurların cinsel sağlığını ciddi şekilde bozar."
#,foodscandal, Yemek Skandalı,"Gizli TV muhabirleri, ülkemizdeki bir dizi mezbahadaki koşulların şok edici görüntülerini yayınladı. Çok az insan ucuz etin maliyetlerinin olduğunun farkında olmasa da, bu, yemeğimizin nasıl keskin bir şekilde üretildiğinin gerçekliğini odağa getiriyor. Organik gıda ve veganlık savunucuları, bu konuda kamuoyunda bir dönüm noktası olarak nitelendiriyorlar."
#,foodshortages, Gıda Kıtlığı, "Akut gıda kıtlığı vatandaşlarımızı aç bıraktıktan sonra uluslararası yardım ülkeye akıyor. Kötü çevre koşulları ve tehlikeye giren altyapı, yerli üretimimizi ezdi. Halkımız acı çekiyor, bu yüzden açlıkla savaşmak için bu kaynak enjeksiyonu memnuniyetle karşılanıyor. Ancak hükümetimizin böyle bir dış desteğe ihtiyacı olduğu vatansever yorumcular tarafından eleştirildi."
#,foreignneighbournuclearmissiletest, Yabancı Komşu Nükleer Füze Testi, "Nükleer silahların geliştirilmesi, küresel askeri alaka düzeyi için kriter olmaya devam ediyor. Komşu bir izolasyonist ulus, nükleer programında sınırımıza yakın bir füzeyi test etti."
#,formermilitaryleaderssentenced, Eski Askeri Liderler Mahkum Edildi, "Demokratik ilerlemeyi aktif olarak bastıran askeri liderler mahkemede mahkum edildi. Bunlar güçlü insanlar ve yargımız ülkemizin yasalarını cesurca onayladı. Güçlü bir açıklama yaptık: Hiç kimse yasanın üstünde değildir ve adalet yerini bulacaktır."
#,formerspypoisoned, Eski Casus Zehirlendi, "Ülkemizde sığınma hakkı verilen eski bir yabancı casus, eski işleyicileri tarafından öldürüldü. Casus, düşman ajanlarının içkilerine radyoaktif bir kimyasal soktuğu bir restoran ziyaretinden sonra aniden hastalandı. Vatandaşlar, halka açık bir yerde potansiyel olarak zehire maruz kalma konusunda paniğe kapılıyor ve vatanseverler, böyle bir operasyonun yerel topraklarda gerçekleştirilebileceğinden dehşete düşüyorlar."
#,fuelshortage, Yakıt Sıkıntısı, "Yakıt pompaları ülkemizin garaj ön bahçelerinde kurudu. Yerli üretim talebi karşılayamıyor ve yakıt ithalatı lojistik sorunlar ve yüksek düzeyde küresel tüketim nedeniyle kısıtlandı."
#,garbagescam, Çöp Dolandırıcılığı, "Geri dönüşüm için yurtdışına gönderilen tonlarca çöp iade edildi. Toplumumuzdan istenmeyen atıklarla dolu kaplar, yanlış bir şekilde geri dönüştürülebilir plastikler olarak etiketlendi. Çevreciler, ülkemizin geri dönüşüm programının temel başarısızlığından öfkeleniyorlar. Bu ulusal utanç tüm dünyada manşetlere taşındı."
#,gigeconomypressure, Konser Ekonomisi Baskısı, "Bir sürüş payı sürücüsü, ücretlerini artırmak için yolcularını kaçırmaktan, uyurken başka bir şehre gitmekten suçlu bulundu. Mahkemede şoför, aylık faturalarını ödemekte zorlandıkları için motivasyonları olarak mali baskıyı gösterdi. İş ekonomisi çalışanları, istihdam hakları ve marjları yıkıcı şirketler tarafından aşındıkça çaresiz hale geliyor."
#,globalhitdrama, Küresel Hit Drama, "Yerli bir dönem draması küresel bir sansasyon haline geldi. Yüzden fazla ülke şovu yayınlama haklarını satın aldı. Kitlesel çekiciliği dünya çapında televizyon ödülleri verdi. Bu eğlence olgusu şu anda ülkenin en büyük ihracatlarından biri."
#,governmentshutdown, Hükümetin Kapatılması, "Hükümetinizin işletme bütçesi kesildi ve kamu hizmetleri bir aydır askıya alındı. Tartışmalı politikalarınız yasama organında geniş bir desteğe sahip değil ve kolektif güçlerini, devlet çalışanlarına ödeme yapmak için gereken fonları size reddetmek için kullandılar. Güvenlik görevlileri, sınır devriyeleri, cezaevi personeli ve hava trafik kontrolörleri, siz siyasi bir çözüm bulurken haftalardır evde kalan ücretsiz işçilerden sadece birkaçı."
#,gravemoveprotests, Mezar Hareketi Protestoları, "Faşist bir tarihi şahsiyetin kalıntıları başkentteki önemli mezar yerlerinden çıkarıldı ve uzak bir mezara taşındı. Sosyalistler, geçmişimizin bu bölümü artık yüceltilmeyeceğinden, yer değiştirmeyi övdüler. Oysa muhafazakar milliyetçiler müdahaleyi protesto ederek geçmişi silmenin mümkün olmadığını ifade ettiler."
#,highcorruptioncriticized, Yüksek Yolsuzluk Eleştirildi, "Uluslararası bir rapor, toplumumuzdaki yüksek yolsuzluk seviyesini eleştirerek kıtadaki en yozlaşmış ülkelerden biri olduğumuzu gösteriyor. Yolsuzluk, yaşamın her alanında bir sürüklenmedir ve ülkemizdeki etkisinin vurgulanması yurtiçinde ve yurtdışında olumsuz karşılanacaktır."
#,highriseblaze, Yüksek Alev, "Bir ev aleti arızası, ülkemizin başkentinde düşük gelirli aileleri barındırmak için inşa edilen yüksek katlı bir apartmanda ölümcül bir yangına neden oldu. Kötü bina inşaatı, düzenleyici uygulama eksikliği ve hazırlıksız bir yangınla mücadele hizmetinin birleşimi, ülkeyi şok eden ölümlere yol açtı. Hükümetiniz, bu vatandaşlara gösterilen özen eksikliğinin vurguladığı servet eşitsizliğindeki genişleyen uçurum nedeniyle daha geniş çapta eleştirildi."
#,holybuildingburned, Kutsal Bina Yandı,"Başkentinizdeki önemli bir ibadet yeri, rakip dini gruplar arasındaki gerginliğin artmasının ardından bir bombayla yerle bir edildi. Basın, bunun ülkemizdeki ırk ilişkileri üzerindeki feci etkisini en aza indirmek için çok az şey yapıyor."
#,hostagesrescued,Rehineler Kurtarıldı,"Bir terörist grup tarafından ele geçirilen rehineler ordumuz tarafından bulundu ve kurtarıldı. Radikal gruplar toplumumuzda hala aktif olsalar da, onlarla etkili bir şekilde savaştığımızı ve sonunda galip geleceğimizi gösterdik."
#,housingmarketboom, Konut Piyasası Patlaması, "Konut fiyatları rekor seviyeye ulaştı. Bu, ekonomimizin güçlendiğinin iyi bir göstergesidir. Herkes para kazanıyor ve mülk portföyünü büyütme isteklerini yerine getirebiliyor. Bazı şahin ekonomistler bunu patlamayı bekleyen geçici bir balon olarak görüyorlar, ancak çoğu güneş parlarken saman yapıyor."
#,housingmarketcrash, Konut Piyasası Çöküşü, "Konut fiyatları düşüyor. Piyasanın kaçınılmaz görünen patlama ve çöküş döngüsü yine bizi yakaladı. Çoklu ev sahipliği ve yabancı yatırımcılar, barınağa gerçekten ihtiyacı olanların karşılanabilirliğinin ötesinde fiyatları artırdı. Artık insanların evlerinin değerini aşan kredileri var, emlak satışlarındaki likidite arttı ve tüm piyasalar güven eksikliğinden muzdarip."
#,hugehurricane, Büyük Kasırga,"Topluluklar olağanüstü büyük bir kasırga tarafından harap edildi. Doğal afet savunmaları başarısız olduğu ve acil müdahale ne yazık ki yetersiz kaldığı için binlerce kişi öldü. Daha sonra, bu trajedinin önlenmesinden sorumlu hükümet yetkilileri arasında bir istifa telaşı yaşandı. Olayı ele aldığınız için kişisel olarak eleştirildiniz."
#,illegalimmigrationoutcry, Yasadışı Göç Çığlığı, "Yasadışı göçte önemli bir artış, ülkemizin muhafazakar nüfusu arasında öfkeyi tetikledi. Irksal gerginlik zaten yüksekti ve gözenekli sınırların sürekli ihlal edilmesiyle bu durum kaçınılmaz olarak başa çıkacaktı."
#,internationalcharges, Uluslararası Suçlamalar, "Uluslararası bir ceza mahkemesi size cinayet, tecavüz ve sınır dışı edilmekle suç duyurusunda bulundu. Tabii ki, bu suçları reddediyorsunuz ve suçlayanlarınızla görüşerek iddiaları onurlandırmayı reddediyorsunuz. Halkın bu yalanları olduğu gibi göreceğinden emin olabilirsiniz."
#,internationalliteraryaward, Uluslararası Edebiyat Ödülü,"Yerel bir yazar, romanlarıyla en prestijli uluslararası edebiyat ödülünü kazandı. Hikaye ülkemizde geçiyor ve ulusun profilini dünya çapında yükseltti."
#,joiningtheunion,Birliğe Katılmak,"Ulusumuz, amacı birlik topraklarında barışı ve refahı sağlamak olan bir pan-kıta örgütüne kabul edildi. Şu anda süper devletine katılmakta olduğumuz bazı komşu ülkelerimizle savaşta olduğunu hatırlayan hala hayatta vatandaşlar var. Kuşkusuz, bazı egemen güçleri feda etmek, elverişli ticaret anlaşmaları kazanmak için ödemeye değer bir bedel ve gelecekteki felaket çatışmalarını önlemek için saldırgan olmayan bir anlaşmadır."
#,journalistjailed, Gazeteci Hapsedildi, "Başkentten haber yapan yabancı bir gazeteci casusluk suçundan hapse atıldı. Masumiyetlerini protesto ettiler, ancak rejimimizi istikrarsızlaştırmak isteyen muhalif isyancılarla birlikte yakalandılar. Uluslararası basın, ülkemizdeki insan hakları eksikliğini eleştirerek bu casusu desteklemek için konuştu."
#,journalistreleased,Gazeteci Serbest Bırakıldı,"Muhalif olduğu gerekçesiyle hapse atılan bir gazeteci, temyizlerini kazandıktan sonra erken tahliye edildi. Hapsedildiklerinden bu yana ülkemizde insan hakları koşulları iyileşmiş ve serbest bırakılmaları hem yurt içinde hem de yurt dışında iyi karşılanmıştır."
#,judgemartyr, Yargıç Şehit,"Bir yargıç mahkeme salonlarına silah getirdi ve kendilerini göğsünden vurdu. Bu şehitlik eylemi, hükümetinizin yolsuzluğunu ve yargıya açıkça müdahalesini protesto etmek içindi."
#,landacquisitionscandal, Arazi Edinimi Skandalı,"Yabancı bir hükümetle önerilen ortak altyapı projesi askıya alındı. Bunun nedeni, ilgili inşaat şirketine arazi alımlarının yasallığı konusunda açılan bir davadır. Görünen o ki, vatandaşlar uygun bir tazminat ödemeden zorla evlerinden atılırken, yetkililer projeden kamu parasını emdiler."
#,leaderdiessuddenly, Lider Aniden Ölür, "Hükümetin lideri aniden ve beklenmedik bir şekilde öldü. Asla iyileşemedikleri büyük bir kalp krizi geçirdiler. Geçici bir lider olan siz, seçimler yapılıncaya kadar onların yerine koyuldunuz."
#,leavingtheunion,Sendikadan Ayrılmak,"Bir önceki hükümetten bir referandum sonucunu miras aldınız ve halkın iradesine uyulması gerekiyor. Ulus, ticaret komşularımızla birlik içinde kalıp kalmayacağımız konusunda ikiye bölündü. En yüksek marjla seçmenler süper devletten ayrılmak için oy kullandı. Kendi yasalarımız, anayasamız ve piyasalarımız birliğin yasalarıyla o kadar iç içe ki, ayrılmak imkansız bir bürokratik görev gibi görünüyor. Ancak, iznin ne anlama geldiği tanımlanmadı, bu nedenle bu siyasi bir toprak ele geçirme fırsatı olabilir."
#,lowcorruptionpraised, Düşük Yolsuzluk Övdü, "Uluslararası bir rapor, toplumumuzun düşük yolsuzluk düzeyine övgüde bulundu ve ülkenin kıtadaki en az yozlaşmış ülkelerden biri olduğunu gösteriyor. Bu ortamda iş gelişebilir ve insanlarımız kendilerini engelsiz bir şekilde iyileştirmek için çaba gösterebilirler. Uluslararası toplum, ülkemize yaptıkları yatırımın amacına uygun olarak verimli bir şekilde kullanılacağından emin olabilir."
#,martyrdies, Şehit Ölür,"Hükümeti protesto eden aşırı bir gösteri eyleminde, bir vatandaş ülkenin başkentinde kendilerini ateşe verdi. Yaralarından kurtulamadılar ve şehitlikleri ülkeyi istikrarsızlaştıran bir sivil itaatsizlik dalgasına ilham verdi."
#,masssentencing, Toplu Ceza, "Yüzlerce mahkum, adil yargılama için uluslararası standartları ihlal ederek tek bir duruşmada mahkum edildi. Her bireyin davasının gerçekleri, bu adalet travestisi sırasında doğru bir şekilde düşünülmüş olamaz."
#,migrantsdieintruck,Göçmenler Kamyonda Ölüyor,"Sınırımızdaki bir ticari kamyonun arkasında düzinelerce ceset bulundu. Boğulan kurbanlar, ülkemize ulaşmaya çalışırken ölen yabancı göçmenler olarak tanımlandı. Bu trajedinin suçu hükümete, sınırlarımızı etkin bir şekilde devriye gezmemeye ve çaresiz insanların ülkemize meşru bir şekilde girmesine izin vermemenin kronik durumuna yöneltiliyor."
#,militarycontractscandal, Askeri Sözleşme Skandalı,"Ordumuzdaki kurumsallaşmış yolsuzluğun ulusal bir gazete tarafından ortaya çıkarılmasının ardından soruşturma başlatıldı. Tahrif edilmiş satın alma sözleşmeleri, büyük miktarda kamu parasını kişisel banka hesaplarına akıtmak için kullanılmıştır."
#,minerskilled, Madenciler Öldürüldü, "Bir maden ocağındaki bir mağara düzinelerce madenciyi öldürdü. Tesisteki sağlık ve güvenlik standartları hakkında soruşturma sürüyor, ancak bu halk tarafından çok az, çok geç olarak görülüyor."
#,multinationalcompanyheadquarters, Çok Uluslu Şirket Merkezi, "Çok uluslu büyük bir şirket, bölgesel merkezini burada ülkemizde inşa etmeye karar verdi. Olumlu bir işgücü piyasası, iyi eğitim seviyeleri ve istikrarlı bir rejim kararlarına katkıda bulundu. Bu, istihdam ve ekonomimiz için bir destek anlamına gelecektir."
#,nationalcyberattack, Ulusal Siber Saldırı, "Ülkemizin temel bilgisayar sistemleri büyük bir siber saldırıya uğradı. Bankalar, medya kuruluşları ve hükümet web sitelerinin tümü, olağanüstü sayıda çevrimiçi isteği olan sunucuları ezen devasa yabancı botnet'ler tarafından hedef alındı. Saldırının arkasında vatanseverleri kızdıran tarihi bir saldırganın olduğu açık."
#,nationalsportsstarsgaggedbyforeignpower, Yabancı Güç tarafından Tıkanmış Ulusal Spor Yıldızları, "Spor bir iş olduğunda, sporcuların fikirlerini söylemeden önce sözleşmelerini kontrol etmeleri gerekir. Ülkelerindeki bir protesto hareketi için seslendirilmeyi desteklemek için istisna yapan yabancı bir süper güce korkunç bir özür diledi."
#,nationalteambanned, Milli Takım Yasaklandı, "Milli futbol takımımız, rakipleri hakkında ırkçı açıklamalar yaptığı için tüm müsabakalardan men edildi. Toplumumuzda ırksal gerginlik çok yüksektir ve bu gözle görülür ceza, sosyal sorunlarımıza utanç verici bir ışık tutmaktadır."
