#,falklands, Arjantin bayrak dikiyor,"Falkland Adaları'nın mülkiyet konusunda uzun süre devam eden bir anlaşmazlık, "lslas Malvinas" olarak iddia eden Arjantin'den yeniden ateşlendi. Arjantinli askerler bir bayrak indirip diktiler ve kısa bir televizyon konusundan sonra geri çekildiler, ancak bu, Arjantin hükümetinin başka bir istila girişiminde bulunurlarsa adaları ikinci kez savunamayacağımızı düşündüğünün endişe verici bir işareti."
#,russianships,Rus gemileri yaklaşıyor, "Bizi korkutmak ve savunmamızı test etmek için daha fazla barış bir girişimde, Rus donanması gemileri ve uçaklarımıza son derece yakın ve savunmamızı karşı karşıya getirmemizi istedi. Bu, askeri yeteneklerimizin şu anda caydırıcı olarak görülmediğini gösteriyor."
#,heatwave,Sıcak Hava Dalgası,"Küresel sıcaklıklar yükseldikçe, havamız daha aşırı hale geldi ve şu anda orman yangınlarına ve çok sayıda ölüme yol açan tehlikeli bir sıcak hava büyüsünün ortasındayız. Ülkemiz bu kadar aşırı hava koşullarına alışkın değil ve ekonomik etkileri hissetmeye başlıyoruz."
#,blacklivesmatter,Siyah Hayat Önemlidir,"Renkli bir kişinin öldüğü yüksek profilli bir polis tutmasından sonra, ırk eşitsizliğine dair bir öfke dalgası ulusumuzu sardı."


#,BorderConflict, Bir Sıra Savaşı!,"Cesur bir ulus daha yeni bir sınır çatışması başlattı! güçlerimiz devreye girdi ve daha fazla takviye yolda."
#,GovermentScandal, Büyük Skandal!,"Son derece güvenilir yetkililerinizden biri, devlet masraflarını ödemek için kullanılması gereken parayı çalıyordu, bunun keşfedilmesinden kısa bir süre sonra yetkili ülkeyi terk etmeyi başardı."
#,ArtifactsDiscovered, Eserler Keşfettik!,"Ekiplerimizden biri, medeniyetimize uzun zamandır kaybedilen eserleri keşfetmeyi başardı!."
#,AirAccident, Hava Kazasına!,"Ekipman ve araç taşıyan askeri kargo uçaklarımızdan biri bilinmeyen nedenlerle düştü, Konuyla ilgili soruşturma başlattık, soruşturma biter bitmez üst düzey askeri şahsımıza bir rapor göndermemiz gerekiyor..."
#,AShootingStar, Kayan Bir Yıldız!,"Gökyüzünü aydınlatan kayan bir yıldızımız vardı!"
#,SchoolShootingPrevented, Bir Okul Atışını Engelledi!,"Neyse ki okul kaynak görevlilerimizden biri okuldaki bir çatışmayı durdurabildi, birçok insan onu durdurduğumuz için mutlu ve övülüyoruz, Ancak bazı ebeveynler ve diğer aktivistler bunun olmasını engelleyebileceğimizi düşünüyor. ilk etapta."
#,SchoolShooting, Okul Savaşı!,"Bugün, yerel bir okuldan bir genç, babasına 9 mm tabanca ve 5,56 tüfek taşıyarak 12 genci ve 2 öğretmeni vurup öldürdü ve bu sabah 22 kişiyi yaraladı, Polis çekime ara verdi ve genci vurup öldürdü, milletimiz bu trajik olaydan büyük zarar gördü."
#,LocalHero, Doğmuş Bir Kahraman,"Yerel bir tamirhanede ve küçük bir evde çıkan yangın, görev dışı bir itfaiyecinin harekete geçmesine ve her iki binada da 11 kişiyi kurtarmasına neden oldu, Neyse ki kimse ağır yaralanmadı ama ne yazık ki binalar kayboldu, Ancak itfaiyeci bir kahraman. kaybedilebilecek hayatları kurtaran ve binaları her iki binadan da koruyan." önceki binaların aynı kaderini karşılamak."
#,GovermentTraitorArrested, Yüce Hain Tutuldu!,"Son derece güvenilir yetkililerinizden biri, devlet masraflarını ödemek için kullanılması gereken parayı çalıyordu, bunun keşfedilmesinden kısa bir süre sonra memur neredeyse ülkeyi terk etmeyi başardı, Ancak polisimizle birlikte gizli servisimiz onu kaçmadan önce tutuklayabildi!"
#,HugeFire, Büyük Bir Ateş!,"Trajik bir kaza bir tamirhanede büyük bir yangına neden oldu! Ne yazık ki, hiçbir ilk müdahale ekibi yangının hızla yayılmasını durduracak kadar erken gelemedi."
#,ArtifactsStolen, Bazıları Çalınan Eserlerdi!,"Dün gece altı soyguncu ulusal müzemize girdi ve paha biçilmez birçok eseri çaldı, polis soyguncuları tespit edebildi herhangi bir bilginiz varsa, eserlerin alınmasına yol açan herhangi bir bilgi için lütfen polise 100.000 dolarlık bir ödül için rapor verin. Bir DDC Muhabiri Dedi "
#,CrimeSpree, Şehir Suçu Çılgınlığı!,"Bir erkek ve bir kadın başkentte suç çılgınlığı başlattı, polis şüphelileri aramak için sokakları doldurdu, bu zor zamanda sizi korumak için size bir güvenlik ekibi atandı."
#,ZooBreak, Hayvanlar Hayat Bahçesinden Kaçıyor!,"Hayvanlar sokakları dolduruyor, trafiği engelliyor, kazaları engelliyor ve hayvanların mülke ve hatta saldırılara zarar verdiğine dair raporlar dökülüyor."
#,Flood, Cıtes Sular'da Kaldı!,"Birçok alıntı şiddetli yağmurdan sonra seller oldu."