#,nationalteamdefects, Milli Takım Kusurları, "Milli futbol takımı uluslararası bir turnuvadan dönmeyi reddediyor. Turnuvanın ev sahibi ülkesinde sığınma talebinde bulunuyorlar ve eve dönerlerse hayatlarının tehlikede olacağını iddia ediyorlar. Bu, geniş toplumsal sorunlarımızı vurgulayan uluslararası bir utançtır."
#,nationalteamexitsworldcup, Milli Takım Dünya Kupası'ndan Çıkıyor, "Milli futbol takımı dünya Kupası'ndan beklenenden daha erken düştü. Nüfusumuz hayal kırıklıklarını engelleyemez. Oyuncular medyada ağır bir şekilde eleştirildi ve ülke genelinde genel bir kasvet duygusu var. Rekabetçi bir spor tarafını bile sahaya çıkaramazken, küresel bir lider olma özlemlerine nasıl sahip olabiliriz?"
#,nationalteamwinsworldcup, Milli Takım Dünya Kupasını Kazandı, "Milli futbol takımı dünya Kupası'nı kazandı ve ülke çapındaki taraftarları memnun etti. Uzun vadeli somut faydalara yol açmayabilir, ancak halkımızda iyi niyet dalgası en çok memnuniyetle karşılanır."
#,nativespeciesextinct, Yerli Türlerin Soyu Tükenmiş, "Oldukça görünür, yerli bir hayvan türünün soyu tükenmiş ilan edildi. Doğal ortamlarının aşınması ve kaçak avlanma suçlanıyor. Hükümetlerin ulusumuzun doğal kaynaklarını koruyamaması çevrecileri öfkelendirdi."
#,naturallyentertaining, Doğal Olarak Eğlenceli, "Ülkemizin ünlü doğa bilimcileri yine yaptı. En son video belgesel dizileri, en acil küresel ekolojik sorunların profilini yükselten küresel bir hit. Dünyanın geri kalanının ulusumuzu bu sürümlerle güçlü bir şekilde özdeşleştirmesi de kendi profilimizi yükseltiyor. Çevre gruplarının üyeliğinde önemli bir artış olmuştur."
#,newlyindustrializedcountrystatus, Yeni Sanayileşmiş Ülke Statüsü,"Ulusumuz, küresel ekonomistler tarafından Yeni Sanayileşmiş olarak sınıflandırıldı. Bu, güçlü siyasi liderliğimizin, üretim büyümemizin, kentleşmemizin ve serbest ticaretimizin tanınmasıdır."
#,nobelpeaceprize, Nobel Barış Ödülü,"Yurtiçinde ve yurtdışında demokrasiyi teşvik etmede araç olarak görülenlere Nobel barış Ödülü verildi. Bu, demokratik rejimimizin uluslararası toplum tarafından güçlü bir şekilde desteklenmesidir."
#,olympichosts, Olimpiyat Ev Sahipleri, "Hiçbir şey uluslararası liderliğin Olimpiyat oyunlarına başarılı bir şekilde ev sahipliği yapmaktan daha iyi olduğunu söylemiyor ve Olimpiyatlarımız aksamadan gitti. Olimpiyat yemininin geniş bir küresel izleyici kitlesi önünde adil oyun ve onur mesajını birlikte seçmek, tüm masraflara, siyasete ve tokalaşmaya değdi. Eminim sporcular da eğlenmişlerdir."
#,openlygayleader, Açıkça Eşcinsel Lider, "Muhalefetin lideri olarak açıkça eşcinsel bir politikacı seçildi. Hükümetin en üst düzeylerinde temsil, toplumumuzda cinsellik ayrımcılığına karşı sürdürülen sürekli bir kampanyanın sonucudur."
#,oppositionmembersstagewalkout, Muhalefet Üyeleri Sahne Çıkışı, "Yasama meclisindeki muhalefet üyeleri, demokratik sürecin hükümet tarafından bastırılmasını protesto etmek için dışarı çıktılar. Muhalefetin katılımı olmadan demokrasinin cephesi bile olamaz."
#,oppositionplanswithdrawal,Muhalefet Geri Çekilmeyi Planlıyor."Bazı muhalefet partileri, tarihi seçim tahrifatı iddiasını protesto etmek için temsilcilerini gelecekteki seçimlerin sandık merkezlerinden çekeceklerini açıkladılar. Bunu kayıplarının nedeni olarak gösterecekler ve eylemleri siyasi aktivistleri bir çılgınlığa sürükledi."
#,parkrangerkilled, Park Korucusu Öldürüldü,"Bugün görev sırasında bir grup silahlı kaçak avcıyı rahatsız eden bir park korucusu öldürüldü. Karaborsadaki nesli tükenmekte olan türlerin değeri, kaçak avcıların artık öldürmeye istekli olduğu anlamına geliyor."
#,pipelineprotests, Boru Hattı Protestoları, "Bir petrol boru hattının inşası, bir yerli vatandaş topluluğunun sahip olduğu araziyi geçerken şiddetli protestolara yol açtı. Çevresel etkilere şiddetle karşıdırlar ve dünyanın dört bir yanından uluslararası ilgi ve destek topladılar."
#,planecrash, Uçak Kazası,"Ulusal taşıyıcıya ait bir uçak düştü ve gemideki herkesi öldürdü. Kötü bakım, yerleşik sistemlerin arızalanmasının nedeni olarak gösterildi ve hükümet düşük güvenlik standartlarından sorumlu tutuldu."
#,poachersconvicted, Kaçak Avcılar Mahkum Edildi,"Park korucuları tarafından yakalanan kaçak avcılar yargılandı ve mahkum edildi. Korucularımızın doğal çevremizi korumaya olan bağlılığı övgüye değerdir ve bu tutuklamaları hükümet tarafından sağlanan hayati kaynaklar olmadan yapamazlardı. Bununla birlikte, kaçak avlanma faaliyeti toplumumuzda yoksulluğun bir belirtisidir ve kök nedenini ortadan kaldırmak daha iyi olmaz mıydı?"
#,policeshooting, Polis Vuruyor, "Silahsız bir vatandaş polis saldırısında öldürüldü. Kurban ırksal bir azınlıktaydı ve toplumlarında öfkeye neden oldu. Liberal destekçiler, ayrımcı polis şiddetini sona erdirmek için bir sosyal adalet kampanyasının arkasında toplandılar."
#,politicalrelationshipdowngraded, Siyasi ilişki Düşürüldü, "Önemli bir ticaret ortağı ülkemizle siyasi ilişkilerini düşürdü. Bu, uluslarımız arasındaki dış ilişkilerin bozulmasından kaynaklanan sert bir adımdır. Dış ticaret ve yatırım zarar görecek ve bu ekonomik faaliyetin önemli bir kısmı geri çekilecektir."
#,politicalrelationshipupgraded, Siyasi ilişki Yükseltildi, "Önemli bir ticaret ortağı ülkemizle siyasi ilişkilerini geliştirdi. Uluslarımız arasındaki ilişkiler geliştikçe, dış ticaret ve yatırım da arttı. Bu resmi siyasi gelişme, bu ekonomik faaliyetlere daha fazla destek sağlayacaktır."
#,protesterskilled,Protestocular Öldürüldü,"Siyasi bir gösteri sırasında onlarca protestocu silahlı polis tarafından öldürüldü. Yürüyüşün yasallığı ne olursa olsun, bu acımasız bastırma son derece demokratik değildir ve hem halktan hem de uluslararası toplumdan kınama alır. Daha fazla sivil huzursuzluk kesinlikle takip edecek."
#,quantumcomputing, Kuantum Hesaplama, "Yerli bir teknoloji firması yeni bir bilgisayar teknolojisi çağını duyurdu. Kuantum işlemciler, aynı anda birden fazla hesaplama yapmak için soyut bilimsel ilkeleri kullanır. Geleneksel bir bilgisayarı binlerce yıl sürecek görevler artık dakikalar içinde tamamlanabilir. Teknoloji sektöründe pazar liderliği ülkemiz için güvence altına alınmış görünüyor."
#,regionalwar, Bölgesel Savaş, "Komşu bir ülkede savaş patlak verdi ve onlarla sınırımızda gerginliğe neden oldu. Mülteci akınının yanı sıra ticaretin de kaynaklandığını görüyoruz. Bu kadar yakın bir çatışmanın kendi ulusumuzun istikrarını azaltacağına dair endişeler de var."
#,resourcesobsolete, Kaynaklar Eskimiş, "Ulusal madenlerimizden çıkarılan minerallere küresel talep düştü. Üretim süreçlerinde kaynaklarımızın yerini alacak daha iyi alternatifler bulunmuştur. Kullanımlarını teşvik etmenin tek yolu fiyatları düşürmek ve bununla birlikte gelir elde etmektir."
#,richestcompanypaysnotax, En Zengin Şirket Vergi Ödemiyor, "Dünyanın en zengin çok uluslu şirketi, ülkemizde milyarlarca geliri devretmesine rağmen bu yıl bize vergi ödemedi. Paranın satın alabileceği en iyi sömürücü muhasebe uygulamalarını ve açık deniz vergi cennetlerini kullanan bu şirket, hükümetimizi çok ihtiyaç duyulan kamu fonlarından aldatırken kimsenin rekabet edememesini sağlıyor. Sosyalistler öfkelidir ve vatanseverler, büyük ulusumuzun bu yabancı varlığı vergilendiremediğine inanamazlar."
#,royalbaby, Kraliyet Bebeği,"Kralcılar için ardıllık düşünceleri. Diğer herkes için sevimli bebek fotoğrafları. Ulusumuzun kraliyet ailesinde gelecekteki bir hükümdar doğduğunda, herkes için bir şeyler vardır. En azından yeterince seçmen için bu zor yasayı çok fazla basında yer almadan geçirebileceğimiz bir şey. Kameralara gülümseyin majesteleri."
#,royalwedding, Kraliyet Düğünü,"Ülkemizin kraliyet ailesine yapılan yatırımın geri dönüşü konusunda bazı tartışmalar olabilir. Bununla birlikte, seçmenlerin dikkatini dağıtmanız gerektiğinde, bir kraliyet düğünü olduğunda basında geniş yer kaplamasına güvenebilirsiniz. Etkinliğin ne kadara mal olduğu hakkında konuşmayalım, sonuçta bu onların özel günü."
#,schoolgirlskidnapped, Kız Öğrenciler Kaçırıldı, "Yüzlerce kız öğrenci bir devlet okulundan teröristler tarafından kaçırıldı. Aşırılık yanlıları, yönetimimize karşı uzun süren bir kampanya sırasında kaçırılmanın gerçekleştiği ülkemizin bölgesini istikrarsızlaştırmıştı. Güvenlik kaynaklarımız kontrolü geri almak ve kız öğrencileri kurtarmak için yeterli değil."
#,schoolshooting, Okul Çekimi,"Ulusal trajedi yaşandı. Yalnız bir kurt silahlı adam okul arazisine girdi ve düzinelerce öğrenci ve personeli öldürdü. Bilinen bir radikal gruba bağlı olmadan, güvenlik hizmetlerinin bu tür çatışmaları önlemesi ve önlemesi neredeyse imkansızdır. Ateşli silahlara erişim ve ruh sağlığı hizmeti sunumunun olmaması yine ölümcül bir kombinasyon olduğunu kanıtladı."
#,scientificbreakthrough, Bilimsel Atılım, "Ülkemizde dünya makinelerinin güçlenme şeklini değiştirecek yeni pil bilimi geliştirildi. Kapasite yoğunluğunun iki katı ile mevcut ürünler daha küçük hücreler etrafında yeniden tasarlanabilir ve daha önce imkansız olan yeni, pille çalışan ürünler oluşturulabilir. Hükümetimizin yerli bilim insanlarını yüksek oranda eğitme ve denizaşırı yetenekleri çekme yeteneği karşılığını verdi."
#,sexualassault, Cinsel Saldırı,"Bir kadının toplu taşıma araçlarına yönelik cinsel saldırısının yaygın olarak bildirildiği için ulusal bir öfke var. Kadınlara karşı şiddet içeren suçlar iğrençtir. Tecavüzün kimsenin müdahalesi olmadan halka açık bir şekilde yapılabileceği toplumumuzun lanet olası bir iddianamesidir. Seçmenler, kanunsuzluk ve cinsiyet eşitsizliğinin hükümet tarafından ele alınmasını talep ediyor."
#,shareipocancelled, Hisse Halka Arzı İptal Edildi, "Yüksek profilli bir şirket, halka arzını ertelemeyi seçerek borsadaki ilk çıkışını iptal etti. Bu, halka açık hisse listelerinin başı belaya giren şirketlerin daha geniş bir eğiliminin endişe verici bir başka örneğidir. Daha önce büyüme paylarına sermaye yatırmak için çaresiz kalan yatırımcılar, şimdi henüz kar elde edemeyen şirketlerin değerlemelerini sorguluyor. Küresel ekonomik büyüme konusundaki endişeler, bu şirketlerin karlı olma ihtimalini incitiyor."
#,shareiposuccess, Halka Arz Başarısını Paylaşın, "Ülkemizin en son teknoloji başlangıç başarı öyküsü, kendisini ulusal borsada halka arz etti. Yatırımcılar, geleneksel pazarları bozmak için en yeni şirketten bir parça satın almak için can atıyorlardı ve hisselerin ticaretin ilk gününde yükseldiğini görüyorlardı. Bu, işgücümüzdeki teknolojik uzmanlık seviyesinin ve ticaret için sağlıklı bir ortamın harika bir göstergesidir."
#,socialmedia, Sosyal Medya?,"Milyonlarca vatandaşın kişisel verilerini sosyal medya platformları aracılığıyla aldatıcı bir şekilde toplayan bir veri analizi firması hakkında soruşturma sürüyor. Kullanıcılar eğlenceli bir sınava girdiklerini düşündüler, ancak son seçimlerde hedeflenen reklamlardan etkilendiler ve etkilendiler."
#,socialstupidity, Sosyal Aptallık,"Çamaşır deterjanı poşetleri yemek... Çocuklar tatlı sabun kapsüllerini tükettikleri için affedilebilirler, ancak sosyal medya kullanıcıları zehiri çiğnemek için birbirlerine meydan okudukça bu tehlikeli aktivite gençler arasında viral hale geldi. Gençliğimizin bu kadar sorumsuzca davranabilmesi, kaynaklarımızı eğitime yeniden odaklama çağrılarıyla ulusal bir utançtır."
#,spousescandal, Eş Skandalı,"Eşinizin yurtdışına alışverişe gitmek için özel jet kullandığı bildirildi. Hükümetin lideri olarak, bu yüksek profilli iktidarı kötüye kullanmak seçmenler tarafından pek hoş karşılanmayacak."
#,statevisitcancelled, Eyalet Ziyareti İptal Edildi, "Yabancı bir devlet başkanı ülkemize yaptıkları resmi ziyareti iptal etti. İptal edilmeleri için bölgesel istikrarsızlığı ve güvenlik endişelerini suçluyorlar. Bu küçümseme seni zayıf gösteriyor ve hükümetimizin düzeni sağlama yeteneğini sorguluyor."
#,stickingupfortheenvironment, Çevreye Bağlı Kalmak, "Bir çevre protestocusu havaalanı güvenliğini ihlal etti ve kendilerini bir uçağa yapıştırdı. Uçuşun kalkması engellendi ve başkentin havaalanında yaygın bir aksaklık var."
#,stormdestroysrailway, Fırtına Demiryolunu Yok Ediyor, "Demiryolunun önemli bir kısmı şiddetli bir fırtına tarafından tahrip edildi. Çevresel savunmalar, temel altyapımızı korumak için yetersizdi, hükümetimizin utanç verici yetersiz yatırımını ve gözetim eksikliğini vurguladı."
#,terrorattack, Terör Saldırısı, "Ülkemizin başkenti, bir dizi koordineli terörist saldırı ile bir savaş bölgesine dönüştürüldü. İntihar bombacıları masum insanları atıcıların ateşine sürükledi ve patlamalardan kaçmalarını bekledi. Yüzlerce masum vatandaş öldü ve terörle mücadele etmek için ülke genelinde olağanüstü hal ilan etmekten başka seçeneğiniz kalmadı. Seçmenlerin güvenliği sağlanana kadar sivil özgürlükler askıya alındı."
#,terroristleaderkilled, Terörist Lider Öldürüldü, "Bir terörist hücrenin lideri, ordumuz tarafından düzenlenen bir insansız hava saldırısında öldürüldü. Sempatik bir ulusa sığınıyorlardı, radikal hiziplerinin vatandaşlarımıza karşı terör saldırıları planlamasına ve yürütmesine izin vermekte suç ortağıydılar. Bu, ülkemizin güvenliğinin ve özgürlüğünün devam etmesi için harika bir gün olmasına rağmen, yöntemlerimizi emperyalist olarak görenler var."
#,tinderbox, Çıra Kutusu,"Geçen yıl şiddetli rüzgarlar, kaydedilen en kötü orman yangınlarının nedeni olan elektrik hatlarını düşürdü. Fırtınaların tahmin edilmesiyle, enerji santralleri başka bir cehennemi önlemek için kesintiler planladı."
#,touristkilledinanimalattack, Hayvan Saldırısında Öldürülen Turist,"Bir turist vahşi bir hayvan tarafından saldırıya uğradıktan sonra öldürüldü. Ülkemizde yaban hayatına yakın olan çok sayıda turist ile tüm saldırı olaylarının önlenmesi mümkün değildir. Ancak bunun gibi bir haber sadece turizm sektörüne zarar verebilir."
#,touristmurdered, Turist Öldürüldü,"Bir turist soygun sırasında öldürüldü. Bu hikaye uluslararası basında geniş yer buldu ve ulusumuzun sosyal sorunlarına ışık tuttu. Karlı turizm endüstrimiz, yüksek suç oranlarımızın en son ekonomik zayiatıdır."
#,tradedispute, Ticaret Anlaşmazlığı, "Dünyanın en büyük iki ekonomisi arasında büyük bir ticaret savaşı patlak verdi ve ne yazık ki kaçınılmaz olarak çapraz ateşe yakalanacağız. Bu tarife savaşı çoğunlukla iç politik amaçlıdır, ancak yine de ihracatımızı etkileyecek ve gıda ithalatımızın fiyatlarını artıracaktır."
#,undermined, Zayıflatılmış, "Kilit çıkarma endüstrilerimizden biri, yabancı bir rakip tarafından emtia fiyatını düşürerek düşürülüyor. Büyük rakibin sermaye rezervleri, üretimi sübvanse ederek yapması gereken zararı emebilir."
#,unitednationssecretary_general,Birleşmiş Milletler Genel Sekreteri,"Önde gelen diplomatlarımızdan biri Birleşmiş Milletler Genel Sekreteri olarak atandı. Dünya moderatörü olarak hareket eden bu güçlü, küresel organizasyonun sözcüsü ve lideri olacaklar."
#,women_smarch, Kadınlar Yürüyüşü,"Kadınlar, toplumsal cinsiyet eşitsizliğini protesto etmek için başkente akın etti. Ülkemizde kadınlar az temsil edilmekte, değer düşüklüğüne uğramakta ve düşük ücret almaktadır. Seçmenlerin yarısını oluşturan bu, siyasi eyleme karışmış olması tehlikeli bir demografidir."
#,worldheritagesite, Dünya Mirası Alanı,"Uluslararası bir kuruluş, ülkemizde dünya mirası statüsünde bir dönüm noktası kazandı. Bu ödül, insanlığın çıkarları için önemli kültürel, tarihi ve bilimsel değere sahip siteler için ayrılmıştır. Özel konumumuz artık uluslararası anlaşmalarla yasal olarak korunacak ve dünya harikamızı ziyaret ederken turizmde büyük bir artış bekliyoruz."
#,xenophobicattacks, Yabancı Düşmanı Saldırılar, "İsyancılar, iş fırsatı bulan göçmen işçileri protesto ederken yabancı dükkan sahiplerine saldırdı. Yabancılar protestoculardan ibadet yerlerinde ve polis karakollarında sığındı. İşsizlik oranları yaygın öfkeye neden olduğu için göçmenlere karşı yabancı düşmanlığı devam edecek."
#,youngbutnotsodumb, Genç Ama O Kadar Aptal Değil, "Öğrenciler, algılanan bir yemi protesto etmek ve hükümetiniz tarafından geçiş yapmak için toplandılar. Her yaş için eşitlik ve sosyal adalet platformunda kampanya yürüttünüz, ancak gençleri yatıştırmakta başarısız oldunuz."
#,CreditRatingDowngraded, Kredi notu düşürüldü!,"Büyük uluslararası kredi kuruluşları, hükümet borcunuzun durumunu düşürdü. Yabancı şirketler ekonomimize yatırım yapma konusunda temkinli hale geldikçe bunun GSYİH üzerinde olumsuz bir etkisi olması muhtemeldir ve ayrıca borcumuz üzerinden ödediğimiz faiz oranının yükselmesine neden olacaktır. bunun kapitalist seçmenlerimizi de üzmesi için iyi bir şans var. Borç seviyesini en kısa sürede düşürerek derecelendirme kuruluşlarıyla güvenilirliği yeniden kazanmak için harekete geçmelisiniz. Mevcut Kredi Notunuz artık '<CREDITRATING>'"
#,CreditRatingUpgraded, Kredi notu yükseltildi!,"Büyük uluslarası kredi kuruluşları, büyümetinizin kredi değerini artırdı. Bu harika bir haber! Bu, borcumuz için daha düşük faiz oranlarına yol açmalı ve ayrıca yabancı yatırımcıların daha yüksek bir güven seviyesinden GSYİH'ya yükselmesine neden olabilir. Bu haberin kapitalist seçmenleri de memnun etmesi muhtemel. Mevcut Kredi Notunuz artık '<KREDİLENDİRME>'"
#,FailedCapitalistAssassination, Başarısız Suikast Girişimi!, "Gizli servis ajansları bugün sizi son derece organize bir suikast girişiminden kurtuldu. Okul açılış töreninde bazı öğretmenlerle birlikte planladığınız yerden sadece 200 metre ötede, yüksek teknolojik tüfeği olan yalnız bir keskin nişancı tutuklu. Suikast, istihbarat servisinin 'Battenburg Grubu' olarak bilinen çok gizli bir aşırı zengin sanayici grubu tarafından işe alındığına dair şüphelerini doğruladı. Görünüşe göre senin ölmeni ve hükümetinin görevinden alınmasını isteyen bir takım aşırılık yanlısı kapitalistler var. Dikkatli ol."
#,FailedConservativeAssassination, Başarısız Suikast Girişimi!,"Görünüşe göre muhafazakar 'Geleneksel Değerler İttifakı'nın aşırlık yanlılığı kanadı, hükümetin başı olarak sizi ortadan kaldırmayı kendileri üstlendi. Görünüşe göre bu kıymık grubu 'Ahlaki Haçlı Seferi' olarak biliniyor ve bugünün başarısız suikast girişimi onların sonuncusu olmayacak. Muhafazakarların kafeslerini bu tür eylemlerde bulunmaları için gerçekten sarsıyor olmalısınız."
#,FailedEthnicAssassination, Başarısız Suikast Girişimi!,"Bu sabah silahlı aşırlık yanlılarının hayatına bir girişimde bulundukları haberiyle panik içinde uyarınız. 'Kara Güç Grubu'ndan olduğu iddia eden bir grup silahlı hücum karşıtı protestocu bu sabah hücum binalarına ateş açtı, camları kırıldı ve bazı kişisel yaralandı, ancak neyse ki hiçbir ölüme neden olmadı. Grup hükümeti ırkçılıkla suçladı ve bu ülkenin etnik azınlıklarının öfkesini temsil ettiklerini söyledi. Gelecekteki bu tür saldırıların potansiyeline karşı dikkatli olmalıyız."
#,FailedFarmersAssassination, Başarısız Suikast Girişimi!,"Bugün saat 10.21'de güvenlik görüntülerimiz, dolu bir pompalı tüfekle basın brifingine girmeye çalışan bir adamı tutukladı. Görünüşe göre tarımla ilgili hükümet politikalarıyla savaşmak için kurulan aşırılık yanlısı bir grup olan 'Çiftçiler İttifakı'ndan geliyordu. Güvenlik güçleri bir süredir bu örgütü izliyor ve hükümet politikaları değişmediği sürece bunun gibi daha fazla saldırı beklememiz gerektiği açık. Bu sefer şanslıydık."
#,FailedGreenAssassination, Suikast Girişimi!,"'Yeşil Tugay' olarak bilinen Yeşil bir Terörist grup tarafından hayatınıza yeni bir giriş oldu. Istihbarat güçlerinin cesur üyelerinin zamanında durmayı başardığı için şanslıydı. Gelecekte o kadar şanslı olabilirsiniz, bu yüzden güvenlik önlemlerini gözden geçirmek isteyebilirsiniz. Bu küçük bir eko-terörist grubudur, ancak daha geniş çevre hareketini ne kadar kızdıracak, bunun gibi daha fazla saldırı beklememiz gerekecek."
#,FailedLiberalAssassination, Başarısız Suikast Girişimi!,"Sizi aceleyle binadan çıkardığım için özgür dileklerim, ancak bu patent, 'Özgürlükbirliği' olarak bilinen aşırlık yanlılığı liberal bir kıyı grubu tarafından boyutlandırılan bir suikast girişimiydi. Görüşe göre, hükümetinizin sizi parçalara ayırmaya çalışmak için liberal meselelere muamelesi konusunda yeterince kızgınlar. Neyse ki güvenlik birimlerimiz patlamadan önce bombayı keşfetmeyi başardı. Bir dahaki sefere o kadar şanslı olmayabiliriz."
#,FailedPatrioticAssassination, Başarısız Suikast Girişimi!,"Bu sabahki toplantıda duyduğumuz silah sesleri bir eğitim dövmesi değil, kendilerini 'Gerçek Yol' olarak niteleyen bir grup ağır silahlı terörist tarafından boyut suikast girişiminde bulunmak için gerçek bir canlı girişti. Görünüşe göre, bir tür aşağı vatansever paramiliter örgüt, son zamanlarda yönetmete yönetim yükseltilerinde giderek daha fazla saldırgan hale geldiler. Bugün, daha yaklaşmadan onları yakalamayı başardık. Bir dahaki sefere o kadar şanslı olmayabiliriz."
#,FailedReligiousAssassination, Başarısız Suikast Girişimi!,"Gizli servis, bugün boyut ve kabineyi planlamayı planlayan dini fanatikler gibi görünen bir araba dolması parayı tuttukları maaşlarını kazandı. Güvenlik personelimiz tarafından ıstihbarat ele geçirildikten sonra, patlayıcı ve küçük silahlarla dolu bir minibüs uyanık polisimiz tarafından durduruldu. Gören o ki, mevcut hükümeti ortadan kaldırmaya kararlı bir dizi dini aşırılık yanlısı var. Bu grup kendilerine 'Tanrı'nın Ordusu' adını verdi."
#,FailedSocialistAssassination, Başarısız Suikast Girişimi!,"Bugün erken saatlerde, mükemmel gizli servis personelimiz, görünüşe göre boyut suikast planıyla yüksek karargahına yaklaşan silahlı adam tutuldu. Şu anda adamları sorguluyoruz, ancak şu ana kadar tek bildiğimiz, onların 'Sosyalist Ordu' adı verilen aşırı bir sol hareketin parçası oldukları. Güvenlik hizmetlerindeki cesur çocuklarımız olmasaydı şu anda morgda olurdunuz efendim..."
#,GainNewDonor, Yeni Büyük Parti Bağışçısı!, "İletişim kurma çabalarınız, gelecek kampanya fonunuza iletişim kurmak için yeni ve zengin bir kişiyi çekmeyi başardı. Bu bağlılığı mutlu etmenizden emin olun ve sempati duyguları gruplarına dikkat edin. Bağışçılar mutsuzsa, hayati mali desteklerini kaybetme şansınız vardır."
#,LoseDonor, Binbaşı Donör Partiyi Terk ediyor!,"Görünüşe göre büyük finansal destekçilerimizin görüşlerine göz kulak oluyorsunuz. Zengin bağışçılarımızdan biri parti desteklerini kesti. Bunun, yeni bir bağışçı bulamazsak (ve onları saklayamazsak) etkili bir şekilde kampanya yapma yeteneğimiz üzerinde bir etkisi olabilir...)""
#,_MinisterialResignation, Bakanlık İstifası,"Bakanlarınızdan biri hükümetinizde yeterince görev yaptı ve 'aileleriyle daha fazla zaman geçirmek' için istifa etti. Onları mümkün olan en kısa sürede değiştirmeye uygun birini bulmanız gerekecek."
#,socialmediascandal, Sosyal Medya Skandalı,"Bir sorgulama, popüler sosyal medya sitelerinin arkasındaki önde gelen teknoloji şirketleri tarafından gizliliği şok edici bir şekilde kötü kullanıldığı ortaya çıktı. İyi gizlilik korumalarının ve kolluklarının olmaması, teknoloji şirketlerinin daha sonra en yüksek teklifi verene satılan çok miktarda özel bilgiyi özgürce toplulukları anlaması geliyordu. Bu, her zaman bağlı yaşam tarzlarımızın sahiplerinden birinin mükemmel bir örneğidir. Doğal olarak, gizlilik savunucuları bunun olmasına izin verdiğiniz için öfkelenir."
#,tsunami, Tsunami!, "Yıkıcı bir tsunami kıyı'ya şeridimize çarp. Bu tür olaylara hazırlanmamıza rağmen, tüm can kayıplarını ve zararlarını önlemek imkansızdır. Kıyı kentlerimize ve balıkçılık sektörümüze yönelik yıkım şiddetlidir ve ekonomimize önemli bir darbe olacaktır."
#,earthquake, Deprem!,"Ülkemizi bir ahlaksız vurdu. Neyse ki can kaybı olduça düşse de, işletmelerin hasarı yeniden inşa etmek ve onarmak için zaman ayırması nedeniyle bunun ekonomimiz üzerinde gözle görülür bir etkisi olacaktır."
