#,BorderConflict, Konflikt Graniczny!,"Odważny naród właśnie rozpoczął konflikt graniczny! nasze siły są zaangażowane, a kolejne posiłki są w drodze."
#,GovermentScandal, Skandal Rządowy!,"Jeden z Twoich wysoce zaufanych urzędników kradł pieniądze, które miały być wykorzystane na pokrycie wydatków rządowych, wkrótce po tym, jak odkryto, urzędnikowi udało się opuścić kraj."
#,ArtifactsDiscovered, Odkryliśmy Artefakty!,"Jeden z naszych zespołów był w stanie odkryć artefakty dawno utracone dla naszej cywilizacji!."
#,AirAccident, Wypadek Lotniczy!,"Jeden z naszych wojskowych samolotów transportowych transportujących sprzęt i pojazdy rozbił się z nieznanych przyczyn, rozpoczęliśmy dochodzenie w tej sprawie, powinniśmy wysłać raport do naszego najwyższego wojskowego osobistego, gdy tylko dochodzenie zostanie zakończone..."
#,AShootingStar, Spadająca Gwiazda!,"Właśnie mieliśmy spadającą gwiazdę, która rozświetliła niebo!"
#,SchoolShootingPrevented, Zapobiegliśmy strzelaninie w szkole!,"Na szczęście jeden z naszych oficerów zasobów szkolnych był w stanie powstrzymać strzelaninę w szkole, Wiele osób jest zadowolonych, że ją powstrzymaliśmy i jesteśmy chwaleni, ale niektórzy rodzice i inni aktywiści uważają, że mogliśmy powstrzymać to przed wydarzeniem się w pierwszej kolejności."
#,SchoolShooting, Szkolna Strzelanina!,"Dzisiaj, jeden nastolatek z miejscowej szkoły, niosąc jego ojcowie pistolet 9mm i Karabin 5.56 strzał i zabił 12 innych nastolatków i 2 nauczycieli, i rannych 22 innych dziś rano, policja respounded do strzelania i zastrzelił Nastolatka, nasz naród jest bardzo uszkodzony z tego tragicznego wydarzenia."
#,LocalHero, Urodzony Bohater,"Pożar w lokalnym warsztacie naprawczym i małym domu sprawił, że strażak po służbie wskoczył do akcji i uratował 11 osób w obu budynkach, na szczęście nikt nie został ciężko ranny, ale niestety budynki zostały utracone, ale strażak jest bohaterem, który uratował życie, które mogło zostać utracone, i chronił budynki przed spotkaniem z tym samym losem poprzednich budynków."
#,GovermentTraitorArrested, Rządowy Zdrajca Aresztowany!,"Jeden z Twoich wysoce zaufanych urzędników kradł pieniądze, które miały być wykorzystane na pokrycie wydatków rządowych, wkrótce po tym, jak odkryto, urzędnikowi almostedowi udało się opuścić kraj, ale nasze tajne służby wraz z naszą policją były w stanie go aresztować, zanim uciekł!"
#,HugeFire, Ogromny Ogień!,"Tragiczny wypadek spowodował ogromny pożar w warsztacie! Niestety żaden ratownik nie był w stanie przybyć wystarczająco wcześnie, aby powstrzymać szybkie rozprzestrzenianie się ognia."
#,ArtifactsStolen, Niektóre Były Artefakty Skradzione!,"Ostatniej nocy sześciu rabusiów weszło do naszego Muzeum Narodowego i ukradło wiele bezcennych artefaktów, policja była w stanie zidentyfikować rabusiów jeśli masz jakieś informacje, zgłoś się na policję, aby otrzymać nagrodę w wysokości 100000 USD za wszelkie informacje, które prowadzą do odzyskania artefaktów. Powiedział Reporter DDC"
#,CrimeSpree, Szał Przestępczości W Mieście!,"Mężczyzna i kobieta rozpoczęli szał przestępczy w captial city, policja wypełnia ulice w poszukiwaniu podejrzanych, zespół bezpieczeństwa został przydzielony do ciebie, aby chronić Cię w tym trudnym czasie."
#,ZooBreak, Zwierzęta Uciekają Z Zoo!,"Zwierzęta wypełniają ulice, blokują ruch, casuing recks i napływają raporty o zwierzętach niszczących mienie, a nawet o atakach."
#,Flood, Miasta Zalały!,"Wiele miast ma powodzie po ulewnym deszczu."

#,globalsummit,Global Leader Summit,"Niedawno odbył się szczyt, w którym uczestniczyło kilku najpotężniejszych liderów świata, a przebiegł on lepiej niż się spodziewaliśmy. Znalazły się wspólne punkty, zawarto umowy, a skargi zostały rozwiązane. Świat stał się trochę bezpieczniejszy, częściowo dzięki Twojemu wkładowi."
