#,armedpolice_lack,""Malam ini kami melaporkan pemakaman petugas polisi <MALEFULLNAME>, yang berulang kali ditembak di dada ketika menghadapi pengedar narkoba di jalan-jalan kami. Berkat kebijakan pemerintah yang menentang <POLICYNAME>, dia hampir tidak berdaya, dan meninggal di tempat kejadian."" adegan tersebut. Istrinya <FEMALENAME> dan putrinya <FEMALENAME> berbicara kepada kami malam ini tentang pendapat mereka tentang pemerintah."""
#,caremissions_lack,""Malam ini, penjual mobil klasik yang marah <MALENAME>, Menjelaskan bagaimana kebijakan pemerintah <POLICYNAME> yang membawa bencana ini menghancurkan bisnis mereka yang pernah berkembang pesat. <MALENAME> mungkin harus menutup bisnisnya yang berusia 25 tahun setelah kebijakan pemerintah membuat mobil yang dia jual secara virtual tidak berharga. Satu lagi suara yang hilang untuk <PLAYERSPARTY>. Saksikan laporan spesial kami."""
#,citizenshiptests_lack,""Jajak pendapat eksklusif dari pemirsa kami menunjukkan bahwa banyak orang, seperti <MALENAME>, berharap untuk melihat <PLAYERSPARTY> memperkenalkan kebijakan <POLICYNAME> ke negara ini. <MALENAME> menganggapnya gila karena begitu banyak imigran tidak mengambil tindakan apa pun untuk berintegrasi ke dalam negara ini. masyarakat kita. 'Rasanya seperti tinggal di negara asing', katanya dalam laporan malam ini, dan dia tidak sendirian."""
#,corporationtax,""<MALEFULLNAME>, yang sudah lama menjabat sebagai Managing Director International Electronics, sebuah perusahaan manufaktur global, menggunakan media sosial untuk melampiaskan rasa frustrasinya pada tingkat <POLICYNAME> di negara kita. 'Hal ini membuat berbisnis di sini benar-benar tidak kompetitif.' klaimnya. 'Kami mempekerjakan 10.000 orang di sini, namun sejujurnya semua pekerjaan mereka terancam jika kita tidak memiliki rezim pajak yang memungkinkan kita bersaing secara internasional. Ini adalah pasar global, dan pesaing kita membayar pajak yang jauh lebih rendah daripada kita!'. """
#,deathpenalty,""Berita tragis malam ini karena penyelidikan besar telah menemukan bahwa eksekusi negara terhadap <MALEFULLNAME> adalah kasus kesalahan identitas. Bukti forensik baru membuktikan bahwa dia tidak bersalah tanpa keraguan. Ini merupakan pengingat yang mengejutkan bahwa kebijakan pemerintah terhadap <POLICYNAME> dapat, dan dalam beberapa kasus akan menyebabkan kematian warga negara yang tidak bersalah. Kami berbicara malam ini kepada <FEMALENAME> tentang sanksi eksekusi yang diberikan negara terhadap suaminya."""
#,disabilitybenefit_lack,""Ini mungkin tampak seperti hari biasa bagi Anda, tetapi bagi <FEMALEFULLNAME>, Usia <ADULTAGE>, ini merupakan perjuangan untuk bertahan hidup di negara ini. Terkurung di kursi roda karena Polio, dan tidak mampu mendapatkan perawatan profesional, setiap hari adalah sebuah tantangan. perjuangan yang berat. 'Sepertinya pemerintah tidak peduli dengan negara ini.' Dia memberi tahu kami. 'Negara lain punya <POLICYNAME>, mengapa kami tidak?'"""
#,diversityquotasforcompanies,""'Ini benar-benar ladang ranjau bagi orang-orang di posisi saya' - Itulah pandangan <MALEFULLNAME>, seorang manajer sumber daya manusia untuk sebuah perusahaan teknologi besar yang berbasis di ibu kota. Dia menyatakan bahwa sebagian besar waktunya kini dihabiskan untuk berurusan dengan identitas masalah politik, bukan rekrutmen. 'Sepertinya sekarang fokusnya adalah mendapatkan demografi yang tepat untuk pekerjaan-pekerjaan terbaik, dibandingkan orang-orang terbaik. Hal ini merugikan perusahaan ini dan saya yakin hal ini juga merugikan perekonomian kita benar-benar bencana!'."""
#,foodstamps_lack,""<MALENAME>, usia <ADULTAGE> hanyalah salah satu dari banyak warga di negara kita yang mengalami kesulitan memberi makan keluarganya. Setiap hari dia harus menjelaskan kepada putrinya <FEMALENAME> bahwa hanya ada cukup makanan untuk satu kali makan hari ini, karena pemerintah belum menerapkan kebijakan yang layak untuk <POLICYNAME>. Malam ini di Berita Nasional, kami menceritakan kisahnya yang memilukan..."""
#,importtarrifs,""<FEMALEFULLNAME> dulunya memiliki kehidupan yang menyenangkan dengan menjalankan bisnis sepeda keluarga kecil-kecilannya, yang suatu hari nanti ia harap dapat diwariskan kepada putrinya <FEMALENAME>. Sayangnya impian tersebut kini tampak hancur oleh kebijakan pemerintah tentang <POLICYNAME>. 'Kami tidak bisa mungkin mampu membayar tarif atas komponen yang harus kami impor', katanya kepada kami. 'Tarif ini akan membuat saya gulung tikar'."""
#,junkfoodtax,""Selama tiga generasi, <FEMALEFULLNAME> dan keluarganya telah menjalankan pabrik makanan kecil ternama yang membuat permen untuk anak-anak, menjualnya ke seluruh negeri. Ini adalah bisnis yang kompetitif, namun kini berada pada titik puncaknya karena perusahaan berjuang untuk menyerap kenaikan harga disebabkan oleh pemerintah <POLICYNAME>. 'Kami tidak bisa bertahan dalam bisnis dengan pajak ini.' - dia memberi tahu kita melalui air matanya malam ini. 'Saya tahu pemerintah mengkhawatirkan obesitas dan kesehatan, namun konsekuensinya bagi kita sangat menyedihkan. Mereka pasti kehilangan suara saya.'"""
#,labourlaws,""Laporan khusus malam ini mengenai penutupan salah satu bisnis manufaktur tertua kami. Di sela-sela tangisnya, CEO <FEMALEFULLNAME> memberi tahu kami betapa menyedihkannya penutupan perusahaan keluarga ini. 'Tidak mungkin menjalankan bisnis dalam kondisi seperti ini negara dengan negara bagian <POLICYNAME> kami?' Dia mengatakan kepada kami. 'Serikat buruh membuat kami terpuruk'."""
#,luxurygoodstax_lack,""'Ini akan menjadi hari yang sangat dingin sebelum saya memberikan suara saya kepada <PLAYERSPARTY>' - Itulah klaim luar biasa yang dibuat malam ini oleh <MALEFULLNAME>, yang pernah menjadi aktivis partai yang menyerukan kepada pemerintah untuk melakukan sesuatu terhadap level tersebut. mengenai ketidaksetaraan di negara ini. Seperti kebanyakan orang, Ia bertanya mengapa kita tidak memiliki <POLICYNAME>. 'Gila, saya membayar pajak yang sama untuk membeli sekaleng kacang-kacangan seperti yang dibayarkan para miliarder ini untuk kapal pesiar ketiga mereka' - katanya kepada kami. malam ini."""
#,mansiontax,""'Saya sudah tinggal di sini selama enam puluh delapan tahun, dan pemerintah memaksa saya keluar' - Kata-kata <FEMALEFULLNAME>, seorang pensiunan wanita yang tidak punya pilihan selain menjual rumah keluarganya karena dia tidak mampu membayar apa yang disebut < POLICYNAME>. Kaya aset tentunya, dia mewarisi bangunan bersejarah yang besar, namun dengan pendapatan di bawah rata-rata, dia tidak mampu membeli makanan, membayar tagihan, dan membayar pajak baru kepada pemerintah. 'Itu kejam menurut saya haruskah ada cara yang lebih baik bagi pemerintah untuk mengumpulkan uang?' - dia memberitahu kita malam ini."""
#,militaryspending,""Pensiunan jenderal <MALEFULLNAME> berbicara kepada kita malam ini tentang keadaan angkatan bersenjata kita yang mengejutkan. 'Tingkat <POLICYNAME> kita sangat menyedihkan, angkatan bersenjata kita sama sekali tidak mampu meningkatkan pertahanan negara'. Senjata tanpa amunisi, Tank tanpa suku cadang, Pesawat dengan perawatan yang mengejutkan... ini adalah hasil dari keputusan mengejutkan pemerintah kita."""
#,minimumwage_lack,""Bangun jam 5 pagi, harus bekerja pada jam 6 pagi, membersihkan, menggosok, dan mencuci setiap permukaan di restoran cepat saji...dan dengan sedikit uang <FEMALEFULLNAME> tidak hanya membutuhkan satu tapi dua pekerjaan untuk membayar sewa dan biaya pangan selama seminggu. 'Sudah waktunya pemerintah memperkenalkan <POLICYNAME>.' dia memberitahu kami. 'Politisi tidak akan melakukan pekerjaan ini, demi bayarannya, tapi mereka pikir itu baik-baik saja bagi orang-orang seperti saya.'"""
#,onechildpolicy,""<FEMALEFULLNAME>,<ADULTAGE> tidak menginginkan banyak hal dari kehidupan, tidak menginginkan kekayaan atau ketenaran, namun satu hal yang sangat dia inginkan adalah seorang anak perempuan. Bersama dengan suaminya yang tercinta <MALENAME>, mereka memiliki seorang anak laki-laki yang luar biasa berusia 4 tahun, tetapi <POLICYNAME> pemerintah berarti anak mereka akan tetap menjadi anak tunggal.' Saya tidak percaya pemerintah menganggap adil jika kita mengabaikan kebahagiaan dengan cara seperti ini. Memaksa putra kami menjadi anak tunggal, dan kami tidak pernah merasakan nikmatnya memiliki anak perempuan.', katanya kepada kami malam ini."""
#,organdonation,""'Saya sangat berterima kasih kepada pemerintah, mereka benar-benar menyelamatkan nyawa suami saya, saya akan memilih <PLAYERSPARTY> sampai saya mati' - itulah pandangan <FEMALEFULLNAME> di acara malam ini setelah dia memuji kebijakan pemerintah tentang < NAMA KEBIJAKAN> karena telah menyelamatkan suaminya setelah kecelakaan kendaraan bermotor yang tragis. Dia tentu saja hanyalah salah satu dari banyak orang yang berterima kasih pada kebijakan ini karena telah menyelamatkan orang yang mereka cintai."""
#,phonetapping_lack,""'Sangat membuat frustrasi' - kata-kata <MALEFULLNAME>, seorang perwira polisi senior yang berbicara kepada kami malam ini tentang kegagalan polisi menangkap seorang pembunuh berantai yang mengintai ibu kota kami. 'Dengan undang-undang yang menghalangi kami untuk mendengarkan potensi penjahat yang kejam, kami berperang dengan satu tangan terikat di belakang punggung', katanya kepada kami saat ia menyerukan kepada pemerintah untuk menerapkan kebijakan <POLICYNAME>. 'Berapa banyak lagi orang tak bersalah yang harus mati sampai pemerintah memahaminya', ia bertanya ."""
#,policeforce,""Selama bertahun-tahun sebagai petugas polisi, Sersan <MALEFULLNAME> sangat peduli dengan keadaan kepolisian. Setiap hari, dia harus memberi tahu anggota masyarakat yang peduli bahwa kejahatan yang mereka laporkan tidak akan diselidiki, atau bahwa kita tidak mempunyai cukup sumber daya manusia untuk menangani masalah-masalah tersebut. 'Kita hanya melakukan pemadaman pada kasus-kasus terburuk, namun kita masih tertinggal.' - dia memberi tahu kami. 'Saya sebenarnya takut dengan apa yang akan terjadi jika kami tidak segera mendapatkan lebih banyak uang'."""
#,pollutioncontrols_lack,""Setiap malam <FEMALEFULLNAME>, seorang siswi yang tinggal di dekat salah satu pusat industri terbesar kami tersedak dan batuk sepanjang malam karena gangguan tidur. Masalah pernapasannya tidak diragukan lagi disebabkan oleh tingkat polutan yang mengejutkan yang dipompa keluar dari pabrik kami setiap hari. Ibunya, <FEMALENAME> terisak-isak saat dia menceritakan kepada wartawan kami bagaimana perasaannya bahwa kurangnya <POLICYNAME> benar-benar menghancurkan kehidupan anaknya."""
#,racialprofiling,""Dalam laporan yang mengejutkan malam ini, kami berbicara dengan anggota etnis minoritas yang dibuat merasa seperti orang asing di negara mereka sendiri karena kebijakan pemerintah mengenai <POLICYNAME>. 'Ini hanyalah pelecehan rasial yang direstui negara' kata <FEMALENAME>, salah satu dari pemirsa kami, yang dihentikan tiga kali oleh polisi dalam satu hari. Dia yakin dia menjadi sasaran khusus karena warna kulitnya, sebuah kebijakan yang dia anggap menjijikkan."""
#,righttodie_lack,""'Saya tidak tahu mengapa pemerintah melakukan hal ini' - Kata-kata <FEMALEFULLNAME> ketika menggambarkan penderitaan sehari-hari ibunya yang sudah lanjut usia, dalam kesakitan yang akut dan terus-menerus karena kondisi yang tidak dapat disembuhkan yang telah mengubah hidupnya seperti di neraka. 'The pemerintah masih menentang <POLICYNAME>, dan mereka perlu menatap mata ibu saya dan melihat penderitaan yang mereka timbulkan,' katanya kepada kami malam ini."""
#,roadbuilding,""Bagi pengendara, perluasan jalan raya nasional mungkin tampak seperti investasi bagus, tapi seperti yang kita lihat di acara malam ini, ini hanyalah neraka bagi <FEMALEFULLNAME>. Sebelumnya dia adalah pendukung pemerintah, dia sangat marah karena rumahnya , memang seluruh komunitasnya akan dihancurkan untuk membuka jalan baru. 'Sepertinya mereka tidak peduli' - dia memberitahu kita malam ini."""
#,sciencefunding,""Fisikawan yang diakui secara nasional <FEMALEFULLNAME>, Usia <ADULTAGE>, berbicara kepada kita malam ini tentang rasa malu yang dia takuti terhadap keadaan <POLICYNAME> di negara ini. 'Saya malu ketika berbicara dengan rekan-rekan di negara lain, tempat mereka mengambil ilmu pengetahuan dan melakukan penelitian dengan serius. Rasanya seperti kita berada di zaman batu. Saya khawatir akan masa depan ilmu pengetahuan dan perekonomian kita jika kita tidak mengubah pikiran pemerintah. Negara kita akan menjadi lelucon global."""
#,stemcells_lack,""Tujuh hari yang lalu, <FEMALEFULLNAME> dan suaminya <MALENAME> menguburkan putri mereka yang berusia enam tahun. Sebuah peristiwa yang memilukan dan menyakitkan semakin membuat kecewa karena banyak ilmuwan berpikir bahwa <POLICYNAME> dapat menyembuhkannya, dan dia masih hidup sampai sekarang. 'Saya memahami kekhawatirannya, tapi teknologi ini menyelamatkan nyawa. Bagaimana politisi bisa berdiam diri dan menyaksikan hal ini terjadi?' - dia memberitahu kita malam ini."""
#,universitygrants_lack,""Di seluruh negara kita, terdapat pelajar-pelajar muda, cerdas, dan cerdas yang tahun ini tidak mendapat kesempatan untuk belajar di universitas. Mengapa? Jawabannya sederhana saja. Para pelajar tersebut berasal dari keluarga miskin, dan sama sekali tidak mempunyai uang untuk bersekolah. pemerintah dalam bentuk <POLICYNAME>, mereka akan mengetahui bahwa pendidikan bukanlah sesuatu yang berhak diterima oleh masyarakat miskin di negara ini. 'Ini memalukan, membuat saya malu menjadi warga negara untuk masa depan', salah satu siswa memberitahu kita malam ini dalam laporan yang memilukan ini."""
#,welfarefraud_lack,""Laporan khusus malam ini menyoroti tingkat penipuan yang mengejutkan dalam sistem kesejahteraan kita. Salah satu contohnya adalah <MALENAME> (bukan nama sebenarnya) yang mengklaim berbagai macam tunjangan dari pemerintah, meski memiliki kekayaan yang besar. pekerjaan yang membayarnya secara tunai, dia menolak untuk menyatakannya pada formulir pemerintah apa pun. 'Sangat mudah untuk melakukan hal ini, bodoh sekali jika saya tidak memainkan sistemnya', dia dengan berani mengakuinya kepada reporter kami segera terapkan <POLICYNAME>"""
