#,TerroristAttack,Terroristas atacam teatro de Moscou!,"60-70 terroristas atacaram um teatro de Moscou, nos disseram que pelo menos 800 reféns foram feitos, os terroristas têm muitos explosivos dentro, Nossas Forças Spetsnaz, SOBR, Polícia e FSB estão prontos para invadir o prédio e derrubar a ameaça, ou podemos ceder às exigências do terrorista.",
#,TerroristAttack_0,Atendendo às Demandas,"Ivan Petrov, Seu primeiro-ministro de confiança diz, Esses terroristas não têm medo de matar cada um desses reféns e lutar até o último homem, devemos ceder às suas demandas para evitar perder muitas vidas.",
#,TerroristAttack_1,Tempestade no Edifício,"Seu Ministro da Defesa, General do Exército Victor Molotov, Diz, Nós Simplesmente Não Podemos Abaixar Nossas Armas e Desistir! O que você acha que as outras superpotências dirão? Você acha que isso impedirá outros terroristas de fazer o mesmo? Devemos invadir o prédio imediatamente!",
#,AttackUkraine,Devemos Declarar Guerra à Ucrânia?,"A Ucrânia está separada da Rússia há centenas de anos, mas após a queda da União Soviética eles declararam independência, devemos retomar o que era nosso? outras coisas?",
#,AttackUkraine_0,Não ataque,"Não podemos nos dar ao luxo de atacar a Ucrânia agora.",
#,AttackUkraine_1,Ataque!,"Devemos recuperar o que é nosso por direito!",
#,AttackMongolia,Devemos Declarar Guerra à Mongólia?,"A Mongólia tem sido um aliado da União Soviética por alguns anos na Segunda Guerra Mundial, mas após a queda da União Soviética agora eles podem ser melhor descritos como "amigáveis", deveria retomamos o que era nosso ou focamos em outras coisas?",
#,AttackMongolia_0,Não ataque,"Não podemos nos dar ao luxo de atacar a Mongólia agora.",
#,AttackMongolia_1,Ataque!,"Devemos recuperar o que é nosso por direito!",
#,ChineseAlert,Um de nossos espiões foi preso!,"Enquanto em uma missão um de nossos melhores espiões foi preso após um fracasso na missão, felizmente ele não é um cidadão de Taiwan e eles não sabem que ele trabalha para nós, Os chineses anunciaram que, se nenhum governo agir e resolver a situação, o espião será punido com a morte! O que devemos fazer?",
#,ChineseAlert_0,Não faça nada,"Não podemos arriscar uma guerra ou outros problemas com os rebeldes agora!",
#,ChineseAlert_1,Cumprir,"Precisamos agir agora! Não podemos deixar nosso espião morrer!",
#,NativeTribe,Um explorador acabou de encontrar uma tribo nativa!,"Enquanto explorava a floresta amazônica, um explorador encontrou uma tribo nativa, Eles não parecem ter visto o explorador, O que fazemos?",
#,NativeTribe_0,Deixe-os em paz,"Não devemos interferir na tribo.",
#,NativeTribe_1,Interaja com a tribo,"Devemos enviar uma equipe e interagir com a tribo",
#,NATOSanctions,NATO Faça uma oferta!,"O presidente dos Estados Unidos se oferece para suspender todas as sanções da OTAN se aceitarmos suas exigências, o que devemos fazer?",
#,NATOSanctions_0,Capitar e Aceitar Demandas,"Para o bem de nosso povo, devemos concordar.",
#,NATOSanctions_1,Recusar a oferta,"Não faremos acordos com aqueles que nos prejudicaram!",
#,RussianArmsDeal,Rússia fez uma oferta!,"Acabamos de receber uma oferta da Rússia para um acordo de armas, já tivemos um acordo de armas com a Rússia que a OTAN não gostou, ousamos fazer outro?",
#,RussianArmsDeal_0,Gentilmente Recusar,"Não devemos antagonizar nossos aliados.",
#,RussianArmsDeal_1,Aceite a oferta,"Nós ainda somos leais aos nossos aliados, Estamos simplesmente ficando mais fortes para o bem da defesa.",
#,SouthKoreanDeal,Coreia do Sul fez uma oferta!,"Acabamos de receber uma oferta dos rebeldes, eles se oferecem para fazer um pequeno acordo que beneficiará a nós dois.",
#,SouthKoreanDeal_0,Declínio,"Não devemos lidar com a escória rebelde.",
#,SouthKoreanDeal_1,Aceite a oferta,"Nós aceitaremos a oferta para o bem do povo coreano.",
#,NorthKoreanDeal,Coreia do Sul fez uma oferta!,"Acabamos de receber uma oferta dos rebeldes, eles se oferecem para fazer um pequeno acordo que beneficiará a nós dois.",
#,NorthKoreanDeal_0,Declínio,"Não devemos lidar com a escória rebelde.",
#,NorthKoreanDeal_1,Aceite a oferta,"Nós aceitaremos a oferta para o bem do povo coreano.",
#,GreekCyberAttack,Nós fomos atacados!,"Acabamos de ser atacados! é um ataque cibernético que vazou informações para os atacantes! temos informações suficientes para indicar que é um ataque grego, mas não o suficiente para convencer as outras nações.",
#,GreekCyberAttack_0,ATAQUE-OS MAIS FORTE!,"Não podemos deixar isso sem resposta, devemos atacá-los com nossos hackers para mostrar a eles que não vamos deixá-los passar por cima de nós! - Disse o seu principal general",
#,GreekCyberAttack_1,Investigar e reportar ao mundo!,"Nós atacá-los pode nos fazer parecer com o atacante, devemos tentar encontrar qualquer informação e então reportá-la à ONU. - Diz seu principal conselheiro",
#,GreekCyberAttack_2,Modernize nossos sistemas!,"Se para evitar que isso aconteça novamente, devemos melhorar nossos sistemas para proteger melhor nossa nação. - Diz o gerente de TI enquanto digita irritantemente em seu laptop depois de conseguir se infiltrar na reunião.",
#,RussianDeal,Temos um acordo Camarada,"Temos um acordo para você camarada, vamos fornecer-lhe armas e protegê-lo dos EUA e dos terroristas, enviaremos mais homens e equipamentos do que os EUA fizeram, o que você diz?.",
#,RussianDeal_0,Não está certo,"Quem faz um acordo como esse? Eles não pediram nada, eles devem estar tentando fazer alguma coisa, não podemos ser enganados por eles, mesmo que eles nos forneçam e nos ajudem. - Diz seu principal conselheiro ",
#,RussianDeal_1,Devemos confiar neles,"Sim, parece um pouco estranho, mas é um ótimo negócio, de qualquer forma, estamos cansados ​​de lutar, não importa o que eles façam, é melhor do que lutar contra os terroristas investigados. - Diz seu vice Presidente",
#,SaudiDeal,Temos um acordo!,"Temos um acordo urgente para discutir, os sauditas estão oferecendo um pequeno acordo de petróleo.",
#,SaudiDeal_0,É um grande negócio!!,"Devemos aceitar! este acordo vai acabar com uma rivalidade que custa muito dinheiro para os dois lados, isso pode melhorar muito nossa economia, Eles estão arriscando sua aliança com os EUA para fazer isso acordo, vamos assinar!",
#,SaudiDeal_1,NÃO, NÓS NÃO PODEMOS!,"Por favor, pense nisso, estaremos vendendo nosso petróleo a um preço muito mais barato, sim, não podemos vender muito petróleo, mas não podemos simplesmente entregá-lo a eles, é mais inteligente fazer um contra-acordo ou simplesmente recusar!",
#,Rainforest Defense Project,Defendendo nossa grande maravilha da natureza,"A Floresta Amazônica, Nossa maior maravilha natural, A maior floresta tropical do mundo, e um simples do Brasil está ameaçada!!",
#,Rainforest Defense Project_0,DEVEMOS DEFENDER A FLORESTA AMAZÔNICA,"Não podemos deixar a floresta amazônica queimar e ser cortada! devemos defendê-la, para o bem de nosso povo, para o bem do mundo e para o bem de todos os animais que vivem nele!",
#,Rainforest Defense Project_1,VAMOS CONFIAR EM DEUS,"Deus protege a todos, Sem ele, não teríamos a floresta, Nosso Senhor cuida de nós e ele pode nos proteger, e nossa grande floresta, então ore comigo e deixe Deus salve a todos nós.",
#,NewDams,Construção de novas barragens,"Precisamos de energia para apoiar nosso povo e economia, vamos construir mais barragens!",
#,NewDams_0,É uma má ideia,"Precisamos da energia, mas o plano fornecido significa que cortamos as fontes de água para outras nações que precisam da água, o mundo vai nos odiar!",
#,NewDams_1,Devemos Construí-los!,"A maioria dessas nações não gosta de nós de qualquer maneira, estamos lutando contra eles no mar da china para obter o controle, então vamos mostrar a eles o poder da china!",
#,NorthenBridgeIncident,Temos um problema!",Uma família chinesa chegou à nossa fronteira, eles cometeram alguns crimes menores na china, mas estão com medo e tentando fugir para o nosso país, o que fazemos?",
#,NorthenBridgeIncident_0,Envie-os de volta,"Não podemos nos dar ao luxo de prejudicar nossas relações com a China! Envie-os de volta agora antes de invocarmos a China!",
#,NorthenBridgeIncident_1,Salve-os!,"Meu líder supremo, devemos mantê-los, você não vê? eles só cometeram crimes menores, eles realmente deveriam morrer por eles? Por favor, salve-os!",
#,NorthKoreanSub,Temos um problema!",Acabamos de localizar um velho submarino enferrujado em nossa costa oeste, temos certeza de que podemos ver a insígnia norte-coreana no submarino, Quais são seus pedidos?",
#,NorthKoreanSub_0,Envie os boinas pretas!,"Precisamos limpar o submarino, Pode conter armas de destruição em massa ou armas químicas!",
#,NorthKoreanSub_1,Envie uma equipe de resgate!",Eles devem ser fugitivos norte-coreanos! Devemos ajudá-los! Dê-nos a ordem!",
#,GreekOffer,Temos uma oferta!",A Grécia acabou de se oferecer para resolver a questão de Chipre, Eles concordam em se retirar totalmente da região se o fizermos, Concordamos?",
#,GreekOffer_0,Vamos confiar neles!,"Podemos resolver esse problema e muitos outros se confiarmos neles! Não podemos agir como macacos lutando o tempo todo!",
#,GreekOffer_1,Não podemos confiar neles!,"Quando nos retirarmos, eles invadirão o norte do Chipre! Não podemos permitir isso!",
#,AdvancedPoliceTraining,Novo treinamento policial?,"Nossa aplicação da lei vem usando quase o mesmo treinamento há anos, muitas pessoas da comunidade de aplicação da lei e do governo pedem para obter um novo módulo de treinamento, mais novo e mais avançado para ajudar a proteger nós do terrorismo e dos criadores do crime.",
#,AdvancedPoliceTraining_0,É uma ótima ideia,"Sempre podemos usar um treinamento melhor para proteger nosso pessoal e derrubar infratores da lei em nosso país.",
#,AdvancedPoliceTraining_1,Nós não precisamos disso!",Nosso treinamento é bom o suficiente, nosso país não tem muito crime, portanto, não precisamos dele!",
#,OilOrGreenPower,Petróleo ou energia verde?,"Desde a descoberta da eletricidade, o mundo inteiro quase só usou fontes não renováveis ​​para eletricidade, estamos prontos para mudar isso?",
#,OilOrGreenPower_0,Sim!,"Nossa nação e o mundo inteiro só podem se beneficiar disso! Devemos fazê-lo!",
#,OilOrGreenPower_1,Não!,"O resto do mundo não mostra nenhum sinal real de mudança, por que deveríamos?",
#,NorwegianGovermentScandal,Nosso monarca cometeu um erro!,"Nosso Monarca foi pego tendo relações sexuais com uma estrela po*n conhecida! Nós o apoiamos publicamente?",
#,NorwegianGovermentScandal_0,Sim!,"Mesmo que ele tenha cometido um erro, devemos apoiá-lo!",
#,NorwegianGovermentScandal_1,Não!,"Não podemos apoiá-lo depois de fazer isso!",
#,Artifacts,Indígenas reivindicam relíquias!,"Há um século, um de nossos museus exibe relíquias sagradas de uma tribo indígena em uma antiga colônia. Representantes da tribo dizem que as relíquias foram roubadas e solicitaram eles sejam devolvidos à sua terra natal. A tribo nos ofereceu réplicas recém-criadas como substitutos."
#,Artifacts_0,Devolver relíquias,"Nós roubamos terras e liberdade dos povos indígenas. O mínimo que podemos fazer hoje é devolver essas relíquias. Vamos aceitar a palavra deles de que vão colocá-las em exibição em sua terra natal."
#,Artifacts_1,Mantenha as relíquias em exposição,"Nós mantivemos as relíquias seguras por cem anos e as exibimos ao público. Se as dermos, elas podem ser danificadas ou roubadas. Essas relíquias pertencem a um museu!"
#,Autonomy,Autonomia para nação indígena?,"Desde tempos imemoriais, uma tribo indígena vive em uma província, que foi anexada ao nosso país há alguns séculos. Hoje, algumas dessas pessoas solicitam uma legislatura local. A autonomia promoveria sua língua e cultura nativas, além de reduzir a tensão racial. Os membros mais patriotas da tribo estão preocupados que uma província autônoma se torne mais pobre do que nosso país como um todo."
#,Autonomy_0,Conceder autonomia,"Há muito tempo, roubamos a terra desta tribo e já é hora de devolvê-la. Pode ser um revés para o bem-estar, mas você não pode colocar um preço na liberdade. Todos os povos deveriam poder para eleger políticos que falem a sua própria língua."
#,Autonomy_1,Integrar os povos indígenas,"Nossa nação se baseia na unidade na diversidade. Nosso governo tem funcionado bem e não devemos enviar essas pessoas para a armadilha da pobreza. Sua cultura sobreviveu até hoje e sobreviverá no futuro, como parte do nosso património nacional."
#,CartoonCrisis,Profeta Cartoon Crise!,"Um jornal nacional publicou uma série de charges que zombam de um profeta religioso estrangeiro. Líderes religiosos reclamam que as charges são racistas e sugerem um boicote internacional contra nosso país. Em uma aliança incomum, liberais e os patriotas argumentam que todas as autoridades religiosas devem estar sujeitas a críticas."
#,CartoonCrisis_0,Condenar cartoons,"Somos um povo privilegiado, que precisa ser sensível sobre qualquer coisa parecida com racismo. Claro que não podemos censurar legalmente o jornal, mas punir a empresa de mídia boicotando-os e tomando partido da congregação religiosa, acalmaria as queixas."
#,CartoonCrisis_1,Defender desenhos animados,"A liberdade de expressão é a pedra angular de uma sociedade civilizada, especialmente quando se trata de questionar o dogma religioso. Figuras de autoridade nacionais e estrangeiras, não devem ser capazes de evitar críticas e sátiras."
#,CitizenByBirth,Cidadania por nascimento?,"Com o aumento da imigração, precisamos rever nossa lei de cidadania. Quem deve nascer cidadão do nosso país?"
#,CitizenByBirth_0,Cidadania por local de nascimento,"Famílias de imigrantes argumentam que todas as crianças nascidas aqui devem se tornar cidadãs, independentemente da cidadania dos pais."
#,CitizenByBirth_1,Cidadania por linhagem,"Conservatives argue that lineage is more important than birthplace. Children born to a mother, or a proved father, who is citizen of our country, should be citizens here. In practice, this means that we will have less immigration, and more emigration."
#,HolyLand,Conflito Palestino,"O conflito sem fim entre Israel e Palestina tem escalado novamente. Israel deixa claro que encerrará relações diplomáticas com qualquer nação que reconheça seu rival. Que lado devemos escolher?"
#,HolyLand_0,Não reconheça a Palestina,"Os capitalistas apontam que Israel é a única nação democrática no Oriente Médio e um importante fornecedor de alta tecnologia. A Palestina não tem controle da maior parte de seu território reivindicado e não é um país funcional. "
#,HolyLand_1,Reconhecer a Palestina,"Os socialistas enfatizam que Israel é um governo de ocupação opressivo, responsável pela maioria das mortes no conflito. A comunidade internacional prefere uma solução de dois estados, então precisamos reconhecer a Palestina mais cedo ou mais tarde. , também melhoraríamos as relações com os países árabes exportadores de petróleo."
#,RaceCensus,Censo baseado na raça,"À medida que um novo censo está chegando, há um debate se o governo deve registrar a origem étnica, credo religioso ou "raça" autoidentificada dos cidadãos. Os socialistas afirmam que esses registros seriam úteis para destacar e combater a discriminação. Liberais e religiosos alertam sobre o risco de que o sistema possa ser abusado."
#,RaceCensus_0,Registro de etnia,"Embora a ciência moderna tenha refutado o conceito de "raça", não podemos ignorar a existência de discriminação contra pessoas de determinada aparência. Essa reforma tornará governo e setor privado mais conscientes para tratar os cidadãos de forma igualitária e proporcionar dados úteis para cientistas sociais."
#,RaceCensus_1,Não registre a etnia,"A história nos ensinou os perigos dos registros com base na origem étnica. Existe o risco de que o governo, ou outro órgão, pesquise as pessoas com base em sua etnia ou credo; ou pior ainda, que alguns dos esses grupos seriam cercados e detidos. Só existe uma raça: a humana."
#,LegalizeBribery,Legalize o suborno,"O suborno tornou-se comum entre os políticos do nosso país. A situação é tão ruim que mesmo as leis mais rotineiras estão sendo detidas por favores políticos. Isso deve ser resolvido."
#,LegalizeBribery_0,Aumentar a supervisão,"O comércio de cavalos, seja chamado de lobby ou suborno, está destruindo nosso país. Precisamos eliminar essa cultura de corrupção na fonte."
#,LegalizeBribery_1,Legalize o suborno,"Por que rodeios? Políticos fazem favores uns aos outros o tempo todo, essa é a única maneira de tudo ser feito. Todo esse sigilo é o motivo pelo qual as coisas estão indo tão devagar em primeiro lugar!"
#,ContributionLimits,Limites de contribuição,"Grandes contribuições anônimas tornaram-se comuns em nossa sociedade. Há muitos que questionam a justiça dessa prática e insistem que ela subverte a democracia e o princípio de 'uma pessoa, um voto'. Outros insistem que isso se enquadra na liberdade de expressão."
#,ContributionLimits_0,Aumentar os limites de contribuição,"A política é para os grandes tubarões. Os tubarões são vencedores. E eles não olham para trás. Porque eles não têm pescoço. Pescoços são para ovelhas. Precisamos de um pastor orgulhoso para este rebanho de tubarões."
#,ContributionLimits_1,Limites mais baixos de contribuição,"Contribuições políticas anônimas dos super-ricos estão distorcendo excessivamente o debate político em nosso país. Além disso, corporações multinacionais podem explorar isso e potencialmente permitir que interesses estrangeiros influenciem nossa política. Isso deve ser considerado um ultraje em qualquer país que se autodenomine uma democracia."