#,BorderConflict,国境紛争！,"大胆な国が国境紛争を始めたばかりです！ 私たちの軍隊は従事しており、より多くの援軍が途中にあります。"
#,GovermentScandal,,政府のスキャンダル！,"あなたの非常に信頼された役人の一人は、これが発見された直後に、政府支出の支払いに使用されることになっていたお金を盗んでいました。"
#,ArtifactsDiscovered,私たちはアーティファクトを発見しました！,"私たちのチームの1つは、長い間私たちの文明に失われたアーティファクトを発見することができました！."
#,AirAccident,エアアクシデント！,"機器や車両を輸送する私たちの軍用貨物機の一つは、未知の理由のために墜落した、我々は問題の調査を開始した、我々はすぐに調査が行われるように、私たちのトップ軍の個人に送信されたレポートを持っている必要があります。.."
#,AShootingStar流れ星だ!,"私たちはちょうど空を照らす流れ星を持っていました！"
#,SchoolShootingPrevented,私たちは,学校の撮影を防止しました！,多くの人々は、私たちがそれを止めて賞賛されていることに満足していますが、一部の親や他の活動家は、そもそもそれが起こらないようにすることができたと考えています。"
#,SchoolShooting,学校の撮影！,"今日、地元の学校から一人の十代は、彼の父親9ミリメートルピストルと5.56ライフルショットを運ぶと12他の十代の若者と2教師を殺し、今朝22人を負傷し、警察は撮影にrespoundedと十代を撃ち、殺した、私たちの国は大幅にこの悲劇的なイベントから損傷を受けています。"
#,LocalHero,生まれた英雄,"地元の修理工場と小さな家の火事で、非番の消防士が行動に飛び込み、両方の建物で11人を救いました。ありがたいことに、誰も重傷を負っていませんでしたが、悲しいことに建物は失われましたが、消防士は失われた可能性のある命を救い、以前の建物と同じ運命に会うことから建物を保護したヒーローです。"
#,GovermentTraitorArrested,政府の裏切り者を逮捕しました！,"あなたの非常に信頼された役人の一人は、政府の費用を支払うために使用されるはずだったお金を盗んできました,これが発見された直後に、公式はalmostedが国を離れることができました,しかし、私たちの警察と一緒に私たちのシークレットサービスは、彼が逃げる前に彼を逮捕することができました!"
#,HugeFire,巨大な火災！,"悲劇的な事故は、修理工場で巨大な火災を引き起こしました！ 悲しいことに、最初の応答者は、火災が急速に広がるのを止めるのに十分な早く到着することができませんでした。"
#,ArtifactsStolen,いくつかは盗まれたアーティファクトでした！,"昨夜、6人の強盗が私たちの国立博物館に入り、多くの貴重な遺物を盗みました、警察は強盗を特定することができました情報があれば、アーティファクトを取得することにつながる情報に対して100000ドルの報酬を警察に報告してください。 DDCの記者は言った"
#,CrimeSpree,市の犯罪まくる！,"男と女は、警察が容疑者を探して通りを埋める、captial市で犯罪酒宴を開始し、セキュリティチームは、この苦労してあなたを守るためにあなたに割り当てら"
#,ZooBreak,動物は動物園を脱出！,"動物は通りを埋め、交通を遮断し、recksをcasuingと報告は、財産を損傷する動物の中に注ぎ、さらには攻撃の。"
#,Flood,Citesが殺到しています！,"多くの引用は、洪水が大雨の後に起こっている持っています。"