#,money_supply1,50,,,,,,,,,,,,,,,
#,money_supply2,-50,,,,,,,,,,,,,,,
#,mpt, planificado, terreno comprado, empresa constructora contratada, construcción iniciada, 25%, 50%, construcción terminada, infraestructura exterior, limpieza, terminada,,,,,
#,PPF, Personal básico, Equipo de protección básico, Aviones PPF, Equipo especial PPF, Vehículos especiales de contención PPF, Capacitación de equipos PPF, Sistemas de advertencia PPF, Equipo de operaciones especiales PPF, Activos navales PPF, Centros de evacuación PPF,,,,,,,
#,StateAnimalShelters, Refugios Pequeños, 5 Cuidadores Por Refugio, Capacitación Básica, Refugios Medianos, 10 Cuidadores Por Refugio,Enriquecimiento Básico Del Hábitat, Tabletas Desinfectantes, Capacitación Estándar, Aumento De Suministros Para Mascotas, Anuncios, Refugios Grandes, 20 Cuidadores Por Refugio,,,,
#,StateAnimalControl,Sin Equipo Ni Entrenamiento,Entrenamiento Básico, Guantes De Manipulación, Palos de Jab,Postes de Control de Animales,Agarrador de Animales,Bozales,Redes De Jaula,Trampas/Guaridas Para Gatos/Perros, Entrenamiento Estándar, Pistolas De CO2, Pistolas de Dardos, Cajas de Entierro, Camillas y Elevadores, Microchips de Rastreo de Animales,
#,StateOrphanages,Hogares Para Niños Pequeños [10-20],Edificios Antiguos Convertidos [50-80],Orfanatos Medianos Construidos Por El Estado[100-200], Un Miembro Del Personal Por Cada Cinco Huérfanos,Dos Comidas Al Día,Subvenciones Básicas,Un Miembro Del Personal Por Cada Cuatro Huérfanos,Orfanatos Grandes Construidos Por El Estado[1000-2000],Calidad De Comida Mejorada,Capacitación Laboral Y De Rehabilitación,3 Comidas Al Día,Orfanatos Enormes Construidos Por El Estado[5000-8000],Un Miembro Del Personal Por Cada Tres Huérfanos,Personal Mejorado Capacitación,Un Miembro Del Personal Por Cada Dos Huérfanos,
#,PoliceTraining,Sin Entrenamiento,Entrenamiento Mínimo de desescalada,Entrenamiento Mínimo Mano A Mano,Entrenamiento Mínimo de Control de Disturbios,Entrenamiento Mínimo de Armas de Fuego,Entrenamiento Mínimo de Conductores,Entrenamiento Mínimo de SWAT/HRT, Curso de Entrenamiento Estándar Completo, Entrenamiento de TVI, Entrenamiento de Formación de Persecución, Entrenamiento Encubierto, Entrenamiento de Investigación, Entrenamiento de Interrogatorio, Entrenamiento Avanzado Completo,,
#,TaxFraudDepartment,Operaciones muy básicas, Departamento de esqueletos, Operaciones básicas, Equipo de investigación único, Asistencia policial, Intercambio de información básica, Agentes bien provistos, Autoridad total del agente, Colaboración entre departamentos, Intercambio completo de información, Mayores recursos de la agencia, Investigaciones internas, Oficina forense totalmente equipada. Múltiples equipos de investigación,,
#,UNNationStatus,No miembro, Estado observador, Miembro, Miembro permanente,,,,,,,,,,,,
#,TheDMZ,Frontera normalizada, mayor seguridad, alerta máxima, DMZ, seguridad extrema, monitoreo tecnológico expansivo, gasto poco realista,,,,,,,,,
#,State Opium Regulation,High Opium Regulation,Increased Opium Regulation,No Opium Regulation,State Opium Investment,Opium State Monopoly
#,Amazon Sovereignty,Total Protection,Sustainable Exploitation,Increased Expansion,Destructive Exploitation,
#,New Administrative Capital,Land Allocation,Basic Infrastructure,Administrative Buildings,Secondary Buildings,Uility Coverage
#,Strategic Shipping Canal,Land Clearance,Canal Dug,Canal Infrastructure,Canal Opened
#,Artificial Island Resort,Island Formation,Basic Infrastructure,Uility Coverage,Resort Buildings