#,BorderConflict,국경 충돌!,"대담한 국가가 막 국경 분쟁을 시작했습니다! 우리 군대가 교전 중이며 더 많은 지원군이 오고 있습니다."
#,GovermentScandal,정부 스캔들!,"귀하의 신임받는 관리 중 한 명이 정부 지출에 사용되어야 할 돈을 훔쳐왔으며, 이 사실이 발각된 직후 그 관리는 간신히 나라를 떠났습니다."
#,ArtifactsDiscovered,우리는 유물을 발견했습니다!,"우리 팀 중 한 명이 우리 문명에서 오랫동안 잊혀진 유물을 발견할 수 있었습니다!."
#,AirAccident,항공 사고!,"장비와 차량을 수송하던 우리 군용 화물기 중 한 대가 알 수 없는 이유로 추락했습니다. 우리는 이 문제에 대한 조사를 시작했습니다. 조사가 끝나는 대로 우리 군 최고 책임자에게 보고서를 보내야 합니다..."
#,AShootingStar, 슈팅 스타!,"우리는 방금 하늘을 비추는 별똥별을 가졌습니다!"
#,SchoolShootingPrevented,학교 총격 사건을 막았습니다!,"고맙게도 우리 학교 자원 담당관 중 한 명이 학교 총격 사건을 막을 수 있었고 많은 사람들이 우리가 그것을 중단하고 칭찬을 받고 기뻐하고 있지만 일부 부모와 다른 활동가들은 우리가 처음."
#,SchoolShooting,학교 촬영!,"오늘 아침, 지역 학교의 한 10대 소년이 아버지의 9mm 권총과 5.56 소총을 들고 12명의 다른 10대와 교사 2명을 살해하고 22명에게 부상을 입혔습니다. 이 비극적인 사건으로 큰 피해를 입었습니다."
#,LocalHero,영웅 탄생,"지역 수리점과 작은 집에서 발생한 화재로 비번인 소방관이 뛰어들어 두 건물에서 모두 11명을 구했습니다. 다행히 인명피해는 없었지만 슬프게도 건물은 모두 소실되었지만, 소방관은 생명을 구한 영웅입니다. 손실될 수 있었고 이전 건물과 같은 운명을 맞이하지 않도록 건물을 보호했습니다."
#,GovermentTraitorArrested,정부 반역자 체포!,"귀하의 매우 신임받는 관리 중 한 명이 정부 지출에 사용되어야 할 돈을 훔치고 있습니다. 이 사실이 발각된 직후 그 관리는 거의 출국할 뻔했지만 우리 경호원과 경찰은 그를 체포할 수 있었습니다. 도망치기 전에!"
#,HugeFire,거대한 불!,"수리점에서 비극적인 사고로 큰 화재가 발생했습니다! 슬프게도 화재가 빠르게 번지는 것을 막을 수 있을 만큼 일찍 도착한 응급 구조원은 없었습니다."
#,ArtifactsStolen,일부 유물이 도난당했습니다!,"어젯밤 6명의 강도가 우리 국립 박물관에 들어와 많은 귀중한 유물을 훔쳤습니다. 경찰은 강도를 식별할 수 있었습니다. 정보가 있는 경우 경찰에 신고하여 유물을 회수할 수 있는 정보에 대해 100,000달러의 보상을 받으십시오. A가 말했습니다. DDC 리포터"
#,CrimeSpree,도시 범죄 행위!,"한 남녀가 수도에서 범죄를 시작했고, 경찰은 용의자를 찾기 위해 거리를 가득 메우고, 이 어려운 시기에 당신을 보호하기 위해 보안 팀이 배정되었습니다."
#,ZooBreak,동물 탈출 동물원!,"동물들이 거리를 가득 메우고, 교통을 차단하고, 신고를 하고, 동물들이 재산을 손상시키고 심지어는 공격을 가한다는 신고가 쏟아집니다."
#,Flood,인용이 범람했습니다!,"많은 인용문에 폭우가 내린 후 홍수가 발생했습니다."