#,BorderConflict，边界冲突！,"一个大胆的国家刚刚开始边界冲突！ 我们的部队已经交战，更多的增援部队正在路上。"
#,GovermentScandal,，政府丑闻！,"你的一位高度信任的官员一直在偷本应用于支付政府开支的钱，在发现这件事后不久，这位官员设法离开了这个国家。"
#,ArtifactsDiscovered，我们发现了文物！,"我们的一个团队能够发现我们文明久违的文物！."
#,AirAccident，空难！,"我们的一架运输设备和车辆的军用货机因不明原因坠毁，我们已经开始对此事进行调查，我们应该在调查完成后立即向我们的高级军事人员发送报告。.."
#,AShootingStar，流星！,"我们刚刚有一颗流星照亮了天空！"
#,SchoolShootingPrevented，我们阻止了学校射击！,"值得庆幸的是，我们学校的一位资源官员能够阻止学校枪击事件，很多人很高兴我们已经阻止了它，我们得到了赞扬，但一些家长和其他活动家认为我们"
#,SchoolShooting，学校枪击案！,"今天，一名来自当地学校的青少年，携带他父亲的9毫米手枪和5.56步枪射击并杀死了12名其他青少年和2名教师，并在今天早上伤害了22其他人，警察"
#,LocalHero，一个英雄诞生，"当地一家修理厂和小房子发生的火灾使一名下班的消防队员立即行动起来，在这两栋楼里救了11人。谢天谢地，没有人受重伤，但不幸的是，这些建筑已经丢失了。"
#,GovermentTraitorArrested，政府叛徒被捕！,"你的一个高度信任的官员一直在偷本应用于支付政府开支的钱，在这件事被发现后不久，这位官员几乎设法离开了这个国家，但是我们的特勤局和我们的警察在他逃跑之前就逮捕了他！"
#,HugeFire，一个巨大的火！,"一场悲惨的事故造成了一个维修店的巨大火灾！ 可悲的是，没有第一反应者能够早到足以阻止火势迅速蔓延。"
#,ArtifactsStolen，有些是被盗的文物！,"昨晚六名劫匪进入我们的国家博物馆，偷走了许多无价的文物，警方已经能够识别劫匪如果您有任何信息，请向警方报告reward100000奖励任何信息，导致检索文物。 一位DDC记者说"
#,CrimeSpree，城市犯罪狂欢！,"一个男人和女人在captial市开始了犯罪狂欢，警察填补了街道寻找嫌疑人，一个安全小组已经分配给你，以保护你在这个困难时期。"
#,ZooBreak，动物逃离动物园！,"动物满大街，堵住交通，投下垃圾，报告说动物破坏财产，甚至袭击。"
#,Flood，城市已经淹没了！,"许多城市在大雨后发生了洪水。"

#,globalsummit1,全球领导人峰会,"一场最近举行的峰会，涉及世界上最强大的几位领导人，进展超出了我们的预期。大家找到了共同点，达成了协议，解决了纷争。世界变得稍微安全了一些，这在一定程度上得益于你的贡献。"