#,mpt,新世界最高的建筑,"建造一座世界上最高的建筑对全世界来说都是一个重要的信息,我们的朋友和敌人都会对我们的成就感到惊讶。"
#,revenueservice,收入服务,"税收服务确保人们按时缴纳税款,许多人说这会更多地伤害中低阶层,但其他人则说,无论如何,我们的国家需要这个机构来确保政府的税收。"
#,freetaxpreparationclasses,免费报税班,"为任何人提供关于如何纳税以及所有非常重要的事情的课程,这可以确保每个人,最重要的是年轻人知道如何纳税,并且可以通过错误地纳税来避免任"
#,pandemicpreparationfund,PPF,"Ppf简称为大流行准备基金,用于保护平民和政府官员免受危及我们国家的疾病。"
#,sas,"国家动物收容所","提供动物收容所给流浪动物或需要的动物一个临时的家,在那里他们得到喂养,洗涤和训练。",
#,sac,"国家动物控制","资助和经营动物控制服务或agancy将允许动物控制官员处理野生,危险和/或需要帮助的动物,并将它们放下,或将它们带到动物收容所或其他",
#,so,"国家孤儿院","国家建造和管理的孤儿院为需要帮助和照顾的孤儿和无家可归的未成年人提供了一个家。",
#,pt,"警察培训","我们给我们的警察更好的培训,他们预制的更好！",
#,wt,"WT"君主,君主"财富税也称为资本税或股权税是一种专注于较富裕的个人和实体（如公司或企业）的税收。 这种类型的税收被称为是无效的君主,君主以提高税收收入君主,君主实际上可以损害税收收入。",
#,bf,"禁止飞行"君主,君主"禁止飞行主要是出于环境原因君主,君主但它可以用于政治或增加使用其他形式的交通工具。",