#,mpt,le plus haut bâtiment du Nouveau Monde,"Construire une structure qui est la plus haute du monde est un grand message pour le monde entier, nos amis et ennemis seront étonnés de notre réussite."
#,revenueservice,Service des recettes,"Un service des recettes garantit que les gens paient leurs impôts et les paient à temps, beaucoup disent que cela nuira davantage à la classe moyenne et basse mais d'autres disent le contraire, peu importe, notre nation a besoin de cette agence pour sécuriser les impôts du gouvernement."
#,freetaxpreparationclasses,Cours gratuits de préparation des déclarations,"Offrir des cours à tous sur la façon de payer des impôts et tout ce qui concerne cela est très important, cela garantit que tout le monde et surtout les jeunes savent comment payer des impôts et peuvent éviter tout problème en le faisant de manière incorrecte."
#,pandemicpreparationfund,PPF,"Un raccourci PPF pour (P)andemic (P)reparation (F)und est utilisé pour protéger les civils et les représentants du gouvernement contre les maladies qui mettent en danger notre nation."
#,sas,"Refuges pour animaux de l'État", "Fournir des refuges pour animaux donne aux animaux errants ou aux animaux dans le besoin un foyer temporaire où ils sont nourris, lavés et entraînés.",
#,sac,"Contrôle des animaux par l'État", "Le financement et l'exploitation d'un service ou d'une agence de contrôle des animaux permettront aux agents de contrôle des animaux de manipuler des animaux sauvages, dangereux et / ou ayant besoin d'aide et de les abattre ou de les emmener dans un refuge pour animaux ou autre centre de détention.",
#,so,"Orphelinats d'État", "Les orphelinats construits et gérés par l'État offrent un foyer aux orphelins et aux mineurs sans abri qui ont besoin d'aide et de soins.",
#,pt,"Formation de la police", "Plus la formation que nous donnons à nos officiers est bonne, mieux ils sont performants!",
#,interest_rate,"Taux d'intérêt", "Les taux d'intérêt influencent de nombreux aspects de notre économie, des taux d'intérêt plus élevés sont généralement mauvais pour la plupart des gens, tandis qu'un taux plus bas nuit à nos banques.",
