#,mpt,le plus haut bâtiment du Nouveau Monde,"Construire une structure qui est la plus haute du monde est un grand message pour le monde entier, nos amis et ennemis seront étonnés de notre réussite."
#,revenueservice,Service des recettes,"Un service des recettes garantit que les gens paient leurs impôts et les paient à temps, beaucoup disent que cela nuira davantage à la classe moyenne et basse mais d'autres disent le contraire, peu importe, notre nation a besoin de cette agence pour sécuriser les impôts du gouvernement."
#,freetaxpreparationclasses,Cours gratuits de préparation des déclarations,"Offrir des cours à tous sur la façon de payer des impôts et tout ce qui concerne cela est très important, cela garantit que tout le monde et surtout les jeunes savent comment payer des impôts et peuvent éviter tout problème en le faisant de manière incorrecte. "
#,pandemicpreparationfund,PPF,"Un raccourci PPF pour (P)andemic (P)reparation (F)und est utilisé pour protéger les civils et les représentants du gouvernement contre les maladies qui mettent en danger notre nation."
#,sac,"Contrôle des animaux par l'État", "Le financement et l'exploitation d'un service ou d'une agence de contrôle des animaux pouvant aux agents de contrôle des animaux de manipuler des animaux sauvages, dangereux et / ou ayant besoin d' "aide et de les abattre ou de les emmener dans un refuge pour animaux ou autre centre de détention.",
#,so,"Orphelinats d'État", "Les orphelinats intégrés et gérés par l'État offrent un foyer aux orphelins et aux mineurs sans abri qui ont besoin d'aide et de soins.",
#,pt,"Formation de la police", "Plus la formation que nous donnons à nos officiers est bonne, mieux ils sont performants!",
#,interest_rate,"Taux d'intérêt", "Les taux d'intérêt influent sur de nombreux aspects de notre économie, des taux d'intérêt plus élevés sont généralement mauvais pour la plupart des gens, tandis qu'un taux plus bas nuit à nos banques.",
#,landvaluetax,"Taxe sur la valeur foncière", "Une taxe sur la valeur foncière (LVT) est un prélèvement sur la valeur d'un terrain sans tenir compte des bâtiments, des biens personnels et d'autres améliorations. , une taxe d'évaluation du site, une taxe à taux fractionné ou une évaluation de la valeur du site.",
#,vat,"Taxe sur la valeur ajoutée", "Une taxe sur la valeur ajoutée (TVA), connue dans certains pays sous le nom de taxe sur les biens et services (TPS), est un type de taxe qui est évaluée progressivement. Elle est prélevée sur le prix d'un produit ou service à chaque étape de la production, de la distribution ou de la vente au consommateur final. Si le consommateur final est une entreprise qui perçoit et verse au gouvernement la TVA sur ses produits ou services, il peut récupérer la taxe payée. Il est similaire à, et est souvent comparée à une taxe sur les ventes. La TVA est un impôt indirect parce que la personne qui supporte en dernier ressort la charge de la taxe n'est pas nécessairement la même personne que celle qui paie la taxe au fisc.",
#,tax_fraud_department,"Département de la fraude fiscale","un département avec des agents chargés d'enquêter sur les personnes, les entreprises et d'autres entités, il se concentre sur la détection de la fraude fiscale et d'autres crimes similaires. En créer un alors qu'une nation a des problèmes d'évasion fiscale augmente le coût de fonctionnement du département, il est conseillé d'en créer un avant ces problèmes ou le plus tôt possible dans ces problèmes.",
#,contributions_to_the_european_union,"Contributions à l'Union européenne","Les pays de l’UE peuvent contribuer à l’UE en euros qui seront utilisés à de nombreuses fins, depuis le soutien aux bénéficiaires de l’UE jusqu’à l’aide humanitaire.",
#,un_nation_status,"Statut de nation des Nations Unies","Le statut de membre d'une nation peut changer beaucoup de choses, sans cela on perd la légitimité, avec lui on la gagne.",
#,dmz,"La zone démilitarisée","Les Corées sont officiellement en guerre depuis les années 1950, même si le temps a été froid pendant la majeure partie de leur histoire, la frontière est toujours hautement militarisée.",
#,dmznk,"La zone démilitarisée","Les Corées sont officiellement en guerre depuis les années 1950, même si le temps a été froid pendant la majeure partie de leur histoire, la frontière est toujours hautement militarisée.",
#,interest_rate_eu,"Taux d'intérêt de l'UE","La BCE est la banque centrale de l'euro et est responsable de la formulation et de la mise en œuvre de la politique monétaire de la zone euro. Les pays de l’UE ne sont pas en mesure de fixer leur propre taux d’intérêt.",
#,vc,"Le saint-siège","Unique en son genre, sept absolus, saint et grand, dirigé par un pape, suprême, évêque de tous, serviteur des serviteurs de Dieu, patriarche, sa sainteté, avec statut et autorité, dirige sous Dieu.",
#,sah,"La question du Sahara","Territoire contesté, nous ne le contrôlons pas totalement, environ 20 % du territoire est détenu par la République Arabe Sahraouie Démocratique",
#,sad,"La question du Maroc","Nous sommes un territoire contesté et une nation menacée, nous ne contrôlons pas totalement nos terres, environ 80% du territoire est détenu par le Maroc, nous devons essayer de rester en vie dans une si mauvaise situation.",
#,empage,"Agence de recrutement","Une agence de recrutement connecte les chercheurs d'emploi avec les employeurs, facilitant le placement de la main-d'œuvre et contribuant au développement économique."
#,govbon,"Obligations d'État","Les obligations d'État sont des titres de dette émis par un État pour lever des fonds en vue de projets publics et de la croissance économique."
#,afgwerights,"Taliban Women’s Rights","The Taliban government's control on woman education, view in public, such as the barring of entry to parks, gyms, and other public areas, without a male guardian, and the harsh enforcement of said rules."
#,sofaz,"State Oil Fund of Azerbaijan","The State Oil Fund of Azerbaijan (SOFAZ) was established to manage oil revenues and invest in the country’s long-term development."
#,sharia,"Sharia Law","Sharia Law is broadly the conservative interpretation of Islamic law, such as systematic exclusion and control of women, moral policing via dedicated religious bodies, madrassas and propaganda enforcing institutions, amoung others."
#,burj,"Burj Al-Khalifa","The Burj Khalifa is not just the tallest building in the world—it's a towering symbol of national ambition, technological prowess, and economic aspiration. Constructing or maintaining such a megastructure represents a massive investment in prestige infrastructure, tourism, and high-end urban development. While the costs—financial, environmental, and logistical—are considerable, the benefits to global reputation, immigration appeal, and high-skill job creation can be transformative."
#,afg_opium,"Opium Production","Opium and other drugs like cannabis have long been a source of income in Afghanistan, from small individually owned poppy fields to state funded farms and logistical lines."
#,arg_retentions,"Agricultural Exports Tax","The Argentine state relies heavily on taxing agricultural exports (like soy, wheat, corn) to fund the government and keep domestic food prices low. This creates an Argentine political loop: The government needs the money to avoid default, but increasing this tax causes massive strikes ("Tractorazos") in the countryside and stifles foreign investments."
#,bra_amazon,"Amazon Sovereignty","Amazon Sovereignty represents the tension between using the Amazon rainforest for economic expansion (like mining, logging, cattle) versus preserving it for international approval and climate health."
#,new_capital_city,"New Administrative Capital","Building a capital needs a large investment, both monetary and political, but once complete, the new capital will bring in cash in the form of tax and other benefits."
#,canal_project,"Strategic Shipping Canal","A massive terraforming project to create a new trade route through your country (similar to the Panama, Suez, or the proposed Kra Isthmus canals). It destroys local ecosystems and angers farmers whose land is seized, but once finished, it generates massive transit fees and creates a trade boom."
#,artificial_island_resort,"Artificial Island Resort","A massive reclaiming project (similar to the Palm Jumeirah in Dubai) to create luxury hotels, beaches, and high-end real estate. It creates a massive Tourism and GDP boom but is ecologically devastating and increases inequality (as it caters exclusively to the super-rich)."